subreddit,selftext,title,author_fullname,upvote_ratio,ups,created,created_utc,num_comments,author,id
Cooking,"My family where shucking some peas and we had a huge pile of pea pod left over, I was initially going to compost them but then it occurred to me they that may be edible. One google search later I find out you can make a paste with them, or you can even keep them in the pod to make soup with them! 

A few weeks ago I didn't want to throw away bread crusts and I found a recipe for Cinnamon Sugar Treats made with Buttered Breadcrusts! 

What are some other leftovers which may be turned into something delicious instead of throwing away?","What are some of your ""leftover"" ingredients that other people throw away but you use?",t2_zr0vj,0.96,3602,1714936948.0,1714936948.0,1569,DAGuardian,1ckz3ed
Cooking,"Just a holiday reminder to everyone cooking for groups this holiday season, alcohol doesn't fully evaporate out of dishes.

Various sources quote different numbers, but dishes with alcohol ingredients can retain 5% to 75% of the original alcohol content.

Long term simmering (above the boiling point of alcohol) with stirring removes the most, but still leaves trace amounts. 


One of many articles about it:
https://www.isu.edu/news/2019-fall/no-worries-the-alcohol-burns-off-during-cookingbut-does-it-really.html","Holiday Reminder: Alcohol doesn't always ""cook off""",t2_evb8o,0.86,3480,1734820760.0,1734820760.0,638,Boating_Enthusiast,1hjl26h
Cooking,"I've gotten in the habit of buying Rao's pasta sauces in the last few years, and when I saw that fancy-pants NYC red-sauce restaurant Carbone had a supermarket brand, I thought, I should try this. Then, when we had guests coming over, I thought, we should do a taste test.  

I cooked a big batch of rigatoni in salted water, drained it and divided it into five pots, and tossed each over a warm burner with about 3/4 cup warmed sauce and about 2 Tb pasta water for about 3 minutes. Not precise, not identical pots, but not terrible. My wife and our guest did not know what was what, but I did.

The contestants were:

1. Rao's marinara
2. Carbone's marinara
3. [Cook's Illustrated homemade marinara](https://www.americastestkitchen.com/recipes/2895-marinara-sauce) made with Cento San Marzano whole tomatoes
4. [Marcella Hazan's onion and butter marinara](https://www.foodandwine.com/recipes/tomato-sauce-onion-and-butter) made with Cento petite diced tomatoes 
5. Our guest's homemade sauce (didn't ask any questions) 

Long story short, my wife and I both picked Marcella Hazan's sauce hands-down. My guest picked Cook's Illustrated marinara, which is significantly more effort to cook. I thought Carbone was distinctly better than Rao's, which I thought was too sweet.  My wife and guest were indifferent between the two.

I can think of a half-dozen ways I could have made this test more rigorous with a little more prep time and/or a commercial kitchen, but as is, it seemed good enough for a Reddit post.",I blind taste-tested Rao's and Carbone's marinara against homemade marinara,t2_421yq,0.94,3351,1706545919.0,1706545919.0,660,CopRock,1adzffz
Cooking,"For me, it's peanut sauce. Like spicy satay sauce. My base recipe is from the rebar cookbook but I'm pretty experimental with it now. Even my Dutch MIL (there is heavy Indonesian culinary influence there) approves. What do you make better than store bought? (And where's your recipe?)

Also here's mine: https://gourmeh.wordpress.com/2012/02/26/peanut-sauce-with-ginger-lime-and-cilantro/",What will you never buy again now that you can make it?,t2_6nv30pvr,0.93,3295,1716939793.0,1716939793.0,3320,SnooStrawberries620,1d2y842
Cooking,"I swear the process of cooking bacon goes: raw, raw, raw, raw, raw, BURNED. Thanks a lot, bacon.","Why does cooking bacon take nine hours, and then four seconds?",t2_pvlxmgzz4,0.94,3214,1727813998.0,1727813998.0,523,NotNamedBort,1fty0k3
Cooking,"I like to think of myself as a good home cook. I also cater to large groups freqeutly as a side hustle.  For some reason though. Cooking was always something I just did and naturally learned through life an I always thought it was easy and common sense.  I thought most people could somewhat so what I do. However, for Thanksgiving I hurt my leg and needed some help cooking the meal this year. So I got a couple of  freands and family to help  as I guided them. they were middle aged people but  they didn't know how to do anything.  

Here are just some things that witntessed that drove me crazy these last 2 days: 

They were so dangerous and awkward with the knife and couldn't hardly rough chop onions or veggies .
They spent 15 minutes peeling the avacados by hand  like a orange instead of just quickly cutting it in half and scooping it out .
 They put the meat in a non preheated  pan when I told them to sear the meat .
Accidently dumping too much Seasoning. 
And overall just a lack of knowing when something is gonna stick to the bottom of a pot or just when something is about to burn. 


I could go on but you get the point . So yeah... this thanksgiving I am thankfull for the cooking skills and knowledge I have. 
",TIL that cooking is a real skill,t2_vflnq07b,0.93,3091,1732871559.0,1732871559.0,670,Motor_Connection8504,1h2hwmo
Cooking,"Title says it all, really.

(Sorry if this is the wrong place to post this, if it there is somewhere more appropriate then I hope somebody can please point me to it before this is locked or something).

What's happened to chicken in the UK?  I'd often marinade my chicken before, but it never felt as necessary as it does now.  It doesn't even seem to absorb flavour while cooking in the same way.

Even poached chicken, which usually turns out melt-in-your-mouth tender, comes out as rubbery these days.

I remember something in the news about possibly lifting the ban on chlorinated chicken, a few years back.  Did this happen without anybody noticing?  I can't find anything to suggest that online.

\[**EDIT**\] So I don't need to keep repeating myself, I have found this problem in chicken breasts from the following places (though I should point out that it seems to be random in the chicken I buy, like poultry roulette);

* Supermarkets (high and low end)
* Hospitality wholesalers
* Butchers
* Farm shops

\[**EDIT 2**\] So, I don't don't like to brag, but I'm not a bad cook.  I don't have 1 single recipe for cooking chicken fillets.  I didn't know that people did that; chicken is like the potato of meat and poultry, it's so easy to work with, and there's just so much you can do with it.

I mentioned poaching because, as I said, it has always been good for making the chicken especially tender. Several of my family have severe stomach issues and normally have problems eating meat in general; poaching is usually the most reliable exception.  (Until now).

But I've found this issue is occurring even when poaching, baking it, grilling, frying/stir-frying, slow cooking, and even in the air fryer.  Sure, I don't use a meat thermometer every time, and I know that I should, but if it's happening through so many different methods, with different heats, and for different cook times, then I think it's safe to say that the problem isn't the way that I'm cooking it.  Especially after so many years of not having this problem previously.",Why have chicken breast fillets become so chewy in the last couple of years?  It's reached the point where I have to marinade all of them in yogurt or buttermilk before I cook 'em!,t2_lgaws,0.91,3044,1723375725.0,1723375725.0,622,MardukBathory,1epilm9
Cooking,"I’ll start with a broad one - not using their senses and blindly following a recipe. 

Taste frequently & intentionally - and think - does it need salt? Acid? 

Smell your food - that garlic got fragrant quicker than you expected, drop the heat! 

Listen - you can hear when your onions are going from sautéed to crispy. 

Look at your food. Really look at it. Does it look done? Need a couple more minutes? You’re probably right. ",What do most average home cooks do wrong? ,t2_508eeinr,0.92,2837,1723417646.0,1723417646.0,1076,someanonymousoctopus,1epy9rw
Cooking,"I have never, and I mean never, seen a carrot sauté faster than an onion. No matter how thinly I slice them, carrots are taking longer. Yet, every single recipe I come across tells me to sauté onions for a few minutes, THEN add the carrots and whatever other vegetable.

Or, if they do happen to get it in the right order, they say to sauté the carrots for like, 3 minutes. No. Carrots take FOREVER to soften up.

This has been a rant on carrots. Thank you for listening.

Edit: Guys, I hear you on the cooking techniques. This wasn’t meant to be that serious. I guess my complaint is more so with the wording of recipes. Obviously, I’ve learned how to deal with this issue, but there are plenty of people who may not be so familiar with the issue and then are disappointed. When recipes saying to “cook the carrots for 5 mins until soft on medium heat,” people are going to expect the carrots to be soft after 5 mins. If it said “reduce heat and simmer until carrots are soft”—that’s more accurate.",Please stop telling me to sauté onions before carrots in recipes.,t2_qytz1,0.84,2818,1716141369.0,1716141369.0,445,lmg080293,1cvu43g
Cooking,"We lost a real one.  Dude took his nerd hobby of old-school milling flour, turned it into a successful company making a quality product, and when he turned 80, gave said company to its workers. May we all live so long and leave behind so benign a legacy.

https://pdx.eater.com/2024/2/12/24070041/bob-moore-bobs-red-mill-death-obituary",RIP to Bob Moore of Bob's Red Mill,t2_81mqxj7r,0.98,2785,1707762683.0,1707762683.0,85,Andrew-Winson,1ap72tl
Cooking,"I'm talking about what happened to Ox Tail, or flank steak, or even tacos. Something that was, or is considered cheap foods, that are heading in the direction of being to expensive for the average person to enjoy.","What are some cheap (read poor) people food that are destined to become ""rich people"" foods?",t2_3fkedivj,0.96,2727,1728266089.0,1728266089.0,1567,belac4862,1fxwr2d
Cooking,For me it’s that cracking an egg in the counter is better than doing it on an edge. It just never works for me and cracking on an edge is easy to do without getting bits of shell in.,Are there any widely accepted cooking tips that you just disagree with?,t2_ugslvtuj,0.91,2562,1707050027.0,1707050027.0,2914,Important_Maximum_78,1aimx1f
Cooking,For me it's Brussel sprout. Boiled Brussel sprouts with salt and pepper tastes like feet but roasted Brussel sprouts with some cheese and a nice vinaigrette is AMAZING!,What's a food you hated growing up but love now?,t2_pnasyv7n,0.93,2454,1715531800.0,1715531800.0,2026,NYR_LFC,1cqbx87
Cooking,"Whoever villainized microwaving things is an AH. I can microwave a potato and have mashed potatoes in like 5 minutes. Thats insane. 

If I undercook pasta/rice - throw it in the microwave for 3 minutes and it’s perfect. 

Microwaves have been stigmatized in such a frustrating way because they’re so useful, but we’re told that microwaved food is lesser somehow. But I’m here to say it’s not, and we should use them more. ",Microwave your potatoes,t2_o871fqxo,0.93,2454,1736715300.0,1736715300.0,588,YoungOaks,1hzwpbe
Cooking,"I’m Turkish, and for me, it’s pasta with tomato paste. At the end of the month, when money was tight, my mum would always make this simple yet delicious dish. It’s just pasta with a sauce made from melted butter, sautéed tomato paste, dried mint, and some reserved pasta water. It’s incredibly tasty, filling, and takes only about five minutes to make. 

When I brought it up with friends, they had never heard of it, which got me curious about similar dishes from other cultures. So, what are the quick, affordable, and comforting dishes from your culture that you grew up with? ",What is a quick and cheap dinner from your culture that you had growing up that other people may not be familiar with?,t2_7892ox93,0.98,2393,1734649116.0,1734649116.0,1167,kjsnfuwreihfg,1hi5lzz
Cooking,"What's something you figured out that you've never read or seen anyone else do? 

Mine is that the cooking water from boiling collard greens or kale is weirdly delicious and makes an outstanding base broth for vegetarian or vegan soups. It's also great for adding depth and balance to meaty soups and stews. I save it and freeze it alongside my frozen chicken broth. 

Edit: guys, I'm not taking about potlikker from braised Southern collards which is thick and rich and has a lot more in it, like smoked meat,  onions, vinegar, chili pepper, etc. I'm talking about freezing the massive pot of plain salted water left from blanching greens. And using this flavored water as vegetarian/vegan soup stock. ",What's your 'one weird hack' for cooking that no one else seems to know about? ,t2_8cygjyf0,0.96,2294,1737234118.0,1737234118.0,2109,Raoena,1i4hb66
Cooking,"For me, I’m tired of the cooking videos that are overly aggressive. There’s no reason for you to be throwing pans and punching garlic. ",What cooking trends are you tired of?,t2_4ogyqnu,0.92,2237,1723236795.0,1723236795.0,2167,PreschoolBoole,1eoap4m
Cooking,"I was surprised to see oyakodon described by [Just One Cookbook](https://www.justonecookbook.com/oyakodon/#:%7E:text=It%20is%20a%20survival%20meal%20that%20will%20sustain%20them%20when%20they%20go%20off%20to%20college.) as a classic Japanese kid's first-meal-they-can-make-solo / college-survival-meal, because it strikes me as way adult-ier than what my parents taught me so I wouldn't starve at college, Chinese [tomato egg stir fry](https://thewoksoflife.com/stir-fried-tomato-and-egg/), and a completely different level from what I think is the American version: my kid can boil water so they can make instant ramen and mac and cheese. In my head, the big skill leap is raw meat handling and getting the meat doneness right.

That being said, it's a fantastic easy meal that also covers so many basic kitchen skills! If my kid could make oyakodon I would be so confident they wouldn't starve at college.

Does your culture have a stereotypical college meal? Do you have a better one in your personal repertoire?","What's your ""my kid won't starve in college"" meal?",t2_4g7qj,0.92,2222,1715618744.0,1715618744.0,670,treedamage,1cr3z6n
Cooking,"Example: If I use a pot simply to boil water, I will not wash it if I later plan to cook pasta in it. After pasta, I can't use it for hot water anymore, but if the timing's right, I'll use it for another serving of pasta, or even to make sauce. Since the pan just has starch and salt on it. *Then* I'll wash it. This is only when I'm alone; if the meal is for company, clean cookware only.

Is it just me, or ""common sense""?

edit: should clarify that the pot in question gets rinsed between uses.","Do we all reuse cookware without washing if it's not ""actually"" dirty?",t2_4z4uc,0.9,2183,1736281731.0,1736281731.0,615,poktanju,1hw1488
Cooking,"I can not for the life of me understand why putting whole fennel seeds, sometimes in large quantity, into Italian sausage is a thing. It totally ruins a perfectly good product for me. Why not grind it up if you want the flavor in the mix?

Anyone else?",Does anyone actually enjoy biting into a fennel seed when eating sausage?,t2_kqss6,0.89,2154,1726530283.0,1726530283.0,708,Original_Dood,1fijun4
Cooking,"Things like lobster and brisket used to be considered cheap foods for the poor, but after a while when people learned what to do with them became expensive. What’s something poor people eat now that you think will have a similar trajectory? 

Edit: y’all stop listing things that are already getting expensive 😭

(Definitely not just trying to find something good that’s cheap 😗)",What are some modern day poor people foods that you think will become gourmet (or at least widespread and popular) in 50 years?,t2_53c066fh,0.95,2116,1737491564.0,1737491564.0,2025,thunder-bug-,1i6shvv
Cooking,"I added heaped tablespoons of chilli powder, cinnamon and cumin to my chilli con carne, only later realising it should have been heaped teaspoons. I was a bit devastated but the food is completely edible and very tasty! Now I'm confused by the concept of spice measurements. What drawback am I missing here? Why didn't it taste terrible? 

Edit: wow thanks everyone, I think I'll be adding some notes to my recipe! 1 teaspoon of each of these spices does seem way too little for a huge pot of chilli!

Edit #2: so my chilli is 2 days old now and it is absolutely the best I've made. When I've made this recipe before, I didn't really view it as chilli, just a good ol' bowl of beans, meat and veg because it didn't really taste like chilli (I know...now I get why lol). I saw this as just a cheap, quick and easy dish that didnt require as much love as my usual chilli recipe.

I won't out the poor internationally famous chef who wrote this recipe. To his credit, the recipe is definitely made for a certain audience lol. I'm usually pretty loose with my measurements but I really did think adding that much more of spices would make a noticeably bad difference. Turns out.....I've seen the light.",I added tablespoons of spices instead of teaspoons. Why wasn't my food ruined?,t2_77a2fr6g,0.91,2096,1726139636.0,1726139636.0,1171,isabellarmh,1fezzhs
Cooking,"What was it, and what was the mystery ingredient that made you say ""not anymore""?

Was the cook offended?

This has happened to me so many times. I'd cooked up a pot of split pea soup once, for example, and when I wasn't looking my mom mashed up the little cubed potatoes in there because she preferred the texture smooth. She must have really preferred it smooth.

Or at a party, someone just dumped a whole jar of picked jalapenos, juice and all, into a pot of chili as a ""finishing touch"" that they obviously enjoyed, but it rendered the chili inedible as far as I was concerned.

Or just adding huge chunks of raw onion to macaroni and cheese once caused me to nope out. How bout you?

----  
  
EDIT: Things I have learned from this post that may improve your relationships as well as your meals:  
  
1.) Parents and in-laws would do well to stay away from the cooking of their adult children.  
2.) Adding sugar can really make things gross for other people, even if you like it that way.  
3.) Adding cinnamon to tomato sauces is not universally considered delicious. Use with care.  
4.) Do not add condiments, dried fruits or eggs to things unless you're sure people love it.  
5.) Chili recipes are as polarizing as cilantro.  
6.) Just because you view a substitution as ""healthier"" does not make it more edible.  
7.) Just because someone was willing to eat a dish as a kid, does not mean they are willing to eat it now.  
8.) Adding meat to things is not always welcome, even if you cannot imagine a meal without it.  
9.) Chunks of raw onion, garlic, or ginger can be a turn-off.  
10.) Orange juice and eggs are both breakfast foods, but it doesn't mean you can combine them to make an omelet.",Has anyone ever totally ruined a dish you were looking forward to eating by adding an ingredient that made no sense to you?,N/A,0.95,1984,1714442945.0,1714442945.0,2179,N/A,1cghdpy
Cooking,"
There was a time where every dessert was fruit in jello. People put weird things in jello. 

There was a time where everyone in Brooklyn was all about deep frying absolutely everything. 

What do you see happening now that won’t stand the test of time?

",What “modern food trend” do you see being laughed at in 2 decades? ,t2_9xxscqy6,0.93,1964,1726946411.0,1726946411.0,2648,Itchy-Picture-4282,1fmanmh
Cooking,"I live in an area of the world that is very rural and has no commercial meat. Great in some senses-- like directly supporting local businesses and lowered meat consumption-- but it also means all beef (and chicken, but that's another beast) I can buy here is extremely tough unless it undergoes an extensive process. Everyone where I live boils their meat, usually followed by frying, and then sometimes stewing. Most of the time I eat meat in a local restaurant, it's fairly tough unless it's something that's been stewed for a while. A lot of people here also like their meat that way; you grow up on it, I get it. But my jaw is weak and American. 

But TODAY I decided to 'velvet' my beef for the very first time after the typical tenderization I give it, and I succeeded in making extremely tender sliced beef. I've been so hesitant to touch beef for over a year because the process has intimidated me but that has now changed! Just \~20 minutes resting with about 1.5 teaspoons of baking soda mixed into a pound or so of beef, rinsed, followed by a quick fry-- and I have not had meat this easy to eat since moving here. 

Bless up!!!! Thanks, Chinese food techniques! ",I just used baking soda to tenderize beef for the first time... can't believe I didn't do this sooner,t2_e3ima9jd7,0.97,1958,1725295629.0,1725295629.0,188,cakingabroad,1f7bhtj
Cooking,"For me it's putting fresh dill in canned tuna sandwich. I'd never thought to do it before until I had a sandwich from a restaurant in NYC that had it.

It was so so so so good and now I always put dill in my tuna sandwiches!",What is a simple food combo you never thought to try but blew your mind when you did?,t2_n4rbb,0.96,1943,1716315441.0,1716315441.0,2202,SilverFilm26,1cxeom1
Cooking,"I’ve looked online and all recipes are a mix of stuff like dijon mustard, a vinegar, a nice olive oil, but I am never able to really come close to the awesome, pungent, strong taste that I experience in nice restaurants. 

What is your best trick to enhance your basic vinaigrette? Any twist in terms of technique? Any ingredient worth investing in that makes a big difference?

Thanks!!",Vinaigrette with green salad just tastes so much better in fine dining restaurants. What’s the trick?,t2_ulro5am8w,0.97,1915,1735564426.0,1735564426.0,642,oopsweredead,1hpmyjt
Cooking,"The other day, I asked a question about people leaving rice in a cooker all day because I don't have one and don't know how they work. Down-voted. Today, I said I like my rice slightly sticky. Down-voted. I see someone else say they cook rice in a pot. Down-voted. 

I get it: rice cookers are better. I only eat rice once every couple of weeks and I don't have the counter space for one. Some of y'all need to chill.

Edit: A lot of really solid answers in here. This is personally my first post in the sub. I had only ever commented on other posts and this was meant to state something I had noticed. I didn't know that food safety spam was such an issue around here, but that seems to be the major pain point. I'm going to delete this post tomorrow as the discussion probably doesn't add much to the sub as a whole.

Edit 2: Someone suggested asking mods to lock it. I'll message them and if not, I'll just delete it then.",Why is this sub so weird about rice?,t2_29d6lzxy,0.83,1917,1709658246.0,1709658246.0,551,Storrin,1b7ae6t
Cooking,"I always thought it was a useless, one function thing, and using 2 teaspoons was just as easy. Sooooo much faster, and they come out uniform. 

Any gadgets or appliances you poo-pooed for years that ended up being amazing?","I've been baking cookies for almost 50 years now, and used a cookie scoop for the first time today. Wish I could go back and tell my 12 year old self about how great an invention this is.",t2_y0y1u,0.98,1909,1726250648.0,1726250648.0,466,Debarooo,1fg197l
Cooking,"AMA

Edit: I meant stovetop

Edit edit: I was not high, I’m just also working so was a bit distracted.",I just sautéed my carrots for 40 minutes before I realized the oven wasn’t on,N/A,0.87,1901,1710335935.0,1710335935.0,343,N/A,1bdr90v
Cooking,"Ok so I used to HATE coriander as a kid. Couldn’t stand even in a leaf of it in a dish because it made the whole thing taste like soap. At some point in my teens I slowly grew to actually like that strange, soapy taste and how it complemented foods, and now I completely love coriander and can’t have too much! 

So I assumed I didn’t have that famous coriander gene which supposedly makes it taste particularly soapy or unpleasant. Until I just saw a TikTok of people describing the taste of coriander and people called it things like “citrusy”, “lemony” or “minty”???? 

This has completely blown my mind. I do not get that citrus note AT ALL from coriander - to me it’s like soapy, almost bug-like lol and very floral… Could it be possible I am experiencing a completely different herb to most other people but still somehow enjoying it in the same dishes???

 Would be SO interested to hear thoughts!!

Edit: In the UK we say “coriander” for the leaves/herb and “coriander seeds” for the seeds/spice. I’m talking about coriander the leafy herb here!",What does coriander (cilantro) taste like to people who don’t have the soapy taste gene?,t2_h42ims3r,0.93,1899,1715206368.0,1715206368.0,1695,OatyMcBoaty,1cnh0p6
