subreddit,selftext,title,author_fullname,upvote_ratio,ups,created,created_utc,num_comments,author,id
Cooking,"Unfortunately I have incurable brain cancer. I don't want sympathy or money or anything else, it would just be nice if my favorite recipes would last longer than I will. If any of the recipe collectors among you would like to download and or share the [offline browsable copy](https://www.bupkis.org/wp-content/uploads/bupkis.dotorg.zip), I'd appreciate it..  there's a link in the right sidebar. at  https://bupkis.org

No ads, no cookies no tracking, no nothing it's just my favorite recipe
** edit: there are cookies st
 these are spectacular**https://www.bupkis.org/index.php/recipes-2/dessert/chocolate-chunk-cookies
Sorry to bother you all. It seems like everybody has years and years and years left, right up until they don't.

**Edit**

It turns out that at the end of the road, the things that really mattered were good times with friends and family, And these were almost all in the kitchen. 

I've gotten to be relatively old, and finding out what I have certainly was not a happy thing, but given the number of my friends over the years that died with no notice from a heart attack or vehicle accident or whatever, this weirdly seems like a bit of a gift that I know what's coming and have *some* idea of a timeline. Although not a really good idea. 

Go home make yummy food and have your friends and family over. Actual happy memories are all that matters, money, power, status, everything else is mostly all nonsense.

**Edit**
This outpouring support and sympathy is more than I could ever have imagined! Thank you all I really appreciate it; However in the [immortal words of Monty Python ""I'm not dead yet""](https://www.youtube.com/watch?v=EfOW9QrLs0o) 8-)

Right now I only have major annoyances but no show stoppers. 

I plan to continue enjoying family and friends and cooking as much as I can, it's just harder and slower now because the surgery kind of wrecked my left side. On the other hand[terrible pun intended] I'm right handed,  so I can still do a lot of stuff, it just takes longer. 

**PS if any of you are cooking for anybody that has cancer and has no appetite, I can tell you from first-hand experience that [the banana bread](https://www.bupkis.org/index.php/recipes-2/favorites/banana-bread) goes down really easily and sits really well.**

The weird part about all this was that I initially found it and made it for someone else who had cancer about 25 years ago, And now we make it for me.

I also can't express enough gratitude that due to the efforts of friends I've never met all over the world the things that made me happy during my life will continue to make others happy for decades or maybe even hundreds of years in the future. The internet which is the very definition of ""not permanent stuff"" is now the eternal keeper of the things in life which mean the most to me which were food and friends and family.

Please note that I have read and appreciate each and every one of your replies. I have not answered them all because doing things online while missing large chunks of my brain is quite a bit more difficult than it used to be. But know that I read them all and you're all appreciated and I thank you all.

**This is a [downloadable browsable offline copy  of the entire website](https://www.bupkis.org/wp-content/uploads/bupkis.dotorg.zip). It will last forever. Certainly longer than me or my web hosting company.**

Just unzip somewhere including folders/directories, find ""index.html"" and double click it to browse offline

Terry Carmen",I have about a year+/- left. I made an offline browsable archive of my website which is a lifetime of my favorite recipes..,t2_2t1gfjhq,0.97,35343,1734032644.0,1734032644.0,1959,TerrysApplianceSvc,1hcth5f
Cooking,"Went into a store and the cheese display had a quarter wheel of parm. The label on the quarter wheel was clearly incorrect, saying that it was .42 pounds, and so was only $10.92. When I went over to the register to see if they would let me actually purchase it, it rung up as it showed on the label, and the cashier let me buy it! When I got home, it weighed 23 pounds! At $25.99/pound, that's $600 of cheese for only $11! I'm planning on giving a lot of it away to friends and family. I've cut it into ~1 lb chunks, vacuum sealed them, and split them between the fridge and freezer. What recipes should I make with my haul???

TLDR: Got an incredible deal on 23 lbs of parmesan cheese for only $11. What should I make?

Edit: photos https://imgur.com/a/23-lb-cheese-AEZcewy

Edit 2: To be clear, during the check out process the cashier was very aware that this was an absurd price for this large wheel of cheese, and had no qualms about ringing it up as it is. Also, if you look at the website for Murray's Cheese, you will notice that they are absolutely not a Mom & Pop shop, but have hundreds of locations across the USA.

Edit 3: To add some context, I actually arrived at the register without the cheese, and when the cashier asked ""anything else?"" I made a joke about ""not unless you'll actually sell me that quarter wheel of cheese for $11!"" She said ""bring it over!"" so I did, and when it rang up as $11 dollars and I was in shock, she made multiple jokes about it being 11 million dollars. As multiple people have stated in the comments, NY has a law that requires stores to sell their merchandise at the labeled price.

Edit 4: It is not an old banana, it is a plantain not yet ready for maduros",I bought a quarter wheel (23 pounds) of parmeggiano reggiano for $11 because it was mis-labeled as .42 lbs. What should I make with it?,t2_9hkcy,0.95,14433,1732501068.0,1732501068.0,1226,HuxleyPhD,1gz88wb
Cooking,"SOS: My burgers have gone from family favorite to something no one wants.

Two boys, 13 and 25, used to devour my burgers like they hadn't seen a meal in ages. Now? They're leaving sad, barely-touched meat discs on their plates. My boys have opinions, and they're brutal: 'weird,' 'too dry,' 'too oily,' 'too greasy,' and the soul-crushing 'it doesn't have any taste.'

To me, they've always been rather plain, but that seemingly was never a problem before. Something has changed, though I'm not sure what.

I'm using 80/20 ground beef, fresh as can be, from a decent grocery store in Massachusetts (Shaw's). My wife likes hers still mooing, but the boys want theirs perma-charred - no pink allowed.

Current recipe (use at your own risk): 7 oz of beef, manhandled into submission, flattened, and sacrificed to a medium-high skillet for 4 minutes per side. Cheese gets a 60-second cameo at the end. Brioche buns because I really do try to make my fam happy.

I've never had to season ground beef before, but maybe that's where I've gone wrong? Is there a secret burger society I'm not privy to? A bovine illuminati?

I could use some help. How do YOU make your burgers taste like actual food and not sad cow discs?

**EDIT: Wow, something like 80 comments in about 8 minutes. I'm doing it wrong. :)**  
**90+ minutes in, and now 500+ comments, I certainly hit a nerve with tasteless burgers. I'm really sorry and I won't do it again. Promise! :(**

**Smash Burger Success!**
Just finished dinner. There’s grease everywhere, I’m still cleaning up, I didn’t expect that much grease to come out on my griddle, and all over the kitchen floor - I usually have a grease catcher over my frying pan.

Regardless, everyone is happy! My wife gave it props too so all in all, excellent work everyone, you all made it happen! 

**TY Reddit!!**","My hamburgers have become so gross, that my boys won't even eat them. Could use some suggestions.",t2_7584c96t,0.86,12246,1721758951.0,1721758951.0,3504,jbezorg76,1eaf0qr
Cooking,"Not that my opinion matters, but I just appreciate that Chef John, Ethan Chlebowski, and Alex the French Cooking Guy never deviated from the objective of their work, which is to bring awesome ideas and recipes for normal folks to cook.

Some of my all-time favorite YouTube chefs have completely sold out and now rank the best sandwiches in the US, show 100 ways to cook a steak, and so on. I respect the aforementioned YouTubers staying the course and just sharing with us what they find cool and interesting.

That's all!",Respect to the YouTube Chefs who didn't sell out,t2_l8o5l,0.94,10039,1731551257.0,1731551257.0,2122,aema15,1gquja8
Cooking,"I let myself buy the fancy butter for my holiday baking this year, and now I can never go back. My butter ignorance has been shattered. I just spend a lot on butter now, I guess. ",PSA: Don’t buy the fancy butter,t2_3mw9xgxv,0.94,8649,1735064183.0,1735064183.0,978,guthriethecasita,1hlj8cf
Cooking,"I used to be happy, healthy, and social. I had a family, I had friends. Until that dark day when my wife asked me to spatchcock a chicken for a recipe. I had never heard of it before. 

As I ripped the backbone out of this flightless bird and smashed its pelvis into flat submission with my fist, I had no idea what this revelation would do to me.  

For I could never eat any other chicken again. I demanded that all chicken be as absurdly juicy and perfectly cooked as a spatchcocked bird. I accepted nothing less than the tender, perfectly mouthwatering meat of a dead, spineless, spatchcocked hen.  

I began refusing hens cooked with inferior processes. I interrogated waiters, then chose salmon when their answers failed to satisfy me. I ruined family dinners, get togethers with friends, and the office potluck. I simply could not eat chicken cooked by barbarians who failed to spatchcock it. A single bite from a piece of chicken that failed to impart the juicy, extravagant flavor of a spatchcocked bird would send me into an aggressive rant which often ended in tears.  

I write this, alone, from a basement apartment with the juices of a properly spatchcocked chicken rolling down my chin. I simply cannot - nay, will not - accept a boring existence outside of the spatchcock lifestyle. 

Heed my cautionary tale.",Spatchcocking has ruined my life ,N/A,0.93,7510,1713839045.0,1713839045.0,557,N/A,1catbii
Cooking,"Guess I should start out with how I got in the situation. I’m an executive member of a student organization at my college (don’t ask which) and one of my jobs is to feed the club at our events. I had a list of meals to cook planned in advance, so I wasn’t going in completely blind. The thing is, this year, our organization kind of ballooned in size. We have almost twice the amount of people we had last year. This meant that the more intricate meal that I had planned would definitely not work anymore. I only realized this on Thursday  night. What I ended up doing was frying 25 lbs of ground beef and slow cooking 6 chicken breasts to make tacos., with some salsa, sour cream, and shredded cheese for other fillings (not the healthiest, I know). And you know what? It worked. Really well. Everyone loved it, and there was plenty to go around. I even took home some leftovers. It didn’t even take that long. The person helping me and I both took only about 2 hours to cook it all. To the people leaving your (hundreds of) tips and suggestions, thank you for trying to help me. To the people saying stuff like “bro you’re done for🤓” “this’ll never work🤓” and ESPECIALLY “🤓🤓🤓just buy food from Costco🤓🤓🤓” unironically you spend less time on Reddit. This place has a deadly combination of 1. super pessimistic people who 2. think that they’re WAY smarter than they are and 3. are always trying to subvert expectations and give the “cleverest” answer. It’s genuinely doing a lot of damage to you, especially if you’re a teenager. The moral of the story? Have a little optimism every now and again, it’s good for you.",I’m the guy who had to cook for 100 people with only 1 day’s prep time. ,t2_5zeldw0x,0.91,6604,1725144144.0,1725144144.0,408,poopty_scoopwoop,1f5zlru
Cooking,"My mom always kept a heavy, canvas cloth around 12” X 18” in a plastic bag in the freezer (to prevent rancidity between washings [along with her pastry cloth]) for chopping nuts. You place it over your chopping board (or on the counter if your countertop isn’t precious, or your cloth is thick enough) when chopping nuts and it keeps the pieces from flying everywhere. As soon as I moved out to go to college, I got my own because I couldn’t live without it. I thought everyone had one in their freezer until I left home.

Edited to add per suggestion for clarity:  The canvas cloth is placed flat on the cutting board, the nuts placed on the cloth, and a Chef’s knife used in a rocking motion with the tip of the blade held down under the palm of your non-dominant hand so it doesn’t leave the surface. ",What kitchen hack was standard in your house growing up that you later learned isn’t common.,t2_avvva02g,0.94,6445,1706393140.0,1706393140.0,5349,ParticularSupport598,1acmbob
Cooking,"Hi everyone. I need advice on what to do with chicken breast. I’m not a fan of it you see, but always have them around after jointing a chicken and eating the parts I do like. I find they always end up dry when I fry them, or put them in a broth for example. 

Schnitzel/ cotolette is one good option I love but takes a load of prep and makes loads of washing up and isn’t that healthy! 

Any ideas welcome! Just need some inspiration and tips on how to keep it nice and succulent!! 

Thanks ",My breasts are dry and boring,t2_wxh04ugq8,0.88,6439,1736202295.0,1736202295.0,1691,Calm_ragazzo,1hvbrns
Cooking,"There was a thread about your favorite childhood poverty meals, and a ton of the things mentioned are no longer cheap.

I myself have noticed that I can’t “shop cheap” in the same way I did when I was younger, and what’s cheapest now are things you wouldn’t expect.

For example going vegetarian on all fresh veggies- if I skip dairy and meat my bill is 1/3 of what it would be otherwise, when fresh veggies used to be the luxury approach. 

Boxed cereal and milk is now no longer cheaper than eggs for the week’s breakfasts, the cheapest cuts of meat are no longer the “leftovers” (like chicken wings and ground beef.) Name brand preservative packaged food is the same price as “real” food.

So yea- what’s the new poverty food? What’s still as cheap as it ever was?",What’s the NEW poverty food?,t2_6j89h,0.94,6297,1710942941.0,1710942941.0,3406,WhatIsThisWhereAmI,1bje15t
Cooking,"How many dishes can really get someone to marry you. Also, this is not a good foundation for a lasting marriage!","I hate the trend of labeling every recipe as “marry me”. Marry me chicken, marry me pasta, marry me cheesecake.",t2_6woe8,0.9,6052,1708093743.0,1708093743.0,925,brw713,1as9wg1
Cooking,"Isn’t it crazy that like… pepper gets to hang with salt even though pepper is a spice? Like it’s salt and pepper ride or die. The essential seasoning duo. But salt is fuckin SALT—NaCl, preservative, nutrient, shit is elemental; whereas black pepper is no different really than the other spices in your cabinet. But there’s no other spice that gets nearly the same amount of play as pepper, and of course as a meat seasoning black pepper is critical. Why is that the case? Disclaimer: I’m American and I don’t actually know if pepper is quite as ubiquitous globally but I get the impression it’s pretty fucking special. ",Why is black pepper so legit?,t2_3nly40ii,0.92,5838,1708318054.0,1708318054.0,672,considertheoctopus,1aueujl
Cooking,"I’m tired of packs of bacon or sausage being sold in 12 oz. portions instead of 16. I’m tired of cans vegetables being some random amount like 10.5 oz. Why would a pack of hot dogs have an odd number like 5. 

End of rant.",Shrinkflation is driving me insane when I cook,t2_9lb6l,0.95,5653,1727048460.0,1727048460.0,769,stu-pac,1fn6zeq
Cooking,"Over means the egg is flipped and not sunny side up. “Easy” has a fully runny yolk, “medium” has a half solidified yolk, and “hard” is a fully solid yolk. In all three cases the whites are fully cooked. Lately I’ve seen people online saying over easy has runny whites as well, and now this weekend I went to a diner with that printed on their menu too! 

It is 100% possible and not difficult to have fully cooked whites with a fully runny yolk. Don’t change the rules because you can’t play the game.",People are trying to change what qualifies as “over easy” and we should not stand for it,t2_6nqa14i2,0.95,5477,1716728952.0,1716728952.0,915,phonemannn,1d110k4
Cooking,I’m looking at you www.joythebaker.com I just wanted to find an easy overnight bread recipie. The recipie seemed fine but navigating around all of the pops was miserable. Like my screen would jump and then I could t find what I was looking for. They all suck. How is this the standard. It’s not just this site but pretty much every site.,Great big shout out to all the terrible unusable recipe websites.,t2_8g73d,0.96,4976,1732895069.0,1732895069.0,651,skuterkomputer,1h2okew
Cooking,"For the people here who AREN’T good at the whole food-making thing but want to take BABY STEPS to get better.

I’m talking microwave.
I’m talking little to no dishes to clean afterwards.
I’m talking thrown together, pantry-to-plate

None of this “only 10 minutes” business: 2 minutes of active effort or less or you’re disqualified.

If I catch even a hint of flexing. Disqualified 

If you so much as *think* the word sauté… Disqualified.

If you mention **fresh** garlic or **sliced** lemon or something like that…  you’d better have a damn good argument or secret technique that makes them easier to add.

Or you’re disqualified. 

(Toasters and toaster ovens are allowed as long as you don’t have to clean them)",Tell me about your REAL low-effort meals ,t2_hgb5x,0.91,4950,1722629533.0,1722629533.0,4181,Bacon8er8,1eijyle
Cooking,"I refuse to allow margarine in my home. I dislike the way it tastes and I don't like the results of anything it's added into. I will eat it if I am at someone else's home to not be rude, but for me, I refuse to buy it. 

Edit: I use the word banned loosely. Don't take the term here literally please.  I personally won't buy it, but if someone wanted me to cook with it, I would. ",What ingredient is banned from your kitchen?,t2_itgb1rze,0.89,4715,1710515897.0,1710515897.0,5906,Sweaty_Entertainer78,1bfgedo
Cooking,"The last year pretty much all of the big channels in cooking on YouTube have seen a massive decline in quality content or content in general. 

Joshua Weissman, Alex the cooking guy, Adam Ragusea, Babish, Ethan Chlebowski, Sam the Cooking Guy, Pro Home Cooking, ...

Anyone got any good channels that still are good and fun?",What happened to all the big YouTube cooking channels?,t2_dvs0z,0.93,4671,1721209103.0,1721209103.0,2929,therapy420,1e5e1px
Cooking,"I'm talking about something that's considered conventional wisdom and generally accepted by all, but it just doesn't make sense to you.

For me, it's saving cheese rinds and adding them to soup.  I think the benefits to flavor and body are minimal, and then I've got to go fishing around for a soggy, sticky rind at the bottom of my pot. No thanks.",What's a cooking practice you don't believe in?,t2_5atx7oax,0.92,4606,1723690399.0,1723690399.0,7567,poordicksalmanac,1eskhth
Cooking,"mine:

pickles ruin food for me. to me, they’re just crunchy vinegar and i can’t even stand the smell of them, let alone taste. they ruin burgers and sandwiches for me, because it makes everything else taste like pickle. if i order something that has pickles i have to order it with no pickles. i can’t even just take them off myself, which i do with other food i don’t like that come on my orders. i’ll still get the essence of pickle on my taste buds.

every time i tell someone this, they get borderline personally offended. 

i will also refuse to cook anything that includes ketchup in the recipe. i can use ketchup as a dip for many things. but as soon as its listed as an ingredient? can’t stand it. but that one is far less controversial 

so what are your unpopular food opinions, that will actually offend people? ",Your ACTUAL unpopular food opinion?,t2_3owddps,0.87,4606,1713072104.0,1713072104.0,7728,deathbykoolaidman,1c3lttr
Cooking,"My submission is avocado. Sure, sometimes it tastes like I’m eating a healthy green thing but sometimes it tastes like I’m just eating straight up butter.",What are healthy foods that taste like they have no right being healthy?,t2_k132etd,0.93,4255,1718334943.0,1718334943.0,2228,klimekam,1dfh700
Cooking,,What major cooking trend of the last 10 years has almost completely disappeared again?,t2_fc60zn4t,0.93,4149,1707589318.0,1707589318.0,4459,waitWhoAm1,1anmoug
Cooking,"I’m Cuban American, my grandparents came here from Cuba in the 60s (for obvious reasons). One thing I feel grateful for was getting authentic Cuban cooking from my grandmother for so many years - she never measured anything, she just knew how to make it all taste right. Even the best Cuban restaurants never came close to her food. 

One thing I remember is that her white rice was always so good. Good enough to eat a bowl of it on its own. It just had so much flavor, and white rice is a daily staple dish for almost all Cuban dishes. 

Now I’ve tried so hard to replicate her white rice. I’ve looked up recipes for Cuban white rice, but nothing was ever the same. 

I finally asked my mom, how the hell did grandma get her white rice so good? 

The answer: lard. My grandma would throw a huge glob of lard and some salt into the rice. Lol. 

I’ve always put olive oil in the rice but it’s not the same. So instead I put a huge pat of butter in it, and wow. It’s close, not the same, but really close. 

When I say huge, I mean like 2 TBSP. I normally only put 1/2 TSBSP of olive oil. 

The olive oil is fine, but the butter is just delightful. 

ETA: this post really popped off! Thanks for the suggestions, I will be trying some new things! 

“Why don’t you use lard?” I want to, and will! But it’ll be just for myself, as my husband is kosher. So, that’s why I didn’t go out and buy lard to try first as I can’t use it in my regular cooking. More than likely I’ll find some shmaltz, at the suggestion of so many people here, and use that going forward! Seems like a win-win for both he and I. 

Love the different flavor ideas people are giving, thank you! ",Add a bunch of fat to your white rice,N/A,0.89,4110,1707240832.0,1707240832.0,1133,N/A,1akfcw2
Cooking,"In the last 10 years, the ones that really stick out to me are: spinach and artichoke dip (suddenly started appearing everywhere as an appetizer, even higher end restaurants), ube flavors, truffle, avocados on everything, bacon on everything, and now hot honey is a big fad. Is there anything upcoming you see heading towards the food trend?","What do you think the next ""food trend"" will be?",t2_8375t,0.9,4015,1714394221.0,1714394221.0,3725,tonithepony,1cfy23f
Cooking,"I just baked peanut butter cookies to get rid of a jar of natural peanut butter. I will be replacing it with a jar of Skippy. I will never buy natural ever again. I don't care what anyone says, processed peanut butter is superior for sandwiches/toast and is fine for cooking. ","What ""fake"" (i.e. processed) ingredient do you insist on?",t2_hoit2,0.89,3995,1721015150.0,1721015150.0,2523,unicorntrees,1e3l88i
Cooking,"Not only did you have to go out and buy a specialized piece of single-use equipment to make them, but they always tasted horrible, with a worse texture, and were NOTHING like the “noodles” they were supposed to be a healthy replacement for.

What other garbage food trends would compete?",Zoodles were the absolute worst cooking trend ever,t2_3n9qv,0.87,3851,1712442429.0,1712442429.0,990,DRoyLenz,1bxo4o1
Cooking,"I live in dallas texas and I hear people all the time talk about their ""local butcher"" like we live in some medieval fairy tale land where there are blacksmiths and butcher shops around every corner that you can get cheap bones and stuff from. Every ""local butcher"" shop I've been in was madly expensive so I usually just get meat from aldi because I'm poor. Am I missing something or do I need to move to some random European town in the country for the local butcher experience. ",What do people mean by just go to your local butcher for bones and such for stocks.,t2_x0asmgd34,0.87,3786,1724631130.0,1724631130.0,886,Lopsided-Election385,1f1aw97
Cooking,"I kept reading in this sub that paprika is not just for show, which is what it always was for me. I had been using a bottle of 8 year old McCormick paprika. Well I finally bit the bullet and dumped the rest of it in one final batch of tomato sauce. Then I went to the bougie spice store that opened down the street and bought Spanish Sweet Paprika and Hungarian Smoked Paprika ($7 for 2oz!!!). 

My oh my, could I suddenly taste paprika. I just tossed a little bit in a sriracha mayo and it was insane. Consider this my thank you to you all. 

What spice should I replace next from my ancient collection that will make a big impact?",Confirmed that paprika is not just red decorative sprinkles,t2_2x2b536z,0.97,3698,1730565661.0,1730565661.0,464,colonel_chanders,1gi0kn4
