subreddit,selftext,title,author_fullname,upvote_ratio,ups,created,created_utc,num_comments,author,id
Cooking,I can think of brick ovens for pizza and the pressure cooker deep fryer for fried chicken.,What are some things that can't be cooked as good as a restaurant simply due to it being unreasonable to have certain equipment at home?,t2_t6y7f,0.96,1528,1713976955.0,1713976955.0,1572,JarJarAwakens,1cc2z5v
Cooking,"I heard about this in a video made by a jamaican food conosieur. He was travelling to different authentic jerk spots and a chef talked about how the felling of pimento trees has been banned. The jerk chefs now use wood like sweet wood. 

You read often online about how jerk chicken is only authentic when cooked over soaked pimento wood. But even in Jamaica they no longer do this, unless they were lucky enough to have had their own trees but that doesn't seem to be common

This also shows how home cooks should adapt to what is locally available vs trying to hard and spending too much on buying ""authentic"" ingredients. We should adapt to suit our own pallets and the local ingredients

Evidence: https://youtu.be/PVxprj4YSAM?si=N22VxCMVk9XDhfLd

Mark Weins at a Jerk spot explaining the cooking process and at 12:05, taking about how jerk chefs now use sweet wood",The chopping down of pimento/allspice trees has been banned in Jamaica. The jerk chicken chefs now use other woods like sweet wood,t2_lzhvgqn2,0.96,1517,1711274940.0,1711274940.0,120,tipdrill541,1bmhd4k
Cooking,"When I mean no gimmicks, that would mean someone like Joshua Weisman (he ranked all the chicken sandwiches from popular restaurants) or Guga Foods (who dry ages steaks in some odd ingredients).

Two examples I have for mostly cooking, less gimmicks, are:

* [Pailin's Kitchen](https://www.youtube.com/@PailinsKitchen) \- my favorite Thai cooking channel
* Chef John's [Food Wishes](https://www.youtube.com/@foodwishes) \- his voice and recipes are like ASMR

Who else would you add to this list?

EDIT: thanks all! I'll be going through this list and giving as many of them a shot as I can.

EDIT 2: fixed some grammar.

Edit 3: shoutout to /u/[thirdmanonthemoon](https://www.reddit.com/user/thirdmanonthemoon/) for creating [cliprecipe.com](https://cliprecipe.com/) that extracts recipes from various social media pages.","What are your favorite Youtube channels that focus just on the cooking, no gimmicks?",t2_b532p,0.96,1683,1737759168.0,1737759168.0,987,TravellingBeard,1i98g61
Cooking,"Obviously everyone lies about onion timings. But what other egregious errors have you encountered? Bad conversions, stupid instructions, ingredients that never reappear, etc. My favourite two are:

**Rubix-cube pumpkin**
Jamie Oliver's recipe for Moroccan tagine said to cut the pumpkin into THREE-INCH CUBES. Yeah, I'm just tucking into this stew with rubix-cube sized veg, mate. Thankfully no pumpkin permits that size. And I knew better. Unlike...

**The Bread Balls**
The first time I made meatballs, I followed a Guardian article I saved which said 300g of breadcrumbs. It looked like a lot, but what did I know? I'd never made meatballs before! The dessicated zombie-head things I had wrought sucked in every drop of moisture from the sauce and were still dry as Saharan sand. I returned to the original recipe, and... ""minor correction"", 30g breadcrumbs. The comments were full of a similarly fooled tribe. A desert tribe, if you will. ",For Fun: what's the worst recipe instruction you've encountered? ,t2_8dqanrno,0.98,1486,1737061900.0,1737061900.0,875,angels-and-insects,1i2zhny
Cooking,"I am not trolling, I promise.

I am german, and Sauerkraut here is a hot side dish. You literally heat it up and use it as a side veggie, so to say. there are even traditional recipes, where the meat is ""cooked"" in the Sauerkraut (Kassler). Heating it up literally makes it taste much better (I personally would go so far and say that heating it up makes it eatable).

Yet, when I see americans on the internet do things with Sauerkraut, they always serve it cold and maybe even use it more as a condiment than as a side dish (like of hot dogs for some weird reason?)

Why is that?",Why do americans eat Sauerkraut cold?,t2_6ggmbcow,0.82,1465,1730042746.0,1730042746.0,1748,AgarwaenCran,1gddg5g
Cooking,i,How do Chinese Restaurants make their egg fried rice so damn moist??? I feel like mine is so dry everytime I make it?,t2_ee7csi9o,0.96,1439,1731284809.0,1731284809.0,394,MineKirin,1gofdgh
Cooking,"Mine has to be egg salad (no specific recipe). Every time I make it I go “huh, this is cheap, not terrible for me, and I love it.”
","What is your easiest, cheapest, AND most nutritious meal that you “forget” about?",t2_4rfxr0ym,0.95,1421,1716081215.0,1716081215.0,887,plzadyse,1cvcez1
Cooking,"I used to eat it a lot as a kid, teenager and even young adult. It was always very good imo. 

Now I’m 32 and purchased some after many many years of just not eating it for whatever reason and my god what is in this? It isn’t just that it’s not the taste I remember, it’s absolutely disgusting! I thought there was something wrong with it.

It’s like some generic box Mac and cheese. Kraft box tastes fine, noodles and cheese but certain generic kinds… not only do they not taste like cheese, they don’t even taste like food, the difference is night and day. Thats what this modern hamburger helper reminds me of.


Edit: I originally bought 3 boxes because it was a deal. I made another the other night and this time added extra butter, salt, my own seasonings, and a SHITLOAD of real cheese. It wasn’t as bad but it STILL wasn’t good. No matter what I did I couldn’t drown out that nasty plastic dogfood taste it naturally came with. I’ll be throwing the 3rd box away.",What in the heck has happened to hamburger helper?,t2_jlkt8qi9,0.92,1419,1730149277.0,1730149277.0,999,Mr_NotParticipating,1ged377
Cooking,"yk, it's always 'salt and pepper', the age old standard, default, 'go-to' all purpose seasoning for pretty much anything and everything. at a restaurant you get S&P shakers, practically every savoury recipe, from most cuisines has S&P as part of the seasoning, regardless of the other ingredients and flavours of the dish, when you refer to something being mildly seasoned or using 'basic' seasoning, the 'basic' usually alludes to salt and pepper. i get why salt would be there, since it is essential to enhance and bring out the other flavours of the food, but 'neutral' in the way that salt doesn't really have its own distinct flavour. but why black pepper? when and why and how did 'S&P' become a thing? to clarify, i have no issue with black pepper, i think it's a great spice that enhances the flavour of so many dishes, but i don't think it necessarily goes well with Everything, sometimes it's just unnecessary and sometimes it can definitely be very noticeable and not in a good way, or sometimes a bit too much of it really overpowers the other spices. no other spice other than black pepper is considered a 'standard' default spice ubiquitously across so many different cuisines around the world. take any other spice for instance, like cumin, paprika, cinnamon, none of those are a 'it goes without saying to chuck it into every dish whether it works or not' you wouldn't use them in any and every dish as they have a distinct flavour which impacts the overall taste of the dish. in the same way, so does pepper, so then why, what makes it so special? ",what makes black pepper the default all purpose seasoning along with salt?,t2_k7tnzxpl,0.93,1409,1736523598.0,1736523598.0,491,ruinsofsilver,1hy7661
Cooking,"Last night i made this https://nomnompaleo.com/post/150016559668/cantonese-crispy-chicken-thighs 


And some roasted kohlrabi with brown rice on the side. I scooped up a little of the left over brothy stuff + vegetables from the pan and put it on the rice (not sure if this still counts as drippings cause of the broth). Everyone loved it but my mom got mad after I explained how i made it taste good. She even told me i have to use no skin no bones chicken next time. (Not to be rude or ungrateful, but her chicken is always incredibly dry). Does anyone know the nutritional value of the stuff on the bottom aswell as the skin? My mom is overweight and likes to be stingy with me when i cook, but her alternative is processed packaged food and deli meat, so how does this meal compare to that? 

 ",Parents yelled at me for putting drippings(?) on rice withe the dinner i cooked for them,t2_7mxcqhdy,0.91,1380,1721909203.0,1721909203.0,416,Apprehensive-Win-200,1ebt7or
Cooking,"Thank you. I had no idea Penzey’s existed until a week or so ago. My spice cabinet will never be the same. I tried Sunny Paris on eggs this morning and it was fantastic. I ordered sample packs of several different brands as well as some Vietnamese cinnamon, hot cocoa mix, and seasoned salt and cannot wait to try them all out ",To the Person Who Posted About Penzey’s Recently… ,t2_eurggsb1,0.94,1381,1728139601.0,1728139601.0,286,KrizJack,1fws0qf
Cooking,"This stuff is like crack. Just got a tin of Za'atar to try and decided to make a sort of pizza with it and holy moly is it good. Where has this been all my life? I need to put this on homemade fries next.  You have to let the seasoning bloom in olive oil and then apply it to your bread.  Its basically like a combination of thyme, sesame seeds, sumac, salt, coriander, cumin, and parsley. The sumac makes it tangy! ",Za'atar should be banned ,t2_puah5yp1c,0.88,1369,1708904480.0,1708904480.0,303,grilledcheesybreezy,1b02soa
Cooking,"Mine is heavy cream and sugar cubes. My mom would never buy them when I was a child because the cream was 'unhealthy' and the sugar cubes were 'too expensive'. Now I keep the cream for that extra dash to add to buttered noodles, or pesto, or soups... and the sugar cubes are just so convenient! I can't get my coffee 'just right' with the sugar bowl, I need 3 sugar cubes, dagnabbit! ",What's your pantry 'luxury' item that you keep on hand because you couldn't have it as a kid? ,t2_1bp5cps2,0.95,1372,1711373840.0,1711373840.0,1154,perkyblondechick,1bnduub
Cooking,"**Once** 

Using sesame oil as a cooking oil


Adding corn starch to hot liquids


Adding boiling water to protein powder


Water + hot oil


Forgetting a utensil in the blender


Not cooking down alcohol enough


**All the fucking time**


Forgetting a pan to catch drippings in the oven


Grabbing lid/pan that just came out of the oven with bare hands


Using too small a bowl to prep


Rubbing eyes after handling peppers


Using higher heat than I should because I'm in a hurry, dammit, won't you cook faster? And being dissatisfied with the results (obviously)


Turning the broiler on, not setting a timer (it's just going in there for a sec, why would I need a timer?), fucking off to do the dishes or something, coming back to food a tad darker than I planned",Kitchen mistakes you made once and mistakes you make again and again,t2_sjtt41581,0.97,1365,1722802410.0,1722802410.0,624,running462024,1ek4ojk
