subreddit,selftext,title,author_fullname,upvote_ratio,ups,created,created_utc,num_comments,author,id
Cooking,"My grandma is a decent cook don’t get me wrong. But I noticed since she started cooking all of our meals, I’ve had food poisoning 4 times this year. I started paying more attention to she will soak meat in milk which is normal sure. But what she does is she puts meat in a container with milk and leaves it out on the counter all day. Sometimes up to two days! She thaws meat like this too. Just leaves it on the counter all day. Not even in water sometimes just on the counter. She said “it cooks evenly at room temp”. She also uses left overs from like weeks ago. She cooked a meal that was pretty good but made me sick. And I found out she used left overs to cook it. Left overs from over two weeks ago! And she NEVER gets sick. Has she just been doing this so long her stomach has turned to stone?! ",My grandma never refrigerates anything she is going to cook. ,t2_up6mnfjz,0.96,1877,1730942039.0,1730942039.0,475,Acceptable-Scheme421,1glenym
Cooking,I genuinely want to know. Some guy posted about his 25lb of eggplants and another guy about his 10 lbs of seal meat. Can you even eat seals? Please tell me about how you're landing yourself in these comical situations,how are you guys obtaining math problem amounts of food,t2_42ndmeni,0.94,1877,1724818943.0,1724818943.0,635,OhNoHung,1f31cl4
Cooking,"First, they substituted Easter lamb for ham, and I said nothing.

Then, they came for Christmas goose, and I did not object. 

Now, they are coming for the Thanksgiving turkey, and it is too late. 

Ham has become the one and only celebration meat for my extended family, and it has made the holidays just that little bit worse. To anyone else feeling the pork lobby's impact, I sit in solidarity with you. ",Ham for every holiday makes me more annoyed that is probably reasonable.,t2_5plpuyzo,0.92,1876,1731801699.0,1731801699.0,456,Agitated_Twist,1gt0oja
Cooking,"Just pop the potatos in the oven for 1 hour at 200c/390f. Cut them in half and scoop them out. Whisk with hot milk and more butter than your diet would approve. A bit of salt. The flavor of baked potatos really shone. The scooping out part was a bit laborious, but is manageable if you have reasonably big ones. Don't do this with tiny spuds unless you have a lot of time.",I just made a mashed potatos using baked potatos and it was the best i ever had.,t2_5offi,0.97,1846,1728387837.0,1728387837.0,320,ilrasso,1fyxquy
Cooking,"For me, soy sauce and maple syrup

Edit: Okay, I am seeing a lot of people say peanut butter. Can someone clarify? Is peanut butter supposed to be in the fridge? Or did you keep it in the fridge but didn’t need to be?",What food item was never refrigerated when you were growing up and you later found out should have been?,t2_6p6gh0dr,0.94,1829,1715653685.0,1715653685.0,2709,spicysaltysparty,1crheny
Cooking,"Causal AMAs are not vetted, so take claims with a grain of salt. But nevertheless this thread by a personal chef to a billionaire was kind of interesting including how to make this gourmet BLT 

---------------------------------------------------------------------------------

https://www.reddit.com/r/casualiama/comments/1alzkuq/i_am_a_personal_chef_to_a_billionaire_ama/kpinvzu/


BLT. If you read a lot of my responses you will see I bring it up a lot because it is my absolute favorite meal all things considered, primarily the simplicity of it and how everybody could make it.

You want a fresh bread that is thicker cut, if you don't want to Make your own bread that is totally fine, you can get something like the Sara Lee artisan white bread.

Tomatoes have to be in season, that's non-negotiable. You want to cut them fairly thick and then immediately dry them by setting them on paper towels and then flipping them to absorb the extra moisture. Next salt them and put them in a single layer in a colander. The salt will absorb into the tomatoes removing extra moisture but also tenderizing them even further. You want to wait until the last moment to put them on your sandwich to give them as much time as possible to be tenderized. You can also add black pepper to them or an Italian seasoning shortly before serving.

The lettuce has to be romaine or a traditional green leaf lettuce, absolutely no iceberg.

The bacon is better if you go to a butcher and have it extra thick cut, but otherwise you want to go for the thickest cut the grocery store will sell which will usually be in the shape of a slab, not where it's been cut and layered in a thin package so you can see each individual slice. This will look like a single slab of bacon with no visible cuts. Cook this low and slow. 280° for whatever time it normally takes, remembering that it will harden when it cools so you want it to be a little soft since you want it to be just at the edge of crispy when cooled.

The mayonnaise is better if you make it yourself of course, but really you just want to avoid a mayo that uses soybean oil. Sunflower oil is the best, so sir Kensington mayonnaise is by far your best option.

Toast the bread lightly, put the mayonnaise on a fairly thick layer on the top and a thin layer on the bottom, then use a fresh black pepper. Get yourself a good grinder and black Tellicherry peppercorns. Then a nice light coating of sea salt.

Bacon should be applied first with the tomatoes on top then the lettuce.

This will produce a BLT that will be so good it will ruin every other BLT You will ever find at a restaurant. I'm not even joking or trying to exaggerate here, every person I've ever made these for that gets used to them eventually complains about how every BLT the order is terrible in comparison. My husband used to order BLTs all the time at restaurants for lunch, now he never does because he's always disappointed. It's especially disappointing because of how simple it is to make a BLT this good. Doesn't require any real skill and everything you need can be purchased from a local grocery store other than the peppercorns which you can buy a 1 lb bag for for $12 off Amazon.",Personal chef to a billionaire explains how to make gourmet BLT sandwhich,t2_2b4nlf96,0.88,1823,1707456477.0,1707456477.0,424,Randomnonsense5,1amgqyh
Cooking,"I made a coconut chickpea curry today and it was so good and as I was eating it I thought about how incredible it actually is that I could make it.

Somewhere in Indonesia someone picked coconuts from a tree and gave it to someone who gave it to someone who canned it and sent it to America where I could buy it for $2

Someone in India planted, cared for, and harvested their chickpeas crops and sent that over for me to buy for a dollar.

Some people probably in california grew onion  garlic, and tomato and someone drove that onion, garlic, and tomato across the state so I could get it at trader joes.

so many olives someone picked from Italy or some place in the middle east, and so much work to extract their oil, all just to grease my pan

Then I used some spices, sourced from all over that earth, that were once only affordable for the richest of the rich, and sprinkled them all into my pan like it was no big deal

For the amount of money I make in 10 minutes of hourly wage, I was able to make a delicious, healthy, filling meal, and enough left over to share with my roommates. So this post is a thank you to all the men and women that helped me, though you only made cents in the process. 

",I made curry and then cried from gratitude,t2_a6k93oep,0.89,1812,1733187159.0,1733187159.0,127,Electronic-Mode-7760,1h5b00k
Cooking,"for me it’s that shaky bottle cheese, that kraft parmesan. objectively? barely even cheese. i remember a couple years ago a big scandal because the brand we always bought from found sawdust in the cheese. but its just too damn good. 

i use real freshly grated parmesan for stuff like actually cooking with. i also use it for brussels sprouts and asparagus. but for pasta? i could fuck up the shaky cheese.

also mcdonald’s. it’s not good. but it’s good for my soul. ",What objectively poor quality food do you still eat because it’s too good,t2_3owddps,0.94,1804,1713158795.0,1713158795.0,2132,deathbykoolaidman,1c4edmi
Cooking,"I will start with mine.

When I was young, my Mom and I had just moved to a new town and she was going through a divorce with someone that did not want to pay child support, so times were tough.  She made several recipes that were off the cuff, but good.

One that I remember fondly is ""Potato Chip Sandwiches"".

2 Slices of bread  
a Handful of potato chips, preferably ruffles  
a little spread of mustard

  
At the time I did not know that we were having problems.  But to this day, about fifty years later, I will still make these sandwiches for myself.  I like them and the bring back fond memories of the togetherness we shared.

I know not everyone will have a similar story or situation, but I thought I would ask to see who might and what ""recipes"" you might have had.","Did you have a ""Poor Person"" or ""Just Getting By"" recipe when you were young that is still a comfort food or favorite now, as an adult?",t2_dao6v,0.97,1778,1734635893.0,1734635893.0,1950,SamuraiMarine,1hi0ocd
Cooking,"I've been cooking for a very long time, and recently me and my wife moved and her family gifted us a ton of pioneer woman cookware. It was an amazing gesture and I was very appreciative and excited to cook on brand new cook ware. 

Within a month I was sick and tired of all of it. It's pretty but that's all it seems to be. The crockpots didn't work and I found out could potentially explode, the ceramic oven dishes already chipped along with the bowls. The pots are OK at best and takes forever to boil water and the pan is well a pan. Pioneer woman is probably better as decoration than cook ware.

I try my best not to use it and my my Carote set but sometimes it's just unavoidable. That is all

",Pioneer woman cookware is the bane of my existence,t2_nkoohskkr,0.93,1769,1723335522.0,1723335522.0,616,Glass_Finance_2941,1ep7h4p
Cooking,"So there are four sides to a box grater. There's the side that is used 90% of the time, the coarse shred side. Then there's the side that's for a finer shred, that usually I'm using a microplane for instead. Then there's the side that I guess is ostensibly for slices, but I'm more likely to use a mandolin or food processor for, or really, just a knife.

And then there's that FOURTH SIDE. The one that makes it impossible to hand wash the thing without drawing blood. The side that's just covered with sharp pointy spikes that do... what, exactly? I have never used that side of a box grater in my entire life, and I can't even imagine what it does that any of the other sides don't do already, other than make me reach for a box of band aids.

I'm 54 years old and have been cooking most of my life, but it has never occurred to me to use that side for anything. What's it for? Am I missing some amazing ""annoying job done easy"" trick? Or do I just already have a tool that does it better?

EDIT: I'm not going to respond to everyone individually, but thank you everyone for educating me on what that side is for! (And also for the assorted laughs provided too)",What is the fourth side of a box grater for?,t2_zm5d3,0.97,1750,1729000630.0,1729000630.0,402,Hansekins,1g48bsd
Cooking,I was cutting up bell peppers this morning and had a memory flood back to me from when I first started dating my now husband. He had minimal cooking experience at the time and literally could only make tacos with a seasoning packet (so much has changed!). He thought he’d be nice and surprise me with fajitas for dinner. I was stoked! I showed up to his apartment and he proudly showed me the skillet filled with bell peppers and steak and then said “I left the seeds in the peppers to make it spicy!”. I had to break it to him that the seeds in fact had no spice. Ate it anyway and powered through a very seed filled fajita. Made me curious if anyone out there has similar stories!,What’s a wholesome cooking mistake you’ve witnessed?,t2_668iussp,0.95,1739,1711052921.0,1711052921.0,1049,schmally_ward,1bkgjmn
Cooking,"Hello my job is hosting a potluck and unfortunately it seems like everyone has some health issues 💀.

I cannot bring anything with the following: Gluten/Starch, Dairy, Refined sugar, Tomatoes and hybrid foods with animal byproducts

Also whatever I do bring has to be vegetarian…

What the fuck do I even make???

EDIT: Thank you for all the suggestions! I’ve never participated in a potluck before so I’ll definitely avoid them in the future from now on.. I think I’ll just bring some fruit from my local grocery store 😅",My work is having a potluck in a couple of weeks and these people have so many dietary restrictions!,t2_clfrebbm,0.93,1736,1733195672.0,1733195672.0,2071,lycheeroll,1h5duyb
Cooking,"You read right. Was in a rush and needed something to thicken the soup, but also give it some acidity. And there is was, my dad's metamucil looking straight back at me, a perfect 2 in 1 combo. I added 2 spoonfuls, stirred and tasted...I stirred a little more vigorously then tasted again.... the aftertaste of artificial orange would not disappear. And worse, the soup made with bone broth and copious vegetables...smelled faintly or orange juice. I scrummaged through the fridge and found about 2 spoon fulls of leftover coconut yogurt which I mixed with what was left of the unsweetened peanut butter, and put that in the pot, put it to simmer for 10 more minutes, closed my eyes, sent one up to Jesus, and left to finish the errands. By the time I got home, my parents were already remarking about how good the soup was, and the neighbor kid (the biggest critic) said it was the best soup he had ever had.

If you remove the pot lid and pay attention, you may notice that the top note of the aroma wafting from the soup is artificial orange. But I'll take the win wherever I can",Metamucil in soup - a mistake that worked out,t2_3yicqz3q,0.89,1728,1710200280.0,1710200280.0,181,jutrmybe,1bci83t
Cooking,"I always try to do what I’m told, but I’m never happy if I keep my pasta at al dente. I thought maybe I’m just not doing it right, but we went to a VERY expensive Italian place, did the tasting menu, everything was AMAZING, but I still would have been happier if the noodles had been cooked just a little more. 
I guess my mom cooking pasta until an inch of mush just destroyed any chance of my palate ever getting there. 
Am I alone in this?","It’s official, it wasn’t my cooking, I don’t like al dente pasta",N/A,0.89,1728,1712536053.0,1712536053.0,360,N/A,1byk3ri
Cooking,"Crab legs; unpeeled shrimp; artichoke; salad consisting of whole, large lettuce leaves; extra long strips of onion and other veggies; nachos with not enough toppings and too many chips, the sky's the limit folks. Hit me.",I want to put together the most inconvenient meal. What are foods that are inconvenient or require work to eat?,N/A,0.95,1712,1717005289.0,1717005289.0,1472,N/A,1d3idxl
Cooking,"I don't mise en place every little thing, I wish recipes would re-iterate amounts.

For example:

""Add the two eggs to the pan"" or ""add the 2 tbsp of butter to the bowl"" or ""add the 1 tsp pepper to the pan.""

I get annoyed going back up to the top of the recipe to see amounts (especially if it's an online recipe!)

  
Anyone else? Or want to provide a counter-point?",Does anyone else wish amounts in recipes were re-iterated in the body of recipes?,t2_6wova,0.95,1691,1714684427.0,1714684427.0,252,Benay21,1cir18m
Cooking,"If you’re trying to help by contributing to the culinary world, mise en place happens in the ingredients list, not the method/directions. Help people by guiding them to do the prep work in advance.  

In case I’m being too vague, the ingredients list should say, “45 cloves garlic, minced” as opposed to just listing 45 cloves garlic, and then the first step of the directions/method says, “First mince the garlic.” That’s just dumb. Put the prep work in the ingredients list to help people get ready, even if they’ve never heard the term mise en place.

Edit: Yes, I read the entire recipe first. ",Unpopular opinion about *some* recipe authors,t2_obqya,0.94,1690,1707608964.0,1707608964.0,297,KithAndAkin,1anu12w
Cooking,"Fun fact

Update: [She’s ready 😳](https://imgur.com/a/n1VtGmB)","TIL my MIL cooks the turkey halfway the night before, and the rest the next day",t2_4wwoh4u3,0.91,1687,1732813807.0,1732813807.0,561,notmypillows,1h20nbr
Cooking,"All my life we've pretty much had salmon about once a week. Just normal grocery store salmon, the lowest priced cuts. For most of my life it was a mixed bag. Sometimes it would be good, sometimes it would be bad. Something changed though. It seems like around 4 years ago was the last time I got a piece of salmon that was good. Most of the time these days it's just bland and tasteless. Has anyone else noticed this decline or is this just something local to me or my own bad luck?",Has anyone else noticed that salmon isn't as good as it used to be?,t2_3ytzq0hd,0.91,1649,1729274721.0,1729274721.0,607,Cannavor,1g6olmg
Cooking,My skills have increased over the past few years and its now gotten to the point that I don't enjoy the average restaurant in my home town.  It's only when I travel that I'm likely to enjoy a special meal. My attitude has shifted to the meal I'm making at home costs 1/5 the amount and I like it more so why bother?  I've literally only had two good local experiences in the past year eating out.  Anyone else feel similarly?,Have you become  more dissatisfied with restaurants after learning to cook?,t2_8j20z3x6,0.94,1647,1734224364.0,1734224364.0,527,nooneiknow800,1heh9pu
Cooking,"Hi all,

My wife's lost much of her appetite due to cancer treatments. She'll crave something, but then the second she starts to eat it, she loses her appetite for it. The exception has been ""artificially sour"" flavors -- think Nerds, sour gummies, etc. She's also eating a lot of lemon yogurt.

In general, she tends to like acidic/spicy foods (her usual breakfast pre-treatment was eggs, mostly as a vessel for hot sauce and ketchup), but we've been very careful with those since they're causing nausea (though so does almost everything, so she still tries sometimes). She says she's been craving cheesesteaks/buffalo cheesesteaks, but she lost interest after a couple of bites in the buffalo wings we got last week because she was craving them. At this point, she says she's getting ""hangry"" because she hasn't had a proper meal in a week.

So I'm wondering if there's anything that I could make that could replicate that sort of ""artificially sour"" flavor. I'm thinking sweet and sour chicken, but also open to other ideas (maybe something with dried Persian limes?). She does not like any sort of seafood, but I think we're willing to eat any other proteins. (And for what it's worth, I think I'm a pretty decent cook.)

Thanks in advance for any suggestions.

QUICK EDIT: Just to clarify since I've seen a few comments about it's OK for her to snack on the candies, I 100% agree. I'm definitely not policing her food in anyway. She's looking for more meal-type foods that she can eat, and in the last week has been especially frustrated that she's not finding anything that she wants. I've always been the primary cook for us, and am more than happy to try new things for her/us. She's definitely still snacking on the candies, but also wants a more fulfilling/nutritious meal during the day.

--

EDITED TO ADD: I've mostly been a lurker since I joined Reddit, and haven't ever had a response like I have here. Thank you so much. I'm overwhelmed, in the best of ways. I'm reading every comment and will try to respond to as many as I can in coming days (we have family coming over to visit, so as soon as I finish typing this, I'm off to the kitchen to make zucchini bread, finish some ice cream and prep pizza dough). I'm excited to try some of these suggestions as soon as I can get to the grocery store this week.","I need some ""artificially sour"" suggestions to make for my wife, who's lost her appetite due to cancer treatments",t2_goaf54dl,0.98,1630,1721445719.0,1721445719.0,836,motteditor,1e7m6cz
Cooking,"Mine is aglio e olio. People ask me to make it when they come over or for me to bring it. 

I watched an old Italian lady make it once on YouTube (sadly can’t find the video anywhere) and copy her exactly.  Nothing more, nothing less, it’s so simple (which I think is the point. I’d love it if people said this about some of my more complicated stuff, not the easiest one

Edit: for those asking for the recipe, it’s not really a recipe, it’s a “feel” dish that you mess around with until you’re happy. In my experience , it’s best learned by watching someone else make it, not following a recipe. Stanley Tucci’s video on YouTube is good, just a bit short. 

Use 6-7 tbsp  quality olive oil. Slice 3 or 4, depending on your preference, cloves of garlic super thin (remember the prison meal scene in Goodfellas? That thin). It will infuse better but burn easier so be careful! Salt the water until it tastes like the sea. Cook the pasta a hair short of al dente because it will continue cooking when you combine it in the pan with the oil and garlic. Reserve sufficient (I use about 1/2 cup, sometimes 2/3 if it’s being funny) pasta water right before you drain it so it’s really starchy.  Pasta in oil, water in , toss. SALT AGAIN TO TASTE NOW, this is important. Add 1/2-1 tsp cracked red pepper. 

Edit 2: RIP inbox",What’s your fraud dish? The one everyone loves but it’s so easy you wonder why it’s a big deal?,t2_5naaw642,0.95,1607,1710177737.0,1710177737.0,1743,ackshualllly,1bc8nr6
Cooking,"Do you still eat it now?

We ate hamburger helper once in a while growing up, I remember liking the lasagna flavor. It was an easy quick meal once the parents arrived home from work. 

At some point in my 20s, the salt content became noticeable when eating it, so I haven't had it since.",Did you eat Hamburger Helper/Pasta Helper/Tuna Helper growing up?,t2_lw7r51im,0.9,1607,1707185543.0,1707185543.0,1339,NILPonziScheme,1ajyn3i
Cooking,"The dish got quite black, and I said I thought with a half hour of cooking the eggs would get extremely hard, but she said no, they didn't. Think she suggested the herbs prevented the eggs from getting too hard. This was in Southern California btw.","An Armenian woman cut my hair and showed me her video where she cooked eggs for half an hour I believe with herbs and possibly oil. think she said it's ""couscous"". But that's not couscous, is it? Any idea what it is?",t2_169paho1,0.91,1588,1712079556.0,1712079556.0,188,GregJamesDahlen,1bu4ufc
Cooking,"I don't know if this title was clear, my mind is really all over the place.  My sister just got diagnosed with total liver failure and has requested to spend her final few days at home.  She lives a very alternative lifestyle of relatively 'of the grid' living and this difference kind of drove us apart over the last decade or so.  Her home is VERY rural.  The closest amenities are a little over two hours away so I need to plan to get all of my supplies as soon as I land and then drive with all of them the two hours to her house.

I need help.  Maybe under normal circumstances I would be able to plan out a week's supply of food to cook, but I am such a mess right now.  Help me meal plan please!  What groceries should I buy that would feed 3 people for a week or two, can be transported in a rental car unrefrigerated for 2+ hours, and are fairly easy to put together?  It doesn't have to be pretty on a plate, just something that an emotional robot can put together.  Can meat be out that long?  What are some recipes you guys can think of?  Thanks in advance.

Edit: Sorry, I should have mentioned that my sister herself isn't eating.  She can't swallow anymore.  The meals are for me and two of her friends.

Edit 2: Y'all are all wonderful people and have been truly helpful.  I couldn't have done this without you.  Even though I wasn't able to respond to everyone, I refreshed the comments right before my plane took off so I could read through everything during the flight and make a plan and shopping list.  If anyone is interested in how this turned out, I settled on two rotisserie chickens (for tacos, chicken and dumplings, and a cheesey chicken n rice), that perogie thing, packets of tuna and the accoutrements to make tuna salad, oatmeal, and a couple dozen eggs.  I got some frozen vegetables that I threw in a cooler with the eggs, milk, cheese, and sausages.  I also got some Twinkies.  My sister and I used to break them in half, try to scoop out the cream without breaking the cake part, and then shove them on our fingers like we were aliens.  Lol, we were such little weirdos.  I haven't really thought of this in years, but it's something we can do together one last time.  Thank you to everyone for opening up your hearts and recipe books, you have really made a difference in my life.",My sister is dying in a very rural location. What can I cook for a week with groceries that have to travel 2+ hours in a car?,t2_7vzmms5i,0.95,1581,1713270602.0,1713270602.0,357,hangrylikeawerewolf,1c5ewfg
Cooking,"I love cooking and I love to watch cooking videos. 

Recently I’ve learned just how long it takes to
Actually properly caramelize onions. 

It’s a lot longer than the 2-3 minutes every YouTube cook tells you to do it for. 

Now I’m wondering what else is commonly preached that is actually incorrect",What are some common things YouTube cooks do that are actually incorrect?,t2_oxvcnlane,0.9,1544,1707326857.0,1707326857.0,1678,ocay_cool,1al8dbl
