subreddit,selftext,title,author_fullname,upvote_ratio,ups,created,created_utc,num_comments,author,id
zerocarb,"I recently about 2.5 weeks ago started this journey, the reason was one morning I was feeling a little ""A bit off"" my wife is type 2 and I was normal.  So Checked BP it was good, but she suggested a Glucose check it was 103.  This was upon waking up in the morning.  So I did some searching and this is outside the normal in the morning.  So I was like uh oh.  I had read so much about Carnivore for the past few months watching and reading the big names on youtube and following a lot of success stories.

Anyway 2.5 weeks in and it does seem to still be a little the same 103 this very morning, but other times in the day is 77, 85, 81.  I have been working the Eggs, Bacon, beef, salt, etc.   Feeling a little weak in the legs but can't quite get a handle on the is blood sugar deal.  I have not had a single carb in weeks, I figure its an adaptation period.  I work a desk job, and I do move but I guess I am planning a exercise regiment now to easily slide into my day so its super easy to follow without getting lazy.

50Y Male, chunky but not terrible, 5'9""  192.  Any Ideas what's going on here?  

I appreciate the insight as I am a little confused.  What could I be doing wrong?",Curious Question about Blood Sugar,t2_wjbvujm0x,0.82,13,1713542826.0,1713542826.0,9,Enhancedcrash,1c80nf1
zerocarb,"I noticed recently that cream has additives in it. I could have sworn that in years past when I looked at the ingredients, it was purely cream.  I've started buying organic cream, but even that has gellan gum in it. Regular cream has mono & diglycerides, polysorbate 80 and carrageenan. Is there anywhere I can get pure cream? I don't drink it straight up, but I do have a latte or two and tea with cream and collagen everyday.

I also love milk. It's the only thing that quenches my thirst. I've resorted to Fairlife milk to limit carb and double the protein intake. I actually like it better than any other milk. I've considered dropping milk altogether but I think it provides a lot of vitamins, minerals and electrolytes and I'm very active. Plus, life is better when I get to drink milk, and I'm not really willing to cut it out to be perfectly honest. Milk and meat is the best of all the worlds to me. I don't think it hinders me, in fact I do think it helps promote my physical lifestyle. But, I am kinda just looking for some anecdotal comparable experiences  for anyone else who drinks milk. Particularly anyone with fitness goals or generally a pretty fitness centered lifestyle. I don't have anyone in my life who is carnivore nor anyone who drinks milk, especially to the extent I do. I would say I probably drink around 2-3 cups a day. If it helps I am a 33y/o female, about 130lbs (I don't own a scale), I teach boxing as a fitness class, lift & play soccer. Do you feel like it hinders or helps you? Do you even notice a difference? ",For my cream and milk drinkers (& my fitness peers),t2_9amld,1.0,14,1706625648.0,1706625648.0,23,bigktizzle,1aepxhn
zerocarb,"When I refrigerate the rendered fat from my 80/20 ground beef, there is solid white fat that sits at the top, with a gelatinous brownish substance beneath it — it looks similar to bone broth.  Is this collagen and/or other proteins, with a little bit of water, too?  Or is this also fat?  

Often, the gelatinous material liquifies while eating, so I don't consume it because I'm worried it'll mess up my stomach like liquid fat does — should I just toss that portion out, and consume the solid white fat, or will I be missing important nutrients if I do so?",Refrigerated Rendered Fat,t2_xr4c9,0.93,12,1720968156.0,1720968156.0,40,IDumpFatLoads,1e33ycd
zerocarb,"I recently became carnivore and am wondering  how long it has taken those of you who have experienced allergies and/or asthma, to start noticing a difference with them, if any.

Any feedback appreciated!(:

Thank you! ",How long did it take for you to see improvements in allergies and/or asthma on the carnivore diet?,t2_4dplzqfc,1.0,12,1713597927.0,1713597927.0,9,Aylak1999,1c8k164
zerocarb,"If  you have been carnivore for less than 7 weeks, post all your questions  and experience reports here.  It is almost certain that your experience  is a frequently asked or low-effort question.

It  is also true that the adaptation period for this way of eating is a lot  like going through puberty. Everyone feels like things are weird and  wrong and no one else has experienced what they are going through.   Everyone is worried about changes in their body and thinks it might not  be normal.  In truth, it's all perfectly normal.  Your body might do  weird things, but it's going through changes.  After you get through  adaptation, you'll wonder why you worried at all.

So,  go ahead and ask your questions about getting started here.  Post about  your experiences here.  Post about your worries and how you don't think  this is working for you here.  Don't give advice that encourages people  to give up.  Don't give people advice to cheat or consume plant foods.   Don't give advice to take supplements or drugs to treat temporary  struggles.",Monthly: Less than 7 weeks? Comment here instead of making a new post.,t2_9jt9p,0.84,11,1711533610.0,1711533610.0,21,partlyPaleo,1boy54k
zerocarb,"T2D runs in my family and I wouldn't be surprised if I were pre diabetic or at the least insulin resistant. I know that doing carnivore and reducing carbs to near 0 is supposed to minimize insulin levels throughout the day. (I'm doing this for weight loss) 

What are ideal levels of BG? 

If BG levels spike after a meal is that an indicator of being insulin resistant?

If my levels of BG are higher what could I do to stabilize them and lower them? 

I'm going to be buying a BG monitoring kit 
And I've been on carnivore for a month now. 

I've struggled for years to get past a 240lb plateau I started carnivore to lose the weight and feel healthier and love it so far and I'm in this for the long haul just trying to figure out what I can do to help my body progress. ",Questions about insulin resistance and blood glucose levels,t2_4u853tau,0.89,13,1708887630.0,1708887630.0,8,CzechiaViolins,1azvs4n
zerocarb,"If  you have been carnivore for less than 7 weeks, post all your questions  and experience reports here.  It is almost certain that your experience  is a frequently asked or low-effort question.

It  is also true that the adaptation period for this way of eating is a lot  like going through puberty. Everyone feels like things are weird and  wrong and no one else has experienced what they are going through.   Everyone is worried about changes in their body and thinks it might not  be normal.  In truth, it's all perfectly normal.  Your body might do  weird things, but it's going through changes.  After you get through  adaptation, you'll wonder why you worried at all.

So,  go ahead and ask your questions about getting started here.  Post about  your experiences here.  Post about your worries and how you don't think  this is working for you here.  Don't give advice that encourages people  to give up.  Don't give people advice to cheat or consume plant foods.   Don't give advice to take supplements or drugs to treat temporary  struggles.",Monthly: Less than 7 weeks? Comment here instead of making a new post.,t2_9jt9p,0.83,11,1730023209.0,1730023209.0,15,partlyPaleo,1gd7lzx
zerocarb,"I appreciate you can get enough Vit c from fresh meat alone if you are healthy. But if you are not healthy there may be a need to supplement Vit c until the gut, general inflammation or other factors have healed. I have tried plain powdered ascorbic acid, but I’m pretty certain I‘m reacting to it. For those who are also very sensitive to foods and supplements, what forms of vitamin c have you had success with, if any? Thanks.",What is the best tolerated form of vitamin c?,t2_q6vj9j38w,0.71,8,1714680134.0,1714680134.0,18,FearlessAd765,1cipa7j
zerocarb,"If  you have been carnivore for less than 7 weeks, post all your questions  and experience reports here.  It is almost certain that your experience  is a frequently asked or low-effort question.

It  is also true that the adaptation period for this way of eating is a lot  like going through puberty. Everyone feels like things are weird and  wrong and no one else has experienced what they are going through.   Everyone is worried about changes in their body and thinks it might not  be normal.  In truth, it's all perfectly normal.  Your body might do  weird things, but it's going through changes.  After you get through  adaptation, you'll wonder why you worried at all.

So,  go ahead and ask your questions about getting started here.  Post about  your experiences here.  Post about your worries and how you don't think  this is working for you here.  Don't give advice that encourages people  to give up.  Don't give people advice to cheat or consume plant foods.   Don't give advice to take supplements or drugs to treat temporary  struggles.",Monthly: Less than 7 weeks? Comment here instead of making a new post.,t2_9jt9p,0.85,9,1709031607.0,1709031607.0,14,partlyPaleo,1b196fb
zerocarb,"If  you have been carnivore for less than 7 weeks, post all your questions  and experience reports here.  It is almost certain that your experience  is a frequently asked or low-effort question.

It  is also true that the adaptation period for this way of eating is a lot  like going through puberty. Everyone feels like things are weird and  wrong and no one else has experienced what they are going through.   Everyone is worried about changes in their body and thinks it might not  be normal.  In truth, it's all perfectly normal.  Your body might do  weird things, but it's going through changes.  After you get through  adaptation, you'll wonder why you worried at all.

So,  go ahead and ask your questions about getting started here.  Post about  your experiences here.  Post about your worries and how you don't think  this is working for you here.  Don't give advice that encourages people  to give up.  Don't give people advice to cheat or consume plant foods.   Don't give advice to take supplements or drugs to treat temporary  struggles.",Monthly: Less than 7 weeks? Comment here instead of making a new post.,t2_9jt9p,0.92,10,1732705209.0,1732705209.0,15,partlyPaleo,1h11r8l
zerocarb,"Hello lovely people, i'm relatively new to the carnivore diet. Decided to take it on after my father said it definitely helps with losing weight and generally feeling ""refreshed"" as he puts it. 

One problem with me is I can't really keep down food that is unseasoned, I come from a middle eastern background and we are a little TOO generous with seasonings. 

I thought about making my ""Chicken Fried Rice"" but without the rice part which is pretty simple. My question is will it defeat the purpose of the carnivore diet if i added a teaspoon each of Paprika, Garlic Powder & Chili Flakes? 

I swapped the olive oil for butter and the taste is relatively the same if not better. 

Thanks in advanced! ","Is using ""Spiced Chicken"" going to be an issue for me on a Carnivore Diet? ",t2_8vi5akg24,1.0,9,1731601105.0,1731601105.0,12,Grapefruity0la,1gr8hbm
zerocarb,"I'm trying to do carnivore again. Did it in the past but had issues and stopped doing it. I've been having a bunch of health issues lately so I'm trying again. I want to try a more lion style as I suspect that part of my previous issue may have been that I don't tolerate certain foods which I perhaps didn't realise so much at the time. Lately it seems that butter makes my throat slightly wheezy. 

The problem is that the meat I have access to is not incredibly fatty and it's leaving me hungry. 

I have tallow and cooked with it but can't eat it plain as it's hard and waxy? I also don't want to drink totally liquid tallow. Find it off-putting. 

So I'm considering trying cooked fat trimmings but I'd like to know what the texture is? Is it waxy like tallow or soft? 

Also can anyone here vouch for the difference in texture between drippings/tallow made from suet (internal fat) and drippings made from external fat? Is it much less waxy/grainy? 

",What is the texture of fried fat trimmings like?,t2_bifhc0bx,0.84,8,1724296756.0,1724296756.0,16,Dry_Ad_540,1ey984t
zerocarb,"I'm two weeks in today. Osteoarthritis in booth knees. I've been keto for over a year. I'm treating this as an elimination diet--if the arthritis improves, I'll start adding other things back to see the effect. The adjustment was easy and I felt more and better mental energy within a couple of days--not dramatic, but noticeable. Also some insomnia with that, but not too bad. I think there was a little improvement in knees three or four days ago but not since. I'm a little tired of all the grease and monotony and would really love some heavy cream in my coffee! I know the general advice is to give it at least a month, but with the prior keto, easy adjustment I wonder if that's necessary. Thoughts? Thank you!",How long to try for arthritis if the adjustment was easy and I was keto for over a year?,t2_jok7hss,0.84,8,1714041008.0,1714041008.0,7,dsschmidt,1ccokjp
zerocarb,"I'm trying carnivore as an elimination diet for a while to see if it helps with various chronic issues.
My initial plan was to stick to beef, either fried in tallow or high-fat cuts fried in their own fat.

I’ve never really liked the taste of beef that much, but I thought I could push through.

However, when I bought beef from a butcher, the flavor was way too intense and bloody, and I couldn’t finish my plate.

Apparently the supermarket beef I’ve eaten in the past is mixed with cereals, vegetables, starch, herbs, and other additives, which probably masked the taste.

Now I’m considering chicken as my main protein source. I know it’s usually discouraged in carnivore for being too lean, but I could fry it in beef tallow to add fat. I’ve also read about concerns with chicken being high in PUFA, but does that really matter if I’m only planning to do this diet for a few weeks before reintroducing other foods?

Or, are there maybe any ruminant meats that taste milder and, well, less meaty than beef?

Lastly, would adding eggs be a good idea to compensate for chicken’s deficiencies? Being an elimination diet I want to keep the number of foods as low as possible, but eggs seem unlikely to be the cause of inflammation or symptoms, right?

Any advice or thoughts would be greatly appreciated!
",Can chicken and beef tallow replace beef?,t2_9xqsxdlq8,0.67,6,1736168827.0,1736168827.0,27,desmetilada,1huykpp
zerocarb,"If  you have been carnivore for less than 7 weeks, post all your questions  and experience reports here.  It is almost certain that your experience  is a frequently asked or low-effort question.

It  is also true that the adaptation period for this way of eating is a lot  like going through puberty. Everyone feels like things are weird and  wrong and no one else has experienced what they are going through.   Everyone is worried about changes in their body and thinks it might not  be normal.  In truth, it's all perfectly normal.  Your body might do  weird things, but it's going through changes.  After you get through  adaptation, you'll wonder why you worried at all.

So,  go ahead and ask your questions about getting started here.  Post about  your experiences here.  Post about your worries and how you don't think  this is working for you here.  Don't give advice that encourages people  to give up.  Don't give people advice to cheat or consume plant foods.   Don't give advice to take supplements or drugs to treat temporary  struggles.",Monthly: Less than 7 weeks? Comment here instead of making a new post.,t2_9jt9p,0.91,8,1722074407.0,1722074407.0,6,partlyPaleo,1edctgj
zerocarb,"did an ultrasound today and i got this result:

HEPATOMEGALY WITH MILD STEATOSIS.

did a google search and said to avoid fatty food. anyone with the same diagnosis but still went zerocarb/carnivore?

another one is this:

SUBOPTIMALLY DISTENDED BLADDER WITHOUT RETENTION

Im just giving here what seems to be important since the other test were saying ""normal"".

i know i should go to a doctor(this ultrasound test are the doctor's instructions). just wanted to compare what you guys are experiencing. I still have 2d echo and treadmill test before the doc can say if i can go to the gym and whatnot",did an ultrasound and i saw two comments from the result. not sure if going carnivore is still feasible?,t2_fbaza,0.61,5,1733921477.0,1733921477.0,39,linux_n00by,1hbsr5w
zerocarb,"Hello Goodmorning  
out of circumstance where im not able to choose my food myself nor cook i needed to go back to a diet with carbs.. its just for a month and after im back and can start over again.  
but my question now: first time i ate a bit carb i felt super sick and hangover the next day..  
but now 2 weeks with carbs is way worse! I have pain in my knuckles on the hands, elbows, shoulders, feet and all my joints feel ""dry"" if i straighten my arms elbows badly crack even my shoulders if i rasie may hands up.

after every meal and i feel nausea, my stomach aches and the stomach feels like inflamed, after eating and even water feels like weird.  
i feel overall not well since tired, sometimes dizzy, my legs and arms feel restless and i need to move them..  
so overall i feel like trash, and hope that will subside after when im out here.  
somebody else have an experience like that?  
thanks and regards","Feeling nausous, stomach aches adn overall unwell after Diet change",t2_b7re16qej,0.68,7,1729850953.0,1729850953.0,13,Cringe_Carnivore,1gbqse3
zerocarb,"This brand of ground lamb contains 4 grams of carbs and <1 gram of fiber in 4 oz. I thought it was a mistake because they have two different nutrition labels on the product page. The actual product label when it arrived had the info I posted above.

I eat 2 lbs per day, so that would be 32 grams of carbs; which is no good, as I'm doing zero carbs right now. Also, fiber messes up my stomach.

So, what's the deal? Does this brand contain a lot of cartilaginous material in it, which is fiber-like? Is there a lot of glycogen still in the muscle meat, which they are counting as carbs? Or is all ground lamb really like this, and this is actually the correct way they should all be labeled?

https://www.amazon.com/gp/product/B088Y2N6WC?ref_=uff_od_product&almBrandId=QW1hem9uIEZyZXNo&fpw=alm",Ground Lamb Contains Carbs/Fiber,t2_xr4c9,0.75,8,1719328351.0,1719328351.0,9,IDumpFatLoads,1do8e5d
zerocarb,"29M, 1,88

So, I went carnivore a couple of years back and went from 127kg to 110kg in a couple of months. Due to stress and lack of money, I abstained from the diet until last month. Where I started carnivore again. I was at 135kg. 

I ate mostly chuck beef, ribeyes, eggs, cheese, some yogurt, pork loin, some sausages. Two meals a day with at least a 12H fast. During the past month I lost 10kg, but I gained 1.5kg during the past week. My physical activity has increased during the past week. I've also been having problems with belching. Didn't have those before.

During my first time, I was eating the same stuff as I am now. I don't know what I might be doing wrong. ",I'm gaining weight,t2_12dtx9,0.88,6,1717161535.0,1717161535.0,4,gafanhotojudeu,1d4vff7
zerocarb,"i asked this because they say to avoid greasy food when taking these medicines and we know cooking with butter violates that rule already

im obese and already reaching 40 with type 2 diabetes. so i wanted to take these with the consultation with the  doctor of course and also want to strictly go carnivore too and wondering if there will be a negative effect combining these.

asaide from health benefits, i also wanted to turn my life around just one last time 

i never liked vegetables though i eat some. mostly leafy vegetables. so if anything, i just wanted to eat meat for the rest of my life :D",Ozempic/Wegovy + Carnivore... has someone did it?,t2_fbaza,0.62,8,1733147629.0,1733147629.0,49,linux_n00by,1h4vga3
zerocarb,"I’ve been carnivore since Jan 2023. After seeing all the positive benefits, this is a lifestyle change. However, a bucket list item is to do a thru hike of the Appalachian Trail. Any hikers and/or backpackers have advice? Is it possible to hike the entire trail while remaining carnivore? ",Bucket List: Appalachian Trail Thru Hike,t2_8ilh3u2x,1.0,6,1717068732.0,1717068732.0,1,New_Explorer1455,1d41txw
zerocarb,"Anyone else get any dizziness after laying down then getting up doing zero carb? I've been going for 6 weeks, lost 20 lbs. Doing 30% calorie deficit. ",Dizziness,t2_tp4mj,0.76,4,1710095934.0,1710095934.0,1,Razbonez,1bbhgyh
zerocarb,"If  you have been carnivore for less than 7 weeks, post all your questions  and experience reports here.  It is almost certain that your experience  is a frequently asked or low-effort question.

It  is also true that the adaptation period for this way of eating is a lot  like going through puberty. Everyone feels like things are weird and  wrong and no one else has experienced what they are going through.   Everyone is worried about changes in their body and thinks it might not  be normal.  In truth, it's all perfectly normal.  Your body might do  weird things, but it's going through changes.  After you get through  adaptation, you'll wonder why you worried at all.

So,  go ahead and ask your questions about getting started here.  Post about  your experiences here.  Post about your worries and how you don't think  this is working for you here.  Don't give advice that encourages people  to give up.  Don't give people advice to cheat or consume plant foods.   Don't give advice to take supplements or drugs to treat temporary  struggles.",Monthly: Less than 7 weeks? Comment here instead of making a new post.,t2_9jt9p,0.71,6,1735297209.0,1735297209.0,8,partlyPaleo,1hnck9k
zerocarb,Does anyone have any information or someone that might be a good contact to know if carnivore might have any positive effect on myelodysplasia? Thanks,Effect on MDS,t2_n4lnv,0.86,5,1727295259.0,1727295259.0,4,cellige,1fpe3x9
zerocarb,"If  you have been carnivore for less than 7 weeks, post all your questions  and experience reports here.  It is almost certain that your experience  is a frequently asked or low-effort question.

It  is also true that the adaptation period for this way of eating is a lot  like going through puberty. Everyone feels like things are weird and  wrong and no one else has experienced what they are going through.   Everyone is worried about changes in their body and thinks it might not  be normal.  In truth, it's all perfectly normal.  Your body might do  weird things, but it's going through changes.  After you get through  adaptation, you'll wonder why you worried at all.

So,  go ahead and ask your questions about getting started here.  Post about  your experiences here.  Post about your worries and how you don't think  this is working for you here.  Don't give advice that encourages people  to give up.  Don't give people advice to cheat or consume plant foods.   Don't give advice to take supplements or drugs to treat temporary  struggles.",Monthly: Less than 7 weeks? Comment here instead of making a new post.,t2_9jt9p,0.86,5,1714212008.0,1714212008.0,15,partlyPaleo,1ceaxpa
zerocarb,"TLDR: Started carnivore a few days ago (four I think) but no keto flu symptoms. 

Perhaps I misunderstood the deal with the carnivore diet but I thought that by eliminating all carbohydrates from my diet I would thus enter ketosis. I haven't measured my ketone levels (and won't be, simply due to the cost) but am almost certain that I am not in ketosis (at least not yet). I have no symptoms that are expected from keto flu. I honestly feel basically the same overall as I did before I started, although I have had a mild headache since beginning and have noticed that I felt worse as time went on until earlier today and I've been improving since then. 

Am I doing something wrong? Should I have started keto before switching to carnivore or would that not have made a difference? Any advice, tips, or tricks helps a lot. I'm also pretty new to the ketogenic and carnivore diets so if I misunderstood something, please point it out. ",Started carnivore but no signs of entering ketosis?,t2_xapke3py8,0.57,3,1716334795.0,1716334795.0,44,4-aminobenzaldehyde,1cxma9z
zerocarb,"I just picked up a slab of pork belly from Costco. To make bacon, can l use only salt or do I need some type of curing salt or vinegar? Does it make a difference in the texture or flavor? I would love to hear your thoughts and/or recipes!",Homemade bacon - are curing salts required?,t2_3h7c34ko,1.0,3,1709670173.0,1709670173.0,2,chrispeytontaylor,1b7fhb2
zerocarb,"Hi everyone,

is it okay/fine to eat my ground beef and beef fat trimmings when cold and with the rendered fat solid like butter? 

Any comments/ remarks are appreciated!

Thanks!",Cold ground beef and beef fat trimmings,t2_g5srheuru,1.0,2,1709660842.0,1709660842.0,4,AureliusLazarus,1b7bhwk
