subreddit,selftext,title,author_fullname,upvote_ratio,ups,created,created_utc,num_comments,author,id
zerocarb,"Granted I've only had 3 zero carb meals so far, but my switch in this experiment is from long-term keto rather than the SAD. 

I'm not seeking to overcome any major health problems, as I have none, but am seeking better overall health. 3 minor issues I have are insomnia, burnout after dinner, and sometimes even lunch. Feeling of stuffiness in primarily my left ear canal. The burnout could be overcome with caffeine, but I'm too sensitive to caffeine to have it after noon, or it exacerbates the insomnia.

So what's changed after 2 zerocarb meals yesterday, and 1 this morning?

1. Burnout after meals was little to none.

2. I slept 9-10 hours straight.

3. I have less muscle soreness(I lift weights 2-3x week). 

4. Stuffiness in ear seems to be lessened.

5. Less sensitivity to the morning coffee.

I realize part of the positive effects could be placebo, and also realize the good night's sleep is responsible for some of the changes, especially #3.",Initial Success; This Will Be a Game Changer,t2_zwioa,0.86,20,1711125851.0,1711125851.0,4,Jay-jay1,1bl3sjy
zerocarb,"29 Year old male here. Any other males notice there erections feel sort of less ""full"" when they do carnivore? I still get rock hard erections, but there is something about the way it feels and looks almost like its less full, more narrow, and the good Lord knows I don't need that lol! Just curious because i went a week strict zero carb last week, with great morning wood, and then I had a carb heavy meal over the weekend and my Johnson looked so full and large.. almost the way carbs can make your muscles look bigger and more full but I was not aware the penis acts in similar ways. Just curiosity. Any thoughts?",Zero Carb and Testosterone,t2_4er27j4j,0.95,20,1713886127.0,1713886127.0,21,udaho33,1cb7he7
zerocarb,"If  you have been carnivore for less than 7 weeks, post all your questions  and experience reports here.  It is almost certain that your experience  is a frequently asked or low-effort question.

It  is also true that the adaptation period for this way of eating is a lot  like going through puberty. Everyone feels like things are weird and  wrong and no one else has experienced what they are going through.   Everyone is worried about changes in their body and thinks it might not  be normal.  In truth, it's all perfectly normal.  Your body might do  weird things, but it's going through changes.  After you get through  adaptation, you'll wonder why you worried at all.

So,  go ahead and ask your questions about getting started here.  Post about  your experiences here.  Post about your worries and how you don't think  this is working for you here.  Don't give advice that encourages people  to give up.  Don't give people advice to cheat or consume plant foods.   Don't give advice to take supplements or drugs to treat temporary  struggles.",Monthly: Less than 7 weeks? Comment here instead of making a new post.,t2_9jt9p,1.0,19,1727431209.0,1727431209.0,39,partlyPaleo,1fqk61a
zerocarb,"If so, do you season it with anything? Do you eat it with just salt?

I've recently come across r/SaturatedFat and am really understanding the importance of it in our diets. I'm trying to find ways to slurp down more fat without just eating sticks of butter and also just simplifying my diet.","Does anyone here eat JUST ground beef, melted fat and all?",N/A,1.0,18,1713636347.0,1713636347.0,15,N/A,1c8wb4m
zerocarb,"Carnivore Brunch in Midtown NYC: Saturday 2/3/24 1-3 pm. 

This is a get together for carnivore lifestylers to socialize, share experiences, cooking tips, exercise tips and so on.

Venue is a commercial loft/event space near the Herald Square subway. 

Everything is zero carb 

2 Egg Japanese Omelet\* (four bucks)

10+2 oz Ribeye Steak\* (thirteen bucks)

1/3 lb Burger\* (three bucks)

Sparking Water/Coffee (one buck)

\*Eggs: pasture raised/organic

\*Beef: 100% grass-fed New Zealand beef

\*Grass-fed beef tallow, organic butter, ghee, and salt available as desired.",Carnivore Brunch in Midtown NYC: Saturday 2/3/24 1-3 pm,t2_gwuad66o1,0.95,16,1706809993.0,1706809993.0,8,carninyc,1agh0q5
zerocarb,"Hey everyone. Just need some advice on how to continue carnivore after wisdom teeth extraction. Every advice online is just “eat ice cream, mash potatoes, bananas, apple sauce, fruit smoothies, ect.”

I’ve been on carnivore for 2 weeks now and my wisdom teeth are coming out in 3 weeks.. I’m just trying to continue carnivore/ketosis without getting dry sockets. I’m open keto ideas as well if that’s as far as diet accommodations can go with this type of surgery. Appreciate any and all recommendations.

Edit: Thank you all for the tips and tricks, definitely feeling prepared now :D",What can you eat after wisdom teeth extraction?,t2_cp34zu78,0.87,17,1709329464.0,1709329464.0,30,Herbert_Larson,1b46i34
zerocarb,"If  you have been carnivore for less than 7 weeks, post all your questions  and experience reports here.  It is almost certain that your experience  is a frequently asked or low-effort question.

It  is also true that the adaptation period for this way of eating is a lot  like going through puberty. Everyone feels like things are weird and  wrong and no one else has experienced what they are going through.   Everyone is worried about changes in their body and thinks it might not  be normal.  In truth, it's all perfectly normal.  Your body might do  weird things, but it's going through changes.  After you get through  adaptation, you'll wonder why you worried at all.

So,  go ahead and ask your questions about getting started here.  Post about  your experiences here.  Post about your worries and how you don't think  this is working for you here.  Don't give advice that encourages people  to give up.  Don't give people advice to cheat or consume plant foods.   Don't give advice to take supplements or drugs to treat temporary  struggles.",Monthly: Less than 7 weeks? Comment here instead of making a new post.,t2_9jt9p,0.95,14,1724752810.0,1724752810.0,9,partlyPaleo,1f2d85a
zerocarb,"Sorry I never post, but I’m hoping for some guidance. My husband and I have been doing carnivore for the past month, and we love it. But we leave for our honeymoon in two weeks for 20 days. 
We are going to Europe and really want to enjoy ourselves and not worry about what we eat or drink. 
When’s the best time to start introducing foods back into our diet so we aren’t sick to our stomachs there, but also what’s the best plan for when we are home? 
We are full carnivore right now, but probably going to switch to animal-based/zero-carb when we get home. 
Thanks! ",Honeymoon in 2 weeks,t2_j8bxe0ds,0.86,14,1723460745.0,1723460745.0,1,Any_Explanation_8099,1eqat2e
zerocarb,So I gave up caffeine a long time ago due to heart and sleep issues. I do still drink quite a bit of decaf especially on cold weather days. What's the recommended hot beverage for those on pure carnivore? I'd like to stay away from things like bone broth to avoid breaking my fast since I'm OMAD most days.,Hot Coffee Alternative?,N/A,0.78,15,1709919752.0,1709919752.0,38,N/A,1b9u4zm
zerocarb,"# What Should I Read First?

Obviously, this FAQ is a good start.  Other recommended reading is [The Fat of the Land](http://justmeat.co/docs/the-fat-of-the-land-vilhjalmur-stefansson.pdf) (should be required reading), [Bear's Words of Wisdom](http://justmeat.co/docs/the-bear.pdf) (also pretty important), and [Strong Medicine](http://justmeat.co/docs/strong-medicine-blake-donaldson.pdf) (optional but has some good information).  All three of those are available as PDFs from those links.  They are listed in order of how beneficial they are.  I have rarely seen a question that was not addressed in The Fat of the Land.

# I'm sorry but the idea of a zerocarb diet having book requirements sounds like ultimate gatekeeping to me.

This way of eating has a history and that history defines what it is and how it is done.  When someone has questions, they are usually already answered in those sources.  I did not say that any of the books are  required.  I said one 'should' be required, another was pretty  important, and one was optional.  No one is being forced to do anything.   It helps to read the books.  But, we answer the questions of those who don't.

# How Long Should I Try?

You should commit to a full 30 days and 100 individual meals, whichever is greater.  During this time, absolutely no deviation or cheating allowed.  If you cheat, or deviate, restart both counts.

# Should I Slowly Reduce Carbs or Jump Right In?

Some of the other moderators here often will tell people to go do keto, paleo, or some other low-carb plan first.  I don't agree with them.  But, you can go try that.  Your first day of zerocarb will not start until after you completely drop everything though.  I say to just commit and get through it.  Stefansson (The Fat of the Land) says the same thing.

>Beginning the meat diet gradually, trying to make the change less  painful, would be about as considerate as chopping a dog's tail off  gradually, by inches.  \[. . .\] I have seen to it, irrespective of  this token hoarding, that the men changed abruptly from the mixed to  the straight meat diet, the saved-up delicacies being strictly saved,  never used in any tapering off process.

# What Can't I Eat?

You can't eat anything that isn't from the animal kingdom.  That means no plant foods, no artificial sweeteners (nothing sweet actually), no fiber supplements, no alcohol, and no plant oils/fats.  This includes honey.  Some people confuse themselves into thinking honey is an animal product.  It is not.  It isn't even something debatable.  Honey is not allowed in any amounts in the carnivore/zerocarb way of eating.

# OK, What Can I Eat?

You can have any kind of meat.  You do not need to stick with beef.  If you like pork, eat pork.  If you are craving some chicken, eat some chicken.  The same goes for everything else: rabbit, fish, lamb, etc.  You can eat high-fat and low-carb dairy.  That's butter, hard cheeses, and creams.  Dairy can cause issues for people, it should not be considered a main course.  It is more like a seasoning or a side.  Some cheese on a burger is fine.  An 8 ounce block of cheese by itself?  That is not fine.  Eggs are fine also.

# What About Milk?

Don't drink milk. You are a grownup.  As people age, milk become less and less appropriate for humans. Young children can drink milk.

After you had adapted, if you wish to try to include milk, you can give it a shot.  Some people have no problems and find it benefits them.  But, during the getting started phase, no milk.  And, the majority of people never go back to it.

# Do I Need to Eat My Meat Raw?

Nope.  Cook your meat however you like it.

# Do I Need to Eat Organs or Grass-Finished Meat?

Nope.  Eat the meat you enjoy and can afford.  There is no need to ever eat organs or grass-finished meat.  You really do not need to concern yourself with it when just starting.

# What About Seasonings, Salt, and Spices?

Spices are allowed (although make sure sugar is not an ingredient).  Plants are allowed as seasonings and medicines.  A light sprinkling of some spices will not be a problem for most people, although some people do have issues.  Do not get too aggressive with it, light is better.   Meat is delicious, it does not need much to enhance the flavor.  Salt is something you can consume to taste.  There are people who insist you need extra and others who insist that you need none.  Stefansson says none.  The Bear says none.  Most people feel better with salt, even extra salt, at the start.  It is not a deal breaker.

# What About Electrolytes? You don't mention them and lots of people on the sub talk about them.

It is covered under seasonings and  salt. Short answer, historical practice has considered salt to be  problematic and it was not permitted. People adapted fine and we're  successful without using any salt or electrolytes (even during the  adaptation phase).  Stefansson even refused to take it with him on the long journeys and what little they had ran out at the same time they went from a mixed diet to a zerocarb one cold-turkey.

Lots of people  mention it. Sure. Lots of people believe they need to consume a bunch  and worry about balancing electrolytes. They will insist they had  symptoms that only resolved because they increased salt or added  magnesium or whatever. Or they insist they get certain symptoms if they  cut or reduce these things. It will never cease to amaze me, the  powerful effect that beliefs can have on the body.

In the end, salt is probably not super harmful.  If it makes you feel better and sleep well at night, have some extra salt. It is not a deal breaker.

# What About Coffee or Tea?

Coffee and tea are not good for you.  But, coffee is generally well tolerated and accepted by many.  Stefansson allowed it, the Bear allowed it, and many long-term carnivores will still drink it.  It falls into the category of plants as flavoring and/or drugs.  You can keep it for the start.  If you do, it is highly recommended that you try going without it at some point in the future.  Tea tends to be harder on the kidneys and body.  A cup should be fine.  But, but not too much.

If you drink either, some cream is fine.  Real cream and not creamer.  No sweeteners of any kind.  No butter, no coconut oil or MCTs (plant oils are not allowed).  Absolutely no Bullet-Proof coffee monstrosities.

# What About Alcohol?

No.  Definitely not at the start.  And, it is not a great idea after.  If you can't stop drinking for 30+ days while you get through the 30 days / 100 meals, you have bigger problems with alcohol than you do with your food.  Fix that first.

# How Much Should I Eat / When Should I Eat?

More than you expect and more often than you think.  The absolute minimum recommended amount (from Strong Medicine) is 3 meals a day of 6 ounces of lean and 2 ounces of fat.  That is equivalent to 3x8oz of (75%/25% ground beef).   One and a half pounds over three meals is about 1,995 calories and 109 grams of protein.  This is the FIRM minimum allowed (small women might get prescribed and eat this amount).  Eating more at any of the three meals was allowed.  For larger people more was encouraged.  Eating less than this was failure to follow the protocol.

Ideally, you will attempt to follow a similar eating protocol and plan at the start.

We   strongly discourage intermittent fasting during the first days.  We know that many zerocarbers who have done this for a while will eat 1-2   meals a day, but very few of them started there.  The first purpose of   eating this way is to relearn your body's signals and needs.  You  should  eat when you are hungry and as much as you want.  For people who  have a  history of calories restriction, IF, fasting, or other stuff  like that,  you might have messed up your ability to know when you are  hungry.  Try  and eat several times during the day.  Have at least two  bites of the  food.  If you eat a couple of bites and really aren't  interested, put it  away and come back to it later.  You will often be  shocked to learn  that you were hungry.  This has other benefits.   First, it reduces  cravings for the foods you shouldn't eat.  If you are  full, you are less  likely to fall to temptation.  Second, it provides  ample nutrients for  your body to heal and get back on track.  Third,  you are sending signals  to your body that food is ample and there is no  shortage.  There's no  need to preserve excess fat, energy is available  for the taking whenever  desired.  You may not lose super quickly  eating this way, although many  people do still lose a lot, you will get  healthy and reach a healthy  weight this way.  Remember, you can starve  yourself thin; but, you will  never starve yourself healthy.

Our position on IF is perfectly summed up by The Bear.

>It   is perfectly ok to only eat one large meal/day, like a three pound   steak- but it is likewise just as ok to eat as many as six. If you are   working out and trying to gain muscle mass, eat six smaller steaks   rather than one or two big ones. I have eaten as much as four or five    pounds of steak in a day- and as little as one or two, it matters   not--but if you ingest less calories than you are burning, you will lose   muscle mass as well as bodyfat. If you ingest more than you need, the   body discards the excess--quite different than is the case with carbs.

# I Can't  Eat Enough At My OMAD!

OMAD is a totally different way of eating from carnivore. Let go of that idea and eat multiple times.

There are zerocarbers who end up  eating one huge meal a day, but it is not everyone. Lots of people end  up with two or three meals a day. Some feel best with even more. But the  number of meals does not matter. All of them eat when their body  requests food. All of them eat enough to fuel their body well.

If  you read the above, the minimum amount for starting out should be three  meals of 8 ounces or more of fatty meat. After you have a few months  under your belt and have learned to listen to your body when it asks for  more or is not asking for food, then you can try something else.

# How Will I Poop Without Fiber?

You   will poop again.  It might slow down.  It might speed up.  Do not  trust  a fart.  One frequent adaptation issue is very loose movements.   It's  not uncontrollable diarrhea, but it is very watery.  These things   normalize in time.  But, you will almost never fart.  If you think you   have to fart, try going to the bathroom.  You won't regret that   precaution.

# Do I Need to Take Supplements? What About Medications?

You do not need supplements.  You can continue to take medications prescribed to you.  Be aware that your body may become more sensitive to the medication and require less as time goes on.  Work with your doctor.

# Do I Need to Buy Anything?

You do not need anything to eat this way.  Do not go out and buy ketone strips, glucose monitors, coaching or anything else.  There is no need to pay for any books.  We have the main ones available for free.  There are no supplies you need to buy, other than the meat that you can afford and enjoy.  It is not  wrong to buy someone's book, but you are not going to be more successful because you do.

Be wary of people trying to sell you something.  There is no need to pay $120 a month for coaching.  We provide all the information you need here for free.  Actually, all the best, most experienced, and helpful zerocarbers offer their help for free and are out there.  Many of us have been helping others for years, for free.  You don't need to buy your meats from any specific supplier.  There are no supplements or vitamins that we are selling.  In fact, if anyone offers advice that also includes something you should buy, that is a pretty good sign that you shouldn't trust them.

# Who Do I Trust?

You will frequently see people with different opinions arguing on here.  People will tell you that you need to eat liver, fast, stare at the sun, rub your left foot counterclockwise under a full moon, etc.  Often this advice will be contradictory.  When in doubt, compare that advice to The Fat of the Land, The Bear's Words of Wisdom, and maybe Strong Medicine (if you haven't already got an answer by then).  If none of those address it, chances are it is not that important.  Look for people who have been doing this for a while and what they do, although be careful.  Some people lie about how long they have done it.  Use your common sense and be willing to test things yourself.  Just because we eat this way does not mean we reject all science, common sense, and logic.  Staring at the sun and arguing that the Earth is flat does not make you extra-zerocarb, it makes you extra-special (and not in a good way).

# Will I Get Scurvy?

No.  Read The Fat of the Land for more details.

# Will I Die?

Yes.  You are human, and all humans will eventually die.  But, this diet won't kill you.  This is the diet meant to keep you alive and healthy.  It will not make you immortal.  It won't make you immune from all disease or a super-hero.  It will give your body the best fighting shot at health.

# What If I Have a Special Medical Issue or Condition?

First, always work with your medical professional.  They are aware of your specific situation in a way that people on the internet are not.  For people with histamine issues and other issues with severe allergies, it may require cutting all spices out and seeking fresher meat than normal (start with spices).  People without gallbladders might need to eat more often to avoid overloading on fat.   Some people may find that they react to eggs and dairy and they need to reduce even those down to zero.  If possible, try and complete a run before tweaking, but also be aware of your specific circumstances.



If you have a question that is not addressed, respond below.  I know some people might disagree with some of these points, but in that case I recommend following the ""Who do I trust?"" advice.",Let's Get Started: Beginner Questions and Answers,t2_9jt9p,0.9,14,1734016689.0,1734016689.0,6,partlyPaleo,1hcnbez
zerocarb,"Does anyone know of a good Beef/Beef organs protein powder? Most common protein powders out there are whey based, and the beef ones I've found contain sweeteners or other unwanted stuff.

Protein shake has always been a very effective way to get in an extra meal, specially when I'm traveling, but having trouble finding a clean one that's carnivore/animal based compatible.",Beef/Beef organs protein powder?,t2_ie47dyjb,0.94,14,1714678788.0,1714678788.0,9,Volunder_22,1ciopiv
zerocarb,"If  you have been carnivore for less than 7 weeks, post all your questions  and experience reports here.  It is almost certain that your experience  is a frequently asked or low-effort question.

It  is also true that the adaptation period for this way of eating is a lot  like going through puberty. Everyone feels like things are weird and  wrong and no one else has experienced what they are going through.   Everyone is worried about changes in their body and thinks it might not  be normal.  In truth, it's all perfectly normal.  Your body might do  weird things, but it's going through changes.  After you get through  adaptation, you'll wonder why you worried at all.

So,  go ahead and ask your questions about getting started here.  Post about  your experiences here.  Post about your worries and how you don't think  this is working for you here.  Don't give advice that encourages people  to give up.  Don't give people advice to cheat or consume plant foods.   Don't give advice to take supplements or drugs to treat temporary  struggles.",Monthly: Less than 7 weeks? Comment here instead of making a new post.,t2_9jt9p,0.93,13,1719482407.0,1719482407.0,12,partlyPaleo,1dpnkq8
zerocarb,"Several days ago I had problems in my lower back. Muscle spasm and related inflammation from overdoing some work occurred. I doubt anything is torn, but the muscles were so tight and sore I could barely do anything for a couple of days. 

Yesterday I did some light work and was pleased at the progression of healing, but after eating an evening meal of pork tenderloin cutlets fried in butter, the pain and stiffness flared up again. Was the flare up caused by the pork? If so what are the most anti-inflammatory meats and/or animal products I can eat to speed the healing?

This morning started out with great pain, but after eating a simple 3 egg omelet I feel much better.",Best Anti-Inflammatory Animal Products,t2_zwioa,0.89,13,1717250945.0,1717250945.0,18,Jay-jay1,1d5nssw
zerocarb,"Hey everyone,

Jumping on reddit (haven't been here in a while) to see if people want to go to a Meat Up in Cape  
Cod, Massachusetts. It will be at Brazilian Grill Hyannis, Massachusetts. Saturday June 1st, 2024 AD.

There will also be free giveaway from sponsors to the event. Sponsors like: Carnivore Bar, LMNT, Health Y Sol, Love Farms, Ungovernable Project.

It is being hosted by Butterfueled, they're mainly present via IG, so I'm just helping them out here to increase awareness.

Here is their flyer, but I would recommend reaching out to them via email or IG if you had any questions. I can pass any questions too.  
[https://imgur.com/a/brazilian-bbq-meat-up-giveaways-UkIlKX7](https://imgur.com/a/brazilian-bbq-meat-up-giveaways-UkIlKX7)

  
thank you and hope to see you there!

 ","Carnivore Meat Up Cape Cod + Giveaways if you go! Saturday June 1st, 2024",t2_a8i1ky,0.88,13,1715989489.0,1715989489.0,2,jb_fit,1cujslf
zerocarb,"Anyone else have a similar experience? I also tried copious amounts of caffeine from iced tea (as a test) and it seems like all stimulants have a MUCH more muted effect on me now. 

I can take my ADHD medication and not feel “cracked out” at all. Which is amazing. But I also hardly have a need for it anymore lol. The difference really is night and day. I wonder why. ",Been strict carnivore for over a month now. My adderall has barely effect on me now. ,t2_qg2a6,0.94,13,1714518632.0,1714518632.0,12,zodiactree,1ch6tkn
