subreddit,selftext,title,author_fullname,upvote_ratio,ups,created,created_utc,num_comments,author,id
zerocarb,"I am an 84yr old female, very interested in anti aging and longevity without loss of ability to carry out activities of daily living. Starting my 4th month of strict carnivore and seeing results, especially in energy levels, and brain function.",Never to late to start!,t2_sdcxbmdcw,0.98,134,1712863832.0,1712863832.0,10,Ok_Insect2780,1c1nw98
zerocarb,"I've been eating carnivore for around 3 months now, have recovered amazingly. Though, i now get huge dips after eating food. I still haven't been able to pinpoint exactly what the issue is, so maybe anyone knows what it could be.  
  
I eat my first meal at 2pm after not eating from 6-7pm or so. I start with 500g chicken thigh with 10 eggs and 30-40grams of butter. 3-4 hours afterwards i eat 8 beef hamburgers. 1:1,2 fat ratio. I eat around 65% of my daily calories from fat, i even upped it lately to 70-72% but still the same issues; foggyness, tiredness and inflammation (seems to get back up).  
  
Could it be the chicken with eggs meal not containing enough fat, or maybe even an intolerance?  
  
Any help would be greatly appreciated!","3 months in, sudden no energy and headaches.",t2_iu1uyfqz1,0.97,71,1712085705.0,1712085705.0,44,Both-Description-956,1bu7i6k
zerocarb,"Hey there,

40 y old guy here. Used to be a gym rat in college, basically was eating paleo without really knowing it. For the last few years to a decade I felt sick/drowsy everyday, no energy, always hungry and could not go more than 3-4 hours before having to wat or having hunger pain.

I just tried carnivore for the past 2 months because to me it was close to what I used to do in the past and I figured I had nothing to lose. Well I did lose something: excess weight. At this rate I'll be back to my college weight or better within 2-3 months.

My depression I carried for most of my life is gone.

I don't fall asleep all the time anymore.

I don't feel hungry all the time anymore. I eat once a day.

I basically eat what I always loved (meat).

Now I feel like I can lift a mountain and I'm getting my gym gear and equipment from my storage to start weight lifting and maybe even amateur bodybuilding as I did almost 20 years ago. I'd say my only issue atm are coworkers who tell me I'm going to kill myself following this diet (I don't call it a diet, I see it as a nutrition style), but the one thing they all have in common is they are severely overweight and many of them have diabetes. I don't want to point the obvious, but I figured in a few months to a year my apearence will speak louder than words.",Feeling like I can lift a mountain,t2_14rtvn,0.99,66,1717690727.0,1717690727.0,12,TheEggers,1d9m5m7
zerocarb,"Sometime during this last summer, I passed my 10 year mark of successfully completing my first month of eating this way. Back then, that mattered because we didn't count from our first attempt at eating this way. If we could, I would be able to date my tenure several months earlier. It was a different world back then. This way of eating was virtually unknown. The downside was that you really were going off into the wilderness almost on your own. The upside was that the information was limited to what was known to work. These days, everyone is talking about ""carnivore,"" even though it seems like the majority aren't doing it and don't understand it.  In this post, I am going to take you back. I am going to take you back to the basics. This will tell you what carnivore is and how it is supposed to be done. I'm going to use the words of ""The Bear"" for structure, because he was a modern contemporary example of actually doing it.

Who is the Bear? That's an interesting question. He's not a one-dimensional figure. For our purposes, I will allow him to introduce himself as he did:

>I have been eating the natural human dietary regime for over 47 years now. I do not eat anything whatsoever from vegetable sources. The only things veggie I use are spices. My diet is usually 60% fat and 40% protein by calories. I used to eat 80/20 when younger and about twice as much quantity of meat also, but that seems too much energy at my age, which is 71- even though I am very active.

The Bear found ""The Fat of the Land"" in his early days and started to eat that way. He ate this way until he died in a car accident. While he was still around, he shared his experience and his rules. He had what is normally summed up as 7 rules. At different times, he shared different rules. But, they usually included the same ideas.

From his original thread:

>Eat only from the animal kingdom. Avoid eating carby animal food, like lactose (dairy) and more than a very small, occasional, few ounces of liver.

>Do not measure what you eat and do not worry about variety.

>Do as little cooking of your food as you can tolerate.

>Eat the fatty part preferentially in each meal first, then finish as much of the lean as you want. Leftovers will keep.

>You do not need 'recipes' or 'sample meals' to follow.

>When away from home, no matter if it is a restaurant, family or friends, or business meal, eat only from the animal kingdom, avoid the rest, practice doing this unassumingly and make pleasant, distracting comments if bailed up on it. Learn to politely refuse alcohol.

From ZIOH:

>1- Eat only from the animal world (eggs, fish, red meat and fowl and some dairy are all animal-sourced foods, i.e.: meat).

>2- Eat nothing from the vegetable world whatsoever. (Very small amounts of flavourings such as garlic/chillies/spices/herbs which may be added, are not ‘food’).

>3- On diary: avoid milk and yoghurt (heavy carbs- lactose), use only pure (not ‘thickened’- heavy) cream (read the label), cheese and unsalted butter.

>4- Don’t cook your meat very much- just a little bit on the outside- for flavour- blood-rare or bleu. For this reason I advise against eating pork.

>5- Eat liver and brains only very infrequently- they are full of carbs.

>6- Be sure to have plenty of fat of animal origin at each meal and eat mostly of the fat until you feel you have had enough- you can eat more lean at this point if you like- calories are not important, nor is the number of meals/day. Vegetable oils are not good food.

>7- You do not need any supplements of any kind. Drink a lot of water and do not add salt to anything.

From ""Bear's Words of Wisdom""

>• Eat only food from animals  
• No vegetables  
• Limit liver intake  
• Avoid liquid milk (except for butter and cheese)  
• Eat as much fat as you like  
• Don’t cook your food much  
• Avoid salt  
And the most important one: Eat your meals as a matter of course, don’t waste any time thinking about food–it is merely a way to stay alive, and must not rule your life.  
By the way, for many obese people low carb does not work–only zero carb does (defined as less than 5 g/day).

So, there it is.  If it's not in the above rules, it isn't carnivore or it doesn't matter. Now look carefully, do you see how these rules differ from a lot of the ""carnivore"" plans that people are promoting? Do you see a difference in attitude and approach?

First, ""don't waste time thinking about food."" No recipes or sample meals or daily food guides. Don't measure shit, don't track stuff, don't obsess about purity and details. If you're out to eat, do your best to stick to pure meat, but don't obsess about trace amounts of impurities. That's the path to an eating disorder. Eat like an animal, you are one.  If you happen to end up consuming a trace amount of sugar or flour, while eating out, it's not a huge deal for most people. You move on and your body will be fine.

Second, limit liver and salt consumption. The modern ""gurus"" almost universally try and push over-consumption of both of these up to and way past the point of causing illness. You don't need either, ever. The people pushing these items are making their inexperience and ignorance obvious by putting it on display.

Third, dairy isn't a free food that you can just consume tons of. No milk. Creams and cheeses are more like seasonings than full foods. And butter is fine, but it's not something to cram down your gullet or hide in your coffee to consume extra.

Fourth, seasonings are fine. At least in the trivial amounts you should be using them. It doesn't take a lot to add flavor to meat. So often, I see people freaking out about how they are bored and can't eat. Then I also find out they are doing some super-weird and super-restrictive diet like only beef without any seasonings. That's silly. That's not required. There's no award for dumbest way to be carnivore or hardest time adapting. Actually, the award for hardest time adapting seems to be complete failure to adapt.

That's it folks. It really is. Eat fatty animal meat. Eat often and as much as you want. Stop thinking too much about it. Don't freak out about a little seasoning. Avoid vegetable oils and salt, but you also don't need to freak out and obsess about perfectly avoiding them. If you're thinking about this, you're making it harder than it is. And, yeah, carbs do still count. That's especially true for obese people. And, that means 0-5 g/day or you're going to have a bad time.",Back to the Basics with Bear,t2_9jt9p,0.93,63,1729107882.0,1729107882.0,14,partlyPaleo,1g586uz
zerocarb,"Hey first off thanks for being a great and informative community!

So I am 35 male 6'4 240 lbs been doing carnivore for 7 months now. The first 5 months or so I REALLY struggled with hydration. Being dehydrated presents a lot of symptoms. I almost gave up until I came across Dr Anthony chaffee and Steak and butter gal talking about not adding salt anymore. I decided to give it a try.

It was like a light switched on I've never felt better. It does make me sad thought I can not add salt to any of my food with out having negative results.

How rare is it that people can't tolerate added salt? Because most knowledgeable people say salt to taste, but I can't even do that. 

I drink when I'm thirsty and eat when I'm hungry usually 1 to 2 ribeyes with some ground beef.

Thanks.",To much added salt this whole time.,N/A,0.96,60,1726315661.0,1726315661.0,67,N/A,1fgkkpi
zerocarb,"Just figured I would share my experience after flirting with carnivore over the last year and very strict of the last few months. This last month has been insanely successful.

* My relationship with my wife is 10x better. 
* Chronic sinusitis is GONE. I rarely get sick anymore. If I do, I get over it quick. I used to be sick all the time.
* I can actually focus and read things.
* Misophonia is vastly improved, (please chew with your mouth closed)
* Depression.
* Anxiety.
* Tinnitus.
* Don't need as much sleep.
* Allergies
* I have been in a fantastic mood.
* Forearm tightness is gone.
* Dandruff is gone.
* GERD is gone
* Much leaner, can do more pushups 



Advice if you are trying this:

* I have slow gallbladder and sludge, magnesium citrate as soon as I am done eating helps me tremendously. I got an ultrasound and it looks like there is not a whole lot left thank God.

* I still had quite a bit of inflammation and issues with dairy, so I cut out dairy.","list of things that has VASTLY improved over the last couple of months, and some side notes",t2_11wrjt,0.99,56,1717090073.0,1717090073.0,11,arm0rist,1d49jrm
zerocarb,"Well, if it isn't confirmation of what we all here know right?

https://arstechnica.com/science/2024/03/human-gut-bacteria-that-can-digest-plant-matter-probably-came-from-cows/",Article: Urban humans have lost much of their ability to digest plants,t2_iyik7,0.9,52,1710508461.0,1710508461.0,12,lambdaba,1bfdorb
zerocarb,"Hey guys, I know the ground beef vs steak nutrition has been asked a million times and the general consensus is that they're pretty much the same. I mostly eat ground beef due to budget with the occasional steak a couple times a month. However, I've noticed when eating steak my libido is much better, for example my morning wood is normally just OK maybe something like 80% strength. The morning after I eat steak though, usually ribeye, my erections and libido are much much stronger, not just a minor difference. I'd normally chalk it up to coincidence but it's happened every time I have a steak the night before. Is there any possible difference in vitamins/minerals whatever for this? I usually eat 20% fat ground beef as well. ",Better libido with steak over ground beef?,t2_vnabm,0.83,53,1718199721.0,1718199721.0,44,golfli,1de6ydy
zerocarb,"I'm 73 and need to lose about 40 lbs. My doctor suggested the Mediterranean Diet, but it is making me sicker. I found I feel better when I eat more meat.

I had tried Carnivore before, but just jumped into it with no transition, and it made me very,very sick (DUH!), so I just surmised it wasn't for me. I'm ready to try again, but I need to transition very slowly, since my body is used to eating just about all carbs all day long, I have lupus, and because at my age, my body takes longer to adjust to things.

What do you think of this plan?

I want to start at 100 carbs a day, which is much lower than I'm doing now, but probably won't mess me up too much.

Every 4 days I will drop down 10 carbs - don't know where I got that number, but I remember reading somewhere that it takes 4 days for your body to start to adjust to a new food, so it sounded about right.

Once I get to 20 carbs, I'll drop one carb a day until I get to zero.

So that's 2 months of transitioning. I feel like doing this very slowly, I can avoid most of the worst ""keto flu"" symptoms, and not go through what I did on my first try.

Feel free to tell me what is right or wrong with this, and what I need to tweak. TIA",Transitioning from Mediterranean diet at age 73,t2_vcykv,0.95,51,1716309462.0,1716309462.0,16,anybodyanywhere,1cxca00
zerocarb,"I am posting this in other subreddits, but enjoy and trust this one so I wanted to ask it here, too. I exclusively cook with cast iron and will often crank the heat up on high and cook with leftover animal fat or butter. Is there any negative consequence of doing this? 

  
It is essentially frying the food in a fat, and I feel like I'm trained to think that cooking foods in this way is inherently unhealthy due to deep fried foods that are done with other types of oils. Does the type of oil matter or is this still causing a breakdown of the foods and causing something to happen during the cooking process, such as how trans fats develop and whatnot. 

  
I may be misunderstanding much of that process but am hoping to get clarification.",High heat cooking with animal fat and butter,t2_5r0fb8w8,0.92,43,1708805960.0,1708805960.0,24,External_Poet4171,1az48c9
zerocarb,"So from my time doing zero carb/carnivore people always talk about salt as one of the parts of the diet. However, I've been reading through some of the older zero-carb stuff e.g. [https://www.zerocarbhealth.com/the-bear-on-salt/](https://www.zerocarbhealth.com/the-bear-on-salt/) and I've seen that a lot of the older long-term guys don't add salt and seem to do fine.

The other thing I noticed is that the same people don't seem to need electrolytes. Also, it got me thinking that the rise of everyone on carnivore needing electrolytes could be linked to adding all this salt? Perhaps adding extra salt sends everything out of whack? I have learned that everything in the body has a reaction when we do things in excess in one way. 

I also noticed that in the older zero-carb stuff they talk about having patience with teething problems crossing over. e.g. not going straight to electrolytes but waiting things out for the body to adapt. 

So I've decided to do a test and stop adding salt to my diet for the next 1-3 months and see what happens.  Currently, my diet is beef, butter, salt, water and the odd egg yolk if i make burgers. 

Am now getting regular beef trimmings from the butchers so moving to lion diet for next 3 months (and onwards if I feel good). But going to try doing it WITHOUT added salt as well.

I expect intiially I will find the meat tasting bland but I want to see if this changes and if it is just because I have gotten reliant on salt. Maybe I ill be fatigued in the cross -ver. But want to apply some patience and see.",Thinking of dropping added salt - thoughts?,t2_4gld8b3y,0.88,35,1719391254.0,1719391254.0,42,GazingIntotheAbyss1,1dotr7n
zerocarb,"
Best in terms of satiety, nutrients density, energy etc. dont need to be in a caloric deficit that can negatively impact hormones etc apparently.   

If you want to lose weight, it’s as easy as eating meat until you’re full, twice a day.
There is no better way to lose weight. You will stay satiated 24/7, eat one of the most nutrient dense foods on the planet, feel good energy wise and shred weight with ease.

Is there even anecdotes where someone did NOT manage to lose weight from eating only meat, salt and water?",Is the carnivore diet the best WOE to lose weight?,t2_qmdc0,0.72,30,1730345877.0,1730345877.0,82,ThinkingApe,1gg5ka5
zerocarb,"hi everyone, hope you are all splendid.

In my country (brazil), every salt is fortified with iodine.

Since salt is something that over time we tend to use less (and some quit it),

My questions are:

* if i stop salt (as many did), will i have problems with iodine?
* meat alone has enough iodine? (since i eat mostly meat and tallow)
* i saw that cows in some places receive suplementation, but.. how we know? this means that if they dont receive, we get sick? since goiter (dont know if it is the right term. researched on google translate. In brazilian portuguese this disease is called bócio) is a thing.

EDIT: I tend to think we will be ok, when i look at the bear writings for example. But he use to eat dairy as far as i know. Stephansson use to eat lot of fish (and fish today is a concern cause of pollution).

Edit 2: thanks everyone for the answers!",Iodine - Meat has enough?,t2_9pzvxc1q,0.95,33,1723135139.0,1723135139.0,41,Safe-Blacksmith6992,1enapcj
