subreddit,selftext,title,author_fullname,upvote_ratio,ups,created,created_utc,num_comments,author,id
zerocarb,"Hello. 👋  
I don't have a particular reason for posting, aside from saying hello to everyone.

Maybe this helps someone down the line.

\-------------

I'll start with my current plans going forward, some advice, and then end with my history with zerocarb.

\-------------

Started yesterday. (again)

I find it easier to count the total meals instead of the total days, so where I can, I'll post a quick picture of each meal to [my subreddit](https://www.reddit.com/r/xikini/). I know I'll probably forget to take a picture here and there, and on those meals I'll just write a quick blurb about what I ate.

I've more or less dialed in what I enjoy and can afford to eat.

Basically intending to eat hamburger patties most meals, with 2 meals a week of salmon. Throw some other foods in there if it fancies me

I'm going to put cheese on the hamburger patties to help transition, and then start going with just hamburger patties after that. 

Two reasons there. I've noticed that I don't enjoy the cheese as much recently, and historically I know cheese affects my hunger signals. Keeps the cravings around. oh and thirdly, I want to try with no salt for awhile.

The food choices are mostly down to convenience and cost.

My meal plan is roughly $75/week.

I live in Canada, and the food prices are just dumb. Eye of round is about $20/lb, and going for new york strip / ribeye / porterhouse, you're looking at $34, $52, $47 per pound. So, eating what I can afford mostly.

\-------------

I've been on/off zerocarb since 2019, so here's my advice.

► First week transition is the hardest.  
\-- It never really gets easier, so if you're able to, just stick with it. I promise you'll be happier.

► Staying with this way of eating is mostly a mental challenge.  
\-- If you live alone, I imagine this is quite a bit easier, or having a buddy that's trying to stick to a diet.  
\-- The carb cravings will disappear around week 3.  
\-- After that, the only thing you'll get a craving for is fat. 

I mean, that's basically it aside from the generic advice.

► Salt to taste or not at all.  
► Drink to thirst. Don't force yourself to drink some set amount per day.  
► If looking for food, I just check if the fat:protein ratio by gram is equal or skewed higher towards fat.  
► Roughly 1:1 ratio is 70% of your intake as fat. 2:1 is 80%.  
► Don't force yourself to eat. Just eat when hungry.  
► If your appetite for meat in general plummets, just wait it out. Hunger is a fantastic seasoning.  
► I highly recommend buying an assortment of different meat when first starting out. Figure out what your body enjoys.  
► If you are having toilet trouble.. eat smaller meals, don't render the fat as much and drink less water near meal times.  
► Don't play around with electrolytes. Your body does it on it's own. Let it do it's thing.  
► Any and all symptoms during transition are unique to the person. Honestly until you're like 6 weeks in, just assume strange shit is going to happen. Ask about it if you're concerned, but by and large the response is just going to be 'yeah, that happens to some people and not others. You're fine.'  
► I don't recommend trying the recipes out there to make carnivore bread / pizza / et cetera.  
► I instead recommend to embrace the simple nature of this way of eating instead of attempting to imitate the foods you previously enjoyed.  
► Weight loss is not a goal of this diet. Or at least shouldn't be your primary reason. Eating for health is.  
► I would argue that weight/body normalization is a better description of what happens. You might increase your weight or reduce it, but your body is going to shift towards being healthier. No matter what happens to your weight, in the mirror, you're going to look better.

\-------------

After transition, overwhelmingly the hardest mental challenge for me is also the greatest benefit of the diet, the monotony.

I've said this before, but the way you just exist, with no ups/down in energy.. just a steady even flow. The effortlessness of eating a meal and being able to just continue on with your day. Nothing hurting randomly. Being able to exercise with no pain the next day. Using the bathroom once every 3-4 days instead of 3x a day.

Everything is just.. simple. Streamlined.

There's nothing to complain about.

Somehow this just deals me psychic damage, and I don't know how to cope with it.

\-------------

Alright into the history.

Looking back at my wasted attempts over the years to transition really hurts, but here it is.

I originally started with trying to lose weight on a keto diet. For exactly 2 days, before I jokingly typed into google 'keto without vegetables', and unwittingly found the zerocarb threads.

That was in March 2019, and I went for 5½ weeks, until I went down my parents for vacation, and stupidly thought the transition was easy and I could take a week off and come back onto it after.

Yeah, turns out, not so much. I spent so much mental energy the first time around that I couldn't stick to the diet again.

During those 5½ weeks I had a couple of staggering changes.

The first was brain fog. I was actually at the point where every thought.. had a delay. You're just grasping at the air trying to connect thoughts together, with 200ms delay between them. It's frustrating to explain as you can't really grasp how difficult the brain fog is without experiencing it first-hand, but the thought-line would more often then not just fizzle out, and never make the full connection to what you were attempting to think about. You know the information is there, but there's no way to access it. And if affects everything in your life.

Anyway, I was honestly convinced that I was just getting older, and my brain was simply getting worse. There was no cure. Not even a hint of chance. And then like 4 days in, it was just wiped away as if the problem never existed. I hadn't read about it happening to others, just blindsided.

It's never come back since.

The other notable side effect is for my eyesight. Around 10-14 days in, it becomes extremely sharp, as when I was in my teens, and then over the next week or so it dulls slightly. Still a marked improvement overall, each time I transition, and it's something I've come to look forward to.

Getting a bit of course, let's streamline this a bit.

March 2019, 5½ weeks. On/off never getting past 1 week usually, with a couple months in between attempts, when my health declines enough to force me into trying again. I say trying, but the thought never goes away. I always want to be eating this way, but I keep making excuses.

The main excuse that keeps coming up is the cost. But that's mostly a fallacy, as it's like a $40 difference between a regular diet, and that's only if you never eat out.

At some point you just realize you've tied your emotions up into your lifestyle. It's hard to put into words, but the fact that you're hurting, sabotaging yourself, it draws attention to you, in a negative way. But that's somehow better then people not recognizing you exist? Mind fuckery at it's best.

Sorry, I ramble. Okay, super streamlined.

2019, started. Mostly off with some on diet.  
2020, still on/off, but the time span between attempts gets shorter.  
2021, 2022, 2023, very similar. Some attempts a bit longer. Somewhere in here I got diagnosed with Type 2 Diabetes.  
2024, basically eating zerocarb for 1/3-1/2 of my meals.

Again, not exactly a good track record here. Don't do this. It's frustrating to see the lack of progress over literal years, even though I know the benefits I get.

\-------------

Sorry for it turning into kind of a rant near the end here, but it is what it is.

I guess my final advice is to simply not follow in my footsteps.

Just cut the bullshit and get it over with.

\-------------

Hello. 👋",Hey. I started yesterday and here's my advice.,t2_in6j6,0.86,30,1734210825.0,1734210825.0,16,Xikini,1hecoal
zerocarb,"Welcome to [r/zerocarb](https://www.reddit.com/r/zerocarb).

Our  definition of zerocarb is a carnivorous diet.  We only eat meat and  animal products.  We do not consume plants for nutrients or calories.    Some animal products contain carbs (e.g. dairy), most of those are  acceptable.  Some plant products contain no carbs (e.g. plant oils), and  those are generally not acceptable.

Are you interested in trying a carnivore/zerocarb way of eating?  Do you have simple questions about it? There is a weekly simple questions thread that will be pinned under this post and is the best location for that questions.

The  term 'zerocarb' is historical and dates back to Owsley ""The Bear""  Stanley.  While many members choose to also use other terms, like  carnivore, we will always consider ourselves zerocarb.

If  you are really interested in eating this way, you should read ""The Fat  of the Land"" and ""Bear's Words of Wisdom.""  They are both pinned to the  top of the subreddit in the Free PDFs dropdown.  These are considered  required reading.  If you find some person or website promoting advice contrary to the information in those documents (e.g. Saladino), do not be surprised when we delete it.

We do not have a reddit chat, but there is a place if you want a live chat: [u/LogicalLynx](https://www.reddit.com/user/LogicalLynx) runs it on discord: [https://discord.gg/CR9gPvp](https://discord.gg/CR9gPvp)

# Check the [Let's Get Started: Beginner Questions and Answers](https://www.reddit.com/r/zerocarb/comments/1hcnbez/lets_get_started_beginner_questions_and_answers/) FAQ Thread for how to get started.

# Purpose

This subreddit exists to:

* provide information about the zerocarb way of eating
* provide support for those eating zerocarb and those who want to try or are trying, to eat zerocarb
* provide a community for zerocarbers to interact and share experiences

We are **not**  a debate subreddit.  There are plenty of places for you to discuss the  health benefits of consuming plants.  This is not the place.  We have  heard it all before.  If you are not on a zerocarb diet or transitioning  to one, you are not guaranteed a right to participate here.  Yes, that  means we reserve the right to ban people just for being vegans,  vegetarians, or bots (which don't eat and thus aren't zerocarb). If you  are veg\*n, you may only post in threads tagged ""VEG\*NS ALLOWED.""  If you  post elsewhere, you can be banned.

We do not offer medical advice.  If you are asking for medical advice, your post will be removed.  If you are giving medical advice, your post will be removed.

The  focus of this subreddit is on eating an all-animal-products diet.  Conversations about unrelated topics may be deleted as they are not  appropriate here.  Conversations about other ways of eating, even  conversations about how those ways of eating are misguided, are not  appropriate here.  It is not the purpose of this subreddit to attack or  mock other ways of eating.

This subreddit makes the assumption that you are an intelligent adult and capable of making your own health choices.  We are wary of making recommendations towards children and teens.  If you are interested in an all-meat diet for your child or you are a teen who is interested, we encourage you to work directly with a medical professional.

If you are interested in a meat-heavy diet, one which is almost carnivore but includes some plant foods, which don't cause you issues, *this is not the appropriate place to have those conversations.*  If this describes you, you may have your right to post removed.  There are two potential subreddits that were created to host those discussions.  We have r/carnivorish and r/dirtycarnivores.  Those subreddits are currently small, but you can help them grow.  A responsible person who helps those subreddits become thriving communities will be considered for a moderator position there.

There are  lifestyle choices that you may believe are related to eating this way,  but there is nothing universal here except the avoidance of plant foods.   Those discussions are best when held in subreddits that are  appropriate for them.

# We are not an extreme weight loss subreddit

Weight  normalization will happen with zerocarb.  If you are overweight, you  will reach a healthy weight.  If you are underweight, you will also  reach a healthy weight.   Weight normalization is just a symptom of the  primary goal.  We are about long-term health and wellness.  This isn't  ""extreme keto"" where you get double your weight loss for extreme carb  denial.

We discourage messages  advocating or encouraging food and calorie restriction, even subtle  messages of this manner.  Do not tell people they need to eat less.  Do  not tell people they are eating too much.  Don't tell people they gained  weight because they ate too much or lost weight because they were  eating less.  Don't tell people to eat leaner meat or try fasting.  This is not a debatable subject.  We don't host CICO  discussions here.

From the Bear's Thread:

>I do advise however, that fasting and severely low caloric intake is NOT a very good idea for your health.\[. . .\]The  meat regime does not require fasting, which is what 1100 cal/day is.  You can eat 5000 cal/day and lose bodyfat. You are eating far too  little. Eat 80% (cal) in fat, 20% (cal) in lean. This is instinctive.  Don’t measure. Choose a nice fatty cut of meat, cook very little (blood  rare or bleu), eat mostly of the fat at first, until you don’t feel like  any more fat (built-in response), then eat the lean until satiated.  Save any left-overs in the fridge for later.‘Dieting’ by measuring fat and lean, and restricting caloric intake DOES NOT WORK as a way to acquire and keep a normal body.\[ . . .\]Calorie restriction and/or ‘partial fasting’ are neither necessary nor desirable.

# We are our own Zerocarb Group

We are a cousin to the Facebook groups: [Zeroing In On Health](https://www.facebook.com/groups/zioh2/), [Zero Carb Health](https://www.facebook.com/groups/ZeroCarbHealth/), [Principia Carnivora](https://www.facebook.com/groups/PrincipiaCarnivora/), and [World Carnivore Tribe](https://www.facebook.com/groups/163527891074530/).    But, we are not a direct offshoot of these and exist in our own  right. Many of us are members of one or more of the facebook groups or  other zerocarb groups.  You are encouraged to join other groups that  interest you.  Do not try and argue that we should run our subreddit  differently because these groups may run themselves differently.  We  know that some groups permit discussions that we don't allow here.   Other reddit groups that are distinct but related to ours include r/CarnivoreForum and  [r/carnivore](https://www.reddit.com/r/carnivore/).

# Rules and Behavior

Make yourself familiar with our rules.  The rules are listed in the sidebar of the new reddit.  There are rules listed on the old reddit style, but they are not updated and may not reflect the current rules.  If there is a conflict in the rules, the ones listed on the new reddit are the correct rules.  You are responsible for reading those rules and following them.  Ignorance of the rules is not an excuse for breaking them.

We are pro-health.  That includes sexual health.  Posts which discourage healthy activities, including healthy sexual activities, are not appropriate here.

We usually hand approve all video posts, watching them first.  A video that includes advice or content that is not allowed here will not be approved.  If a video is long, it can take a much longer time to get reviewed.  At times, with heavy moderation loads, we can remove videos without reviewing them first.  Our default reaction is to remove a video, not approve one.

Breaking  any of the above could result in getting your post deleted, future  posts being manually reviewed, and/or being banned from the subreddit.   Using **bold** in your posts is  disallowed by a historical rule.  Breaking this rule usually only  results in our asking you to edit it and remove the bold.   Your posts  can also be removed if they make it obvious that you didn't read this  post first.  ***Please  report posts that you think might violate rules.  The mods don't always  see everything, and we rely on you to alert us to things that we miss.***

# Debatable Subjects

There are some discussion topics where we hold varied opinions.  These include, but are not limited to:

* coffee, tea, and other beverages *\[generally permitted by most\]*
* artificial sweeteners *\[generally not permitted\]*
* salt, spices, and seasonings *\[generally permitted by most\]*
* intermittent fasting and meal timing *\[accepted when it is natural, discouraged when it is artificial and forced\]*
* occasional use of plant oils (like in a mayonnaise) *\[bad stuff, and the least possible amount is the best\]*
* eggs and dairy *\[most people tolerate these well, but they are the first things we think of when people have problems\]*
* organ meats and liver *\[some swear by them, but many people never eat them and are healthy\]*
* grass fed meat or grain finished meat *\[the biggest issue here should be about animal treatment, as the nutritional value of the two categories is insignificant with the amounts we eat\]*

You  will find that many people end up on different sides of the argument  about these.  The *\[text\]* describes the default position of most people.  But, almost all of us would agree that this is arguing  about the last couple percentage points of perfection.  Eating meat (avoiding plant foods) and drinking water gets a person 98% of the way  there.  If spices and cheese help you stick to just eating meat, you're  better off having them than giving up entirely.  In general, we ask that you refrain from suggesting that something from this list is necessary for success.  And, we certainly don't want you telling people to engage in those things were are generally discouraged.

It should be noted that honey is not an animal food.  It is absolutely not tolerated here.  Recommending honey, in any amounts, or trying to argue that it should be permitted will cause the posts to be removed and even first infractions can result in loss of posting privileges.

We  welcome experience reports, even if you struggled or failed.  We  encourage people to try this out and give it a shot.  But, there is a difference between talking about how you're going to try it and asking us how to incorporate plants back into your diet after that trial up.  Trying it and then evaluating is one  thing.   We aren't going to help you plan plant consumption.  Participate here, while you try it.  If your first post is to tell use that you have done it for six months and your left foot exploded and leaked butter all over your couch, you will find us a bit skeptical as to the veracity of your tale.  We don't need you posting ""Goodbye"" posts.

# My post was deleted or doesn't show up

We  get a lot of hate and a bunch of spam here.  If your post doesn't show  up or gets caught in a filter, and you believe this is in error,  feel  free to message the moderators.  If you spot abusive or off-topic posts,  please report them and we will get on top of them as soon as possible.

There is a certain account age and karma, below which your posts will automatically be removed.  We don't post specific numbers, to discourage people from attempting to find ways around them.  Attempting to get around these limitations can result in your account permanently being filtered.  What we will say is that the numbers are not very high and if you participate positively on other subreddits for a couple weeks, you should be fine.

If  you disagree with a post being deleted, you can message the mods and  try and have a reasonable conversation with us.  We allow some moderator  discretion when it comes to approving and deleting posts.  Having an attitude or attacking the moderators will not help you.  It is likely to make us decide against you, and might result in loss of posting privileges here.  Please note the right for moderators to use discretion.  If we do not allow your post, but we did allow a similar post, that does not mean we have an obligation to approve your post. We make no apologies for heavy-handed moderation.  This is a very specific way of eating.  When people try and dilute or change the way we do things, we are not obligated to provide them an area on this subreddit to promote their variations.","READ THIS BEFORE POSTING AND CARNI-CURIOUS [UPDATED Dec 12, 2024] ",t2_9jt9p,0.9,31,1734016590.0,1734016590.0,7,partlyPaleo,1hcna49
zerocarb,"How do I know if

1. I am taking too or too little much magnesium, potassium, or sodium when the symptoms are very similar, AND
2. Which electrolyte(s) may be too high or too low when the symptoms overlap. 

I found this online…

Electrolyte imbalances can occur with both deficiencies and excesses of key minerals such as magnesium, potassium, and sodium (often considered as the ""last electrolyte"" in common discussions). Here are signs associated with too little and too much of these electrolytes:

Magnesium
Too Little (Hypomagnesemia):
- Muscle cramps or spasms
- Weakness
- Fatigue
- High blood pressure
- Irregular heartbeat
- Numbness and tingling
- Seizures
- Mood changes, like agitation and anxiety

Too Much (Hypermagnesemia):
- Nausea and vomiting
- Lethargy
- Muscle weakness
- Urinary retention
- Low blood pressure
- Irregular heartbeat
- Cardiac arrest in severe cases

Potassium
Too Little (Hypokalemia):
- Weakness and fatigue
- Muscle cramps and twitching
- Muscle aches and stiffness
- Abnormal heart rhythms (arrhythmias)
- Digestive problems
- Tingling and numbness

Too Much (Hyperkalemia):
- Fatigue and weakness
- Numbness and tingling
- Breathing difficulties
- Chest pain
- Palpitations or irregular heartbeats
- Nausea and vomiting

Sodium
Too Little (Hyponatremia):
- Nausea and vomiting
- Headache
- Confusion
- Loss of energy and fatigue
- Restlessness and irritability
- Muscle weakness, spasms, or cramps
- Seizures
- Coma

Too Much (Hypernatremia):
- Thirst
- Weakness
- Nausea and vomiting
- Confusion and irritability
- Severe cases can lead to seizures and coma

It's important to maintain a balanced intake of electrolytes, as both deficiencies and excesses can lead to serious health issues. Changes in electrolyte levels can be indicative of underlying health conditions, so it's advisable to seek medical advice if you experience symptoms related to electrolyte imbalances.",Too much or too little electrolytes,t2_lyrqk,0.86,29,1709015752.0,1709015752.0,19,mattstaton,1b158bz
zerocarb,"Hi,

(35m) I'm living through an extremely tough and stressful moment in my life, dealing with grief, and I have absolutely no appetite. Should I fast or force myself to eat? I'm scared of falling off the diet, resorting to pizzas and junk food, and destroying my health, as well as regaining all the weight I lost. I was 270 lbs and now I'm 235.

Edit: I really appreciate all of your kind messages; they mean a lot to me.",Sh*t hits the fan: I need advice,t2_dajm78lq,0.91,29,1709913967.0,1709913967.0,33,tivied,1b9robx
zerocarb,"Hey guys,

I'm curious whether or not you guys exercise? Exercise is supposed to be so beneficial and important for people.

  
However I found out that since I've gone carnivore, my body composition is just nicer than 90% of people anyways. IDK my bodyfat percentage, but I'm quite lean and I don't have a ripped 6pack but you can definitely see an outline of my abs and no fat around lower back etc and more muscular than average. I'm not trying to be a bodybuilder so I don't see much point in doing exercise... I guess it is important to note I was a highschool athlete and in my twenties I did some powerlifting and had a pretty serious gym routine (I'm currently 34). Only exercise I get is my 10,000 steps a day right now by walking with my dog twice a day.",Do you guys exercise much?,t2_c95ni,0.88,26,1716804952.0,1716804952.0,25,SlCKXpT,1d1oaoh
zerocarb,"Almost 5 months in, just meat, water, salt and a single shot of coffee in the morning. Very occasionally I'll have a slice of cheese or a little kefir. 

First 2 months I noticed that I didn't need very much sleep (6-7 hrs) and felt rested in the morning anyway. 

Last two months however I've needed a lot of sleep (8.5-10 hrs) to feel rested. This is my usual pre-carnivore amount actually. 

I haven't changed exercise regime or much of anything else. What are others' experiences with sleep? Any ideas to explain the change? Does it really matter?",Sleep changes (5 months),t2_10rcmi,0.96,24,1706672585.0,1706672585.0,17,Devils_Advoca8,1af8a2a
zerocarb,"Hi all. Suffer from mild rosacea (about a year now) I'm a 44 year old man. Been transitioning to carnivore over the last 6-7 weeks, only eating ground beef, steak, occasionally chicken and pork (beef 85% of the time) butter, eggs, some raw milk/cheese. Have definitely seen benefits (water weight loss, consistent energy, better sleep) but I've noticed my rosacea flare up this week. Cheeks/forehead flushed, horrible spots on cheeks. I'm trying to give my body as much time as it needs to fully adjust, the skin issue is just frustrating. Wondered if anyone had any advice for me etc. Many thanks.","Carnivore for around 6 weeks, rosacea issues",N/A,0.95,21,1723120579.0,1723120579.0,33,N/A,1en4ts4
