comment_id,parent_id,post_id,comment_body,emojis
m3f1cya,t1_m3d28lr,1hjo3wa,So true! I analyzed quite a bit of recipes before making the selection. Showcasing the diversity was one of my main goals. Thank you for noticing!,
m39p2b6,t1_m38htv0,1hjo3wa,"Cool! Happy you found my post.   
Any other recipes in mind that you would like to see compared?",
m39osh5,t1_m38qvt4,1hjo3wa,Thank you! It was a true baking marathon..,
m39ot8x,t1_m38t0v1,1hjo3wa,Thank you!,
m3f1dvb,t1_m3bxhw5,1hjo3wa,Thank you! :),
m4nx0sf,t1_m3h1jkl,1hjo3wa,"23 (21 banana for the batters + 2 for toppings)  
All 6 recipes called for 3 bananas each also two had a banana on top.  I had small ones, so I added a bit more than 3 per recipe. I went with 300g of banana per recipe. Using identical amount of banana allowed for a fair comparison.",
m6lqybv,t1_m6epvar,1hjo3wa,"Thank you for taking the time to write this! It means the world to hear that my posts are helping the community! Also, as someone who loves photography, I really appreciate the compliment. 

I often feel like food speaks louder than my words. I usually don’t tell people (who don’t know I’m vegan) that the food I make is vegan until the end of the meal or tasting. It allows tasters to approach the flavors with an open mind, free of any expectations. 

Every ‘’Really, that was vegan?’’ gives me hope that the question eventually turns into a seed of curiosity. 

Someone recently asked for a video comparing vegan brownie recipes, as it is a relatively simple treat that can be made on weekdays. I think I’ll do that next. Your red velvet suggestion has been pinned to the idea board! Thank you for the links!",
m39owjv,t1_m38pc2c,1hjo3wa,Thank you for noticing! ❤️,❤
m3aj3fm,t1_m39oguf,1hjo3wa,"It was a website/creator! I tried to use the way back machine when I first realized the site was gone, but no luck",
m3f1ypr,t1_m3f1cya,1hjo3wa,"Hey there EcotarianEats - thanks for saying thanks! TheGratitudeBot has been reading millions of comments in the past few weeks, and you’ve just made the list!",
m3a6390,t1_m39p2b6,1hjo3wa,I would be curious to see different vanilla or chocolate cake recipes! Nora cooks or It Doesn’t Taste Like Chicken are usually my go to’s for any baked goods,
m87fdx6,t1_m6lqybv,1hjo3wa,Ooohhh... I'll be keeping eyes peeled for the brownie post too!!! Thank you 🎂,🎂
m3bno5u,t1_m3aj3fm,1hjo3wa,"I tried that this morning when I read your first comment. Yeah, didn't work..",
m3boqnq,t1_m3a6390,1hjo3wa,"I've got you, I already made a video comparing chocolate cakes. [https://youtu.be/WM\_IidwO0Ow?si=qU5CR6xrDxSik6p-](https://youtu.be/WM_IidwO0Ow?si=qU5CR6xrDxSik6p-) I might do vanilla cake at some point too.  
If you prefer pictures, here is the post [https://www.reddit.com/r/VeganBaking/comments/1aimv7k/i\_tested\_3\_vegan\_chocolate\_cake\_recipes\_from\_well/?utm\_source=share&utm\_medium=web3x&utm\_name=web3xcss&utm\_term=1&utm\_content=share\_button](https://www.reddit.com/r/VeganBaking/comments/1aimv7k/i_tested_3_vegan_chocolate_cake_recipes_from_well/?utm_source=share&utm_medium=web3x&utm_name=web3xcss&utm_term=1&utm_content=share_button)   
Many have told me about Nora cooks. I feel like I really should try her recipes too. Thank you.",
luxe9qa,t3_1ghcdkk,1ghcdkk,Thanks for sharing! It looks incredible,
luxeccv,t3_1ghcdkk,1ghcdkk,They look and sound delicious! I need to try these. Am I right in thinking Nussecke translates to nut corners? :),
lux58ax,t3_1ghcdkk,1ghcdkk,Why are they sitting on a bed of almonds? Is there a mistranslation?,
luwu75z,t3_1ghcdkk,1ghcdkk,Kannst du das Rezept auf deutsch schicken? Oder hast du es wo anders her?,
luxgysy,t1_luxeccv,1ghcdkk,"thank you
yes i guess its an adequate translation!",
lux5x1n,t1_lux58ax,1ghcdkk,the almonds are only here as a pic enhancer :),
m5sli0p,t3_1hve4rd,1hve4rd,"Please share the recipe, those look to die for!",
m5sj74f,t3_1hve4rd,1hve4rd,They look delicious.,
m5suv6v,t3_1hve4rd,1hve4rd,"Ooooh, like an orange creamsicle 😍
Your wife did a wonderful job! Were these baked for a specific event, or was the specific event just to bake delicious cupcakes? 😋",😍😋
m5u8hww,t3_1hve4rd,1hve4rd,"Compliments to the wife 💐⭐ Treasure her, someone baking and decorating like that deserves all the tea and treats in the world 💖",💐⭐💖
m67m9zp,t3_1hve4rd,1hve4rd,Thank you! I will try this for the next Birthday coming soon :),
m7103qd,t3_1hve4rd,1hve4rd,I like how soft the buttercream looks on top. Too often it ends up crunchy,
m5ti9ru,t1_m5sli0p,1hve4rd,"Hello. My wife just tweeked this recipe a bit. Where it calls for lemon, she used orange, and w the frosting she used 1/2 vanilla extract and half orange extract to give it a creamsicle feel. They’re delicious! https://www.noracooks.com/vegan-lemon-cupcakes/",
m609s8r,t1_m5suv6v,1hve4rd,Just another typical day (she is a keeper for sure🤩),🤩
m5vk7y3,t1_m5ti9ru,1hve4rd,You rock and your wife is a wizard! Thank you for sharing,
m3vaq0h,t3_1hmn0c9,1hmn0c9,That's stunning!,
m3vdf85,t3_1hmn0c9,1hmn0c9,I love the sound of “gingerbread construction” and “gingerbread structure” 🚧👷‍♀️,🚧👷♀
m3vgdus,t3_1hmn0c9,1hmn0c9,This is gorgeous OP! your piping skills look incredible to me.,
m3veqd7,t3_1hmn0c9,1hmn0c9,Looks absolutely amazing! What gingerbread recipe did you use?,
m3vbq16,t3_1hmn0c9,1hmn0c9,your piping skills look awesome already! i especially love the little wrapped candy up top. the entire carousel is just gorgeous.,
m3vc1u7,t3_1hmn0c9,1hmn0c9,This is amazing!! How'd you get the holes to be the perfect size for the straws?,
m42zb4u,t3_1hmn0c9,1hmn0c9,"I made a carousel one year too! Did yours take an entire weekend like mine did?

[https://vegandollhouse.com/recipes/vegan-gingerbread-carousel/](https://vegandollhouse.com/recipes/vegan-gingerbread-carousel/)",
m3whuhv,t3_1hmn0c9,1hmn0c9,Wow!!! So beautiful!,
m3wx2o5,t3_1hmn0c9,1hmn0c9,This is amazing! What is your icing recipe?,
m3wykje,t3_1hmn0c9,1hmn0c9,That is lovely and impressive!,
m3xcfnt,t3_1hmn0c9,1hmn0c9,🥰,🥰
m3ylqj8,t3_1hmn0c9,1hmn0c9,"It's lovely,  u both did a great job.",
m428hxg,t3_1hmn0c9,1hmn0c9,That's fabulous 😍 Really appreciate your hard word..keep it up,😍
m436nsj,t3_1hmn0c9,1hmn0c9,"it's so pretty! I love the mix of the natural gingerbread and the colors, it's very understated but still whimsical. Would love to know what other structures you guys have created!",
m3zn5u2,t1_m3veqd7,1hmn0c9,"Thanks! We adapted one from vegan cookies invade your cookie jar, I've never really written it out properly though. I'll do my best >\_< The recipe make *a lot* of gingerbread, though we still needed 2x for the carousel + some sugar cookies for contrast.

**Dry Ingredients**

* 750g plain/all purpose flour
* 1.5tsp baking powder
* 0.5tsp baking soda
* 1tsp salt
* Spice blend (4.5tsp ginger; 1.5tsp nutmeg & cinnamon; scant 0.5tsp cloves) ^(we like ours fairly well spiced, scale up/down to taste)

**Wet ingredients**

* 220g buttery nuttelex (Australian spreadable vegan butter, has 65% fat content)
* 245g molasses
* 450g granulated sugar
* 60ml milk + 1 tsp egg replacer powder (we use orgran but bob's red mill or the like would work)

**Method**

1. Melt sugar + molasses + butter over medium heat, the sugar does not need to be completely dissolved.
2. Add milk/egg replacer, whisk to combine.
3. Sift + fold in dry ingredients in thirds to form a stiff, slightly sticky dough.
4. Divide into two parts, wrap in plastic and refrigerate for at least one hour or up to 3 days.
5. Before rolling, preheat oven to 180°C/350°F.
6. Roll dough over baking paper or on a floured surface to about 6mm for structural pieces or 4mm for non-structural.
7. Cut shapes and bake - baking times depend heavily on the size of your shapes, small cutouts may take as little as 8-12 mins but the larger octagons (28cm diameter) we used for the carousel took over 20 minutes to be fully stable.
8. We usually re-cut the shapes once immediately after removing them from the oven to allow for crisp edges.
9. Allow the gingerbread to cool, then decorate and assemble as required.",
m3zng75,t1_m3vc1u7,1hmn0c9,"Thanks! The straws are sitting between the base and roof, we cut bbq skewers to size and stabbed them into the base which added a bit of extra support 😊",😊
m3zjgz6,t1_m3wx2o5,1hmn0c9,"Thanks! We use [this one](https://cookingoncaffeine.com/vegan-royal-icing/) by cooking on caffeine, it's aquafaba-based and dries out well 😊The recipe doesn't call for it but I usually add a little (\~1tsp) vanilla extract to it as well.",😊
m41exc1,t1_m3zng75,1hmn0c9,"Oh, that's clever!  Which makes sense since the whole thing is clever in its entirety as well!",
m3zosz2,t1_m3zjgz6,1hmn0c9,Thank you! I will have to give this a try! I've used the icing recipes with corn syrup before but they don't set as crisp as it looks like this does. I will have to give this a try! ,
luq9l1u,t3_1ggk3qv,1ggk3qv,Thank you for the recipe!! This looks amazing.,
luq8dzg,t3_1ggk3qv,1ggk3qv,looks sooo good thank you for sharing this (:,
luriq8v,t3_1ggk3qv,1ggk3qv,Simply put  ⭐WOW⭐ This is my Christmas dessert.Thank you for sharing a delicious and amazing recipe 💐🫶,⭐⭐💐🫶
luspsg6,t3_1ggk3qv,1ggk3qv,This looks delicious,
luu36ws,t3_1ggk3qv,1ggk3qv,This looks divine 😍,😍
luqbfau,t3_1ggk3qv,1ggk3qv,Looks very good! Props for the recipe!,
lur8glu,t3_1ggk3qv,1ggk3qv,Can you speak to the gastronomic effect of the sparking water? Fabulous cake!,
luraa6e,t1_lur8glu,1ggk3qv,"thank you!
sparkling water is great to make fluffy and light sponge cakes, I got the idea from [this website](https://www.zuckerjagdwurst.com/en/recipes/vegan-sponge-cake-so-fluffy-and-easy) and I've been making my sponges based on it ever since. also it's easy to adapt to versions with cocoa or hazelnuts etc",
luram4b,t1_luraa6e,1ggk3qv,"Thanks, the cross section shows how delicate the crumb is!! So delicious!",
lo4xamx,t3_1flo0it,1flo0it,Thanks for posting the recipe! Yours looks great and I’ll have to give it a try.,
lo5ch2m,t3_1flo0it,1flo0it,This looks gorgeous and delicious 🤤,🤤
lo608g8,t3_1flo0it,1flo0it,domestic gothess is theeeeeee best,
lo75evz,t3_1flo0it,1flo0it,"I love this recipe too! This looks sooo good, I'm jealous!",
lo7wqgz,t3_1flo0it,1flo0it,looks amazing!!! I love domestic gothess. did you freestyle the pistachio filling or does she have a recipe for that too?,
lo9epmw,t3_1flo0it,1flo0it,Yummmmmm!!! I had a recipe that I veganised but I'm going to try this one. Thank you!,
lo5e5hv,t3_1flo0it,1flo0it,Another babka?,
lo5ykry,t3_1flo0it,1flo0it,But how does it look *inside*?,
lo9yphj,t1_lo4xamx,1flo0it,Thanks!,
lo6xiqs,t1_lo5ch2m,1flo0it,Thanks!,
lo7x0b5,t1_lo7wqgz,1flo0it,I grind up salted pistachios with powdered sugar and melted vegan butter and spread it as the filling,
lo9kbsh,t1_lo9epmw,1flo0it,It's always a hit!,
lo6xk05,t1_lo5e5hv,1flo0it,I've never posted one before,
lo9yvtx,t1_lo5ykry,1flo0it,I don't have a picture of this particular one as it was for someone else,
lo7jud6,t1_lo6xk05,1flo0it,"Sorry, I was trying to make a joke. It was a line from the TV show Seinfeld. Your baking looks amazing! Again, sorry.",
lo7wumg,t1_lo7jud6,1flo0it,"It’s a good joke! Ha, ha. Totally remember that episode!",
lpkdefr,t3_1fsgiv4,1fsgiv4,So pretty!,
lpkirle,t3_1fsgiv4,1fsgiv4,Wow! That’s literally beautiful. Do you recommend that cookbook?,
lpkf4g3,t3_1fsgiv4,1fsgiv4,[removed],
lpkn4mz,t3_1fsgiv4,1fsgiv4,You made it look better than the photo 🫶🏻,🫶🏻
lpl13k3,t3_1fsgiv4,1fsgiv4,"It looks AMAZING! How did it taste? 

Is it the Crossroads cookbook by Tal Ronnen?",
lpkmaxb,t3_1fsgiv4,1fsgiv4,Wow! Yours looks even better than the one in the book! Beautiful!,
lplvb37,t3_1fsgiv4,1fsgiv4,plz be my friend 🤩 this looks scrumdiddlyumptious!!,🤩
lppy6qg,t3_1fsgiv4,1fsgiv4, Now that looks like a really good chocolaty chocolate cake. Moist and all. Yum!!,
lpkdk73,t1_lpkdefr,1fsgiv4,Thank you!! I almost felt bad cutting into it 😂,😂
lpkjkv0,t1_lpkirle,1fsgiv4,1000% yes! So many amazing recipes in here. My cookbook club has repeated it three times 😂,😂
lpkidab,t1_lpkf4g3,1fsgiv4,💛💛 thank you! It was a treat for sure.,💛💛
lpkntkk,t1_lpkn4mz,1fsgiv4,Thank you!! 😊,😊
lpl1sj0,t1_lpl13k3,1fsgiv4,"Thank you!! It was RICH but such a treat. I guess that's not surprising when they put 'decadent' in the recipe title 😂

 And yes, that's the one! One of my favorite cookbooks!",😂
lpknq7i,t1_lpkmaxb,1fsgiv4,Thank you! 😆,😆
lpth45m,t1_lpl1sj0,1fsgiv4,"I’m always cautious with terms such as ‘decadent’ but this looks gourmet, eat it and not even care how many calories it has! 

That cookbook is in my husband’s booktopia list of titles I’m after. Perhaps this Xmas I might be gifted with a copy! 

Glad to hear your positive review - I’ve made many poor choices when purchasing vegan cookbooks which turned out to be disappointing. 

Cheers for all the inspo and info!",
lz9qzdv,t3_1h0kup2,1h0kup2,Clean 🥖 10/10 ✨,🥖✨
lz52tdi,t3_1h0kup2,1h0kup2,Congrats! I’m searching for gluten-free vegan bread recipes — please post any site or book suggestions!,
lz5d2nt,t3_1h0kup2,1h0kup2,That looks really good!,
lz6erdc,t3_1h0kup2,1h0kup2,Gorgeous 🤩,🤩
lz8potl,t3_1h0kup2,1h0kup2,Pretty,
lz4r8ig,t3_1h0kup2,1h0kup2,"Flour, sugar, yeast, water. Bread can be pretty easy and thankfully a lot of it is inherently vegan to begin with. Looks good though.",
lzait6m,t3_1h0kup2,1h0kup2,You did it!!! 🥰,🥰
lzi0js7,t3_1h0kup2,1h0kup2,Looks awesome,
lzahk68,t1_lz9qzdv,1h0kup2,😃😊,😃😊
lz7taf5,t1_lz52tdi,1h0kup2,"theloopywhisk.com is excellent for gluten-free bread recipes and gluten-free and vegan baking recipes in general. Can’t recommend it enough. I’ve got quite a lot of experience making gluten-free bread that’s actually good, so just ask if you have questions about ingredients or whatever.",
lz5oa1k,t1_lz5d2nt,1h0kup2,Thanks! I'm very happy with it.,
lz8qo0x,t1_lz6erdc,1h0kup2,Thank you! I'm so happy about it.,
lz8qtkn,t1_lz8potl,1h0kup2,Thanks! I'm always tryin' my bestest.,
lz79w3z,t1_lz4r8ig,1h0kup2,No need for sugar. Salt makes it taste nice though.,
lzb46lx,t1_lzait6m,1h0kup2,😃🤗,😃🤗
lz968od,t1_lz79w3z,1h0kup2,"Sugar isn't for the bread, It's to help activate the yeast. By time you pour the water and yeast in the sugar should already be consumed. Bake often?",
lzalkfg,t1_lz968od,1h0kup2,"Yes, I have baked all my own bread for the past 15 years or so. The yeast does just fine consuming the carbohydrates in the flour, extra sugar is unnecessary. Thanks for the rude and patronising tone though!",
kovcltr,t3_1aimv7k,1aimv7k,"Here are links to all three recipes :  
https://thebananadiaries.com/best-vegan-chocolate-cake-ever/   
https://makeitdairyfree.com/the-best-vegan-chocolate-cake/   
https://www.pickuplimes.com/recipe/easy-vegan-chocolate-cake-74   


In case you are interested, I made a video comparing the ingredients, methods and taste.   
https://youtu.be/WM\_IidwO0Ow",
kovfu6o,t3_1aimv7k,1aimv7k,"The time, the effort, the taste testing…  Thank you for putting this comparison together. 
Whenever I come across these types of posts (cakes, cookies, etc.) I always envy the person! 

These all look amazing. Do you plan to do more in the future? ",
kovdi52,t3_1aimv7k,1aimv7k,which one is your favourite??,
koveg3o,t3_1aimv7k,1aimv7k,I can help to eat these away,
kovkyrk,t3_1aimv7k,1aimv7k,King Arthur Flour website also has a couple amazing chocolate cake recipes that are easily made vegan. My absolute favorite is the Sourdough Chocolate Cake and second is the Simply Rich Chocolate Cake!,
kowmchz,t3_1aimv7k,1aimv7k,I bet it smells amazing at your house! Thanks for sharing! Would you consider making a contest for vanilla recipes? I feel like there are more good chocolate cakes than vanilla cakes in the vegan recipe world.,
koyb6iq,t3_1aimv7k,1aimv7k,Oh my goodness. If you ever make one for baked cheesecakes please let us know!,
krg289y,t3_1aimv7k,1aimv7k,"Thank you for putting in the work, time and expense!
I've just made and taste tested the Make it dairy free cake with the Pick up limes buttercream, very good!
The cake is super moist and the butter cream is really good, beautiful consistency will deffo be adding that to my kitchen bible!",
kovol2b,t3_1aimv7k,1aimv7k,If you ever try testing a gluten free one please let me know. They look so good.,
krretck,t3_1aimv7k,1aimv7k,"Hey! I've just made the Make It Dairy Free one, inspired by this post, and I had quite a big issue with it doming whereas some other sponges I make don't have this problem (same oven). Did you have any issues with doming? Or have any recommendations?",
lo2yd4o,t3_1aimv7k,1aimv7k,what dairy free milk do you use?,
lynixo5,t3_1aimv7k,1aimv7k,Great video! What vegan butter did you use?,
m23ew1i,t3_1aimv7k,1aimv7k,"THANK YOU!!!! I didn't have a tonne of time to test recipes for an event. Based on this post and the OPs comments, I did the ""Make it dairy free"" cake and the ""Pick up limes"" frosting... and it was amazing. I fully trust your recommendations. Subscribing to your YouTube! 💙",💙
kozadmv,t3_1aimv7k,1aimv7k,This looks like fun! I was definitely looking at all these recipes and made the Nora Cooks recipe in December. I'd love to know how it compares to all of these!,
kovcy39,t1_kovcltr,1aimv7k,Which one is for the slice on the right in the last pic?,
kox4le6,t1_kovcltr,1aimv7k,"You're a legend, thanks so much for doing this",
kowc3lw,t1_kovcltr,1aimv7k,ty 👍,👍
l75fzjs,t1_kovcltr,1aimv7k,"Omg I’m making my husband a chocolate cake for his bday in a few days, your review was so helpful THANK YOU!",
kovgilh,t1_kovfu6o,1aimv7k,"Thank you for the kind words!  
I was thinking of testing popular vegan banana bred recipes.",
kovfrxf,t1_kovdi52,1aimv7k,"I really loved the sponge from Make It Dairy Free, it was very moist and tender.   
The Pick Up Limes cake had a very good buttercream (with dark chocolate). 

If I have to pick one I would go with the Make It Dairy Free, it also had a very good buttercream!  
The Banana Diaries cake was great too, but it was on the sweeter side. I have made her recipe adding sour cherries between layers and it worked very well.",
kp0beh8,t1_koveg3o,1aimv7k,I wish I could share!,
kp0bqfl,t1_kovkyrk,1aimv7k,The sourdough one sounds very interesting!,
kp0c6qv,t1_kowmchz,1aimv7k,"The amazing smell is one of my favorite things about baking.  
Cool idea, thanks! Wrote it down on my whiteboard.",
kp0dpqs,t1_koyb6iq,1aimv7k,Added the idea to my list!,
kp0d1l4,t1_kovol2b,1aimv7k,"While researching for this video I noticed that The Little Blog Of Vegan also has an amazing looking choc cake. She is a well known vegan baker on IG and recently she went gluten free. If I ever film a second part for chocolate cake testing, I will include the recipe.  
[https://www.thelittleblogofvegan.com/2022/06/vegan-gluten-free-chocolate-cake.html](https://www.thelittleblogofvegan.com/2022/06/vegan-gluten-free-chocolate-cake.html)  


Maybe you have a gluten free banana bread recipe in mind, that you would like me to test?",
l9lj08k,t1_krretck,1aimv7k,"I use the ""spin"" technique to reduce doming in round cake recipes. After adding your batter to the prepared pan, tap on the counter a few times to start leveling and pop air bubbles, then put the pan on the counter and use your palms to quickly spin the pan. The centripetal force will subtly push the batter towards the sides of the pan and create a small depression in the center. Just don't do this too enthusiastically or you'll spin the pan off the counter!",
lx2yzrm,t1_lo2yd4o,1aimv7k,Bjorg sugar free soy milk,
kp0dst5,t1_kozadmv,1aimv7k,"If I ever make it, will let you know!",
kovd7v2,t1_kovcy39,1aimv7k,"It's the Pick Up Limes cake. Her buttercream has chocolate in it, so the color is darker.",
kp0asrd,t1_kox4le6,1aimv7k,Thank you! I'm really happy you guys like the idea.,
kovr4uj,t1_kovgilh,1aimv7k,"Yes please, do the banana bread 🍌",🍌
koz8qz7,t1_kovgilh,1aimv7k,I’m hooked on America’s Test Kitchen recipe from their Vegan for Everybody cookbook. Would love to see your take on other popular ones.,
koxvkfx,t1_kovfrxf,1aimv7k,Sounds like I'd combine the Make It Dairy Free dough with the Pick Up Limes buttercream.,
l9vmpgn,t1_l9lj08k,1aimv7k,"Oh thanks, haven't tried that spinning technique. Will give it a go",
kp0b5zk,t1_kovr4uj,1aimv7k,Any particular banana bread recipes I mind that you would like me to test?,
kp0b7ub,t1_koz8qz7,1aimv7k,"Thank you for the idea, will check out the book.",
kp0dl7g,t1_koxvkfx,1aimv7k,"We tested this with leftovers and I loved the combo!  
My partner still prefers the original Pick up limes recipe as is.",
kp5vd0p,t1_koxvkfx,1aimv7k,that's what I was thinking too!,
kp12r2c,t1_kp0b5zk,1aimv7k,"Yes! Colleen Patrick-Goudreau’s book, “The Joy of Vegan Baking” has incredible recipes. Instead of taking pictures of her cook book, I found this even though it has chocolate chips in it:

https://www.styleathome.com/food-and-drink/recipes/article/recipe-vegan-banana-chocolate-chip-muffins",
kp327us,t1_kp0b5zk,1aimv7k,I can recommend to try at least one recipe which combines bananas with shredded or sliced apples. For example [this one](https://www.veganricha.com/one-bowl-vegan-banana-apple-bread/#recipe).,
kp1fec5,t1_kp12r2c,1aimv7k,"Cool, thank you!",
kpbb945,t1_kp327us,1aimv7k,Thank you! Love the idea to add shredded apples!,
m0laau3,t3_1h7hs61,1h7hs61,Is there a recipe you used?,
m0lkmsv,t3_1h7hs61,1h7hs61,Can I just buy it and eat it?  Asking for a friend 😏 ❤️,😏❤
m0lucm1,t3_1h7hs61,1h7hs61,Wow😲,😲
m0mq25b,t3_1h7hs61,1h7hs61,This is gorgeous!,
m0mv7vh,t3_1h7hs61,1h7hs61,I accept,
m0omvmg,t3_1h7hs61,1h7hs61,The drizzles 😍,😍
m16n2ee,t3_1h7hs61,1h7hs61,Gimme.,
m5nd820,t3_1huqnr5,1huqnr5,Looks fab! Tres leches isn’t one I’ve personally tackled before. Do you have a recipe to share?,
m5p9upu,t3_1huqnr5,1huqnr5,"Latina vegan, looks delicious!! You’re very sweet to your partner.

Usually the base of a tres leches cake is not coconut flavor and is a mild/neutral vanilla. 

I’ve made a few variations and the Nora Cooks recipe is good.

What really gets it authentic is sweetened condensed milk flavor, but I haven’t really nailed that yet without buying a specifically vegan version of that product yet.

When you buy these at a Latin bakery they usually put a line of maraschino cherries down the top 😋",😋
m5ppbo2,t3_1huqnr5,1huqnr5,Looks delicious! Saved the recipe! Thank you for sharing.,
m5ndqwk,t3_1huqnr5,1huqnr5,RECIPE PLZ,
m5nvx2e,t3_1huqnr5,1huqnr5,"Looks great! I need to give this a try, I haven’t had tres leches since going vegan",
m5o4ebb,t3_1huqnr5,1huqnr5,"Well done! 
I wish you had a recipe with measurements, and such, however I can relate, as some of my best culinary achievements are done in the go!",
m5pnvga,t3_1huqnr5,1huqnr5,Tres leches is my favorite cake! However I’ve had a hard time with it absorbing. I’ll put in the mixture on and leave overnight and it just sits. I haven’t tried the box cake tho…that might do the trick! I usually use a vegan Victoria cake sponge as the base but the results are very inconsistent for me.,
m5nfw4n,t1_m5nd820,1huqnr5,"Yes! So for the cake I used the Duncan Hines Dolly Parton Coconut cake mix. But in theory you can use any flavor cake. I substituted in coconut milk, Bob’s Red Mill egg replacer, and melted a stick of plant based butter. I then combined the wet ingredients with the dry ones. I baked the cake in a 9x13 pan at 350 for 25 minutes. I then let it cool on the counter for an hour.

For the three milks I combined a cup and a half of coconut milk, a can of coconut sweetened condensed milk, and a cup of plant based heavy cream a long with a dash of vanilla extract. Once I whisked those together I just poured it on top of the cake. To make sure the liquid really absorbed I used a fork to poke holes in the cake. 

For the whipped topping I used plant based heavy cream, a cup of powdered sugar, and a few dashes of vanilla extract and beat those together before spreading on top. You can top the cake with strawberries or cinnamon like I did. And then let it chill in the fridge over night. It’s bomb af I hope you try it",
m5poqdv,t1_m5p9upu,1huqnr5,"once i tried nature's charm sweetened condensed coconut milk and i thought the flavor was disappointing, it was just kind of sugary. sweetened condensed milk has such a strong milky flavor that i'm not sure how it could be replicated. i've been too scared to make a tres leches cake.",
m5pvla2,t1_m5ppbo2,1huqnr5,It’s so good I hope you enjoy,
m5ngmc5,t1_m5ndqwk,1huqnr5,I just posted it! I hope you enjoy,
m5o4iis,t1_m5o4ebb,1huqnr5,I posted the recipe in the comments^^,
m5pwf2w,t1_m5pnvga,1huqnr5,The shitty box mix totally absorbed the milk. But also I poke a bunch of holes in the cake with a fork before pouring all liquid and wait a few minutes before putting on whipped cream,
m5nr2j5,t1_m5nfw4n,1huqnr5,Thank you for sharing this !!!!,
m5ninta,t1_m5nfw4n,1huqnr5,"Which plant based heavy cream did you use? I’ve used the Silk product, but during the holidays, I saw that Califia Farms has one, but I haven’t tried it yet.",
m5r0d9v,t1_m5nfw4n,1huqnr5,thank you for sharing the recipe.,
m5pqxdl,t1_m5poqdv,1huqnr5,So the brand that I used is called Andre Prost. It was the only coconut condensed milk available at my local Walmart in the baking isle. The flavor was pretty spot on,
m5ngpgy,t1_m5ngmc5,1huqnr5,Slay mamma,
m5o5jit,t1_m5o4iis,1huqnr5,"I haven’t slept - so I shall be more observant. Apologies, and MANY thank you’s for sharing! It looks DELICIOUS! How did it go down? ❤️",❤
