comment_id,parent_id,post_id,comment_body,emojis
ltwwtqo,t1_ltwv4i7,1gctqs2,"Probably would be more hard to whip to stiff peaks and the flavour probably will not be that good though depends how much salt, but if you already were planning on using the can why not try it, a lot of meringue recipes ask for a bit of salt but it's usually added in the end",
lu6fn18,t1_lu1wylo,1gctqs2,"Oh, man! You can’t go past a good trifle! 

I’ve not been game enough to make one to share that uses vegan jelly yet … my in-laws would rather chew broken glass crushed up in a tin of Pal dog food than knowingly eat anything vegan!",
lu6ful1,t1_lu1wylo,1gctqs2,"Ooh! And my hubs only gets this on special occasions (his mum makes it every Xmas) - choc ripple cake. I made a vegan ginger snap and coconut cream mango and shaved coconut ripple cake, but apparently only I enjoyed it!",
ltwxd9m,t1_ltwwtqo,1gctqs2,True.  You sound like you know a few things about vegan baking. Thanks!,
lr8rufq,t3_1g0hlqn,1g0hlqn,Cute heart pattern! Looks delish,
lr933zs,t3_1g0hlqn,1g0hlqn,This is adorable! How did you make the frosting?,
lr9nl70,t3_1g0hlqn,1g0hlqn,Please share the recipe 🙏🙏,🙏🙏
lra21ws,t3_1g0hlqn,1g0hlqn,What white cake recipie did you use?,
lra7pio,t3_1g0hlqn,1g0hlqn,"That's actually an awesome save, the consistency looks perfect.",
lr8t06o,t3_1g0hlqn,1g0hlqn,this is so cute!,
lr9y62x,t3_1g0hlqn,1g0hlqn,Wow!!!,
lr8ssj9,t3_1g0hlqn,1g0hlqn,Love this! I want to make this exact thing. Maybe for valentines. 🥰,🥰
lr8wna4,t3_1g0hlqn,1g0hlqn,Absolutely delightful.   I would be thrilled if someone put this in front of me.,
lr9wx8l,t3_1g0hlqn,1g0hlqn,This is the most eye pleasing cake I've ever seen!,
lrakdkn,t3_1g0hlqn,1g0hlqn,Omg i love thissss!,
lrbqneb,t3_1g0hlqn,1g0hlqn,SOOO cute,
lrbqu0b,t3_1g0hlqn,1g0hlqn,So cute 🥰,🥰
lr8s7vm,t1_lr8rufq,1g0hlqn,Haha thanks,
lr9bcef,t1_lr933zs,1g0hlqn,"Thank you😊 Well I tried making icecream with whipping cream and condensed milk but failed😅 300 ml of whipping cream, 1/2 cup condensed milk, a tbsp of vanilla and 1/3 cup strawberry syrup.",😊😅
lrad2kj,t1_lr9nl70,1g0hlqn,"[This one.](https://youtu.be/-rJqENVxWhA) 
I used almond milk and almond condensed milk instead of the dairy ones.",
lrack3t,t1_lra21ws,1g0hlqn,"[This one](https://youtu.be/-rJqENVxWhA)
I used almond milk and almond condensed milk instead of the dairy ones.",
lrac0na,t1_lra7pio,1g0hlqn,Haha yes. I was surprised too. This was the first time I tried this recipe.,
lr98vvs,t1_lr8t06o,1g0hlqn,Thanks alot😁,😁
lracnnq,t1_lr9y62x,1g0hlqn,Thankyou 😊,😊
lr98teu,t1_lr8ssj9,1g0hlqn,Yay! Hope you do🤗,🤗
lr992pl,t1_lr8wna4,1g0hlqn,Haha I'm still an amateur at this but I'm happy you liked it🤗,🤗
lraba1u,t1_lr9wx8l,1g0hlqn,Omg that means alot thank you so much🤗,🤗
lras9q7,t1_lrakdkn,1g0hlqn,Haha thanks,
lrfib9u,t1_lrbqneb,1g0hlqn,Thanks😁,😁
lrfid9m,t1_lrbqu0b,1g0hlqn,Thanks😁,😁
lradusj,t1_lrad2kj,1g0hlqn,Thank you!,
lrcwuf5,t1_lrad2kj,1g0hlqn,It is pretty common to fail when you try to translate a recipe to dairy free that way. It is normal. It takes more than just 1 attemp because almond milk is not exactly the same. Cow milk have more fat.,
lrabevu,t1_lraba1u,1g0hlqn,Wish I could buy it! can't wait to see more of your bakes!,
lrfi6ru,t1_lrcwuf5,1g0hlqn,Yep I gotta practice more ig😅,😅
lrabpu8,t1_lrabevu,1g0hlqn,Haha I'll definitely post more now😛,😛
lcb81ag,t3_1dysfzi,1dysfzi,wow absolutely gorgeous im genuinely blown away. i thought this was a mushroom identification subreddit and was about to say thats a raspberry,
lcauwm2,t3_1dysfzi,1dysfzi,So cool! What are the little things holding the raspberries?,
lceqqzs,t3_1dysfzi,1dysfzi,"If you said that this was a tree stump, I would have believed you. It’s that realistic.",
lcb0gl9,t3_1dysfzi,1dysfzi,Great job!,
lcbrko4,t3_1dysfzi,1dysfzi,That’s amazing!  You are very talented.,
lcchuih,t3_1dysfzi,1dysfzi,That is an absolutely beautiful and creative cake. Fantastic work!,
lcayj3b,t3_1dysfzi,1dysfzi,❤️,❤
lcepuep,t3_1dysfzi,1dysfzi,Wow. What was your process?,
lcf6vno,t3_1dysfzi,1dysfzi,Omg the artistry in this is absolutely amazing,
lck486g,t3_1dysfzi,1dysfzi,omg I love this!,
lcs8v1y,t3_1dysfzi,1dysfzi,That is cool!,
lcb4i1o,t3_1dysfzi,1dysfzi,Very nice! What kind of cake is it on the inside?,
lcccggm,t3_1dysfzi,1dysfzi,"It’s so beautiful, happy birthday! 🎂🎊",🎂🎊
lcdav9i,t3_1dysfzi,1dysfzi,It looks cool but I would be afraid to eat it lol,
lce2fq9,t3_1dysfzi,1dysfzi,Wow! This is amazing!!!!,
lcfkm8q,t3_1dysfzi,1dysfzi,Absolutely beautiful! 🥰 Excellent work!,🥰
lcftq5k,t3_1dysfzi,1dysfzi,Absolutely exquisite! Creative and so wholesome. Happy Birthday!,
lcbs1tk,t1_lcb81ag,1dysfzi,This reply actually made me laugh out loud 😂,😂
lcawz20,t1_lcauwm2,1dysfzi,toothpicks covered in modelling chocolate!,
lcjslfa,t1_lcepuep,1dysfzi,"Cake part was made and stored in the fridge overnight, I also melted chocolate chips and made the bark shape on parchment paper  for them to sit overnight as well. 
Then I covered in icing, stuck the chocolate bark to the side, and started painting the top to look like a log, added crushed pistachios for the moss, and oh! I also made modelling chocolate that day to make the stems of the mushrooms. 
I then put it back in the fridge till it was party time!",
lclanu9,t1_lck486g,1dysfzi,Thank you!,
lcsnluc,t1_lcs8v1y,1dysfzi,thank you!,
lcb5kzl,t1_lcb4i1o,1dysfzi,"Layered chocolate and vanilla, chocolate sauce in-between. It was met with good reviews!",
lclhz5v,t1_lcfkm8q,1dysfzi,Thank you!,
lcfndnw,t1_lcawz20,1dysfzi,How did you create the moss? Looks so realistic. Beautiful forest bathing cake. I want a slice! ✌️,✌
lckljgr,t1_lcjslfa,1dysfzi,You’re clearly an artist. That’s not hobby level painting skill lol,
lcgour7,t1_lcfndnw,1dysfzi,The moss is just finely crushed pistachios ! Easy and delicious!,
lckjg9w,t1_lcgour7,1dysfzi,Brilliant!,
ltjigdn,t3_1gb6yhn,1gb6yhn,I personally think this belongs in r/veganfoodporn but I’m a big fan of cake. lol,
ltjdp0y,t3_1gb6yhn,1gb6yhn,Gorgeous and sounds sooo good. Recipe?,
ltjg9u3,t3_1gb6yhn,1gb6yhn,Looks absolutely amazing!,
ltjj217,t3_1gb6yhn,1gb6yhn,Damn that looks good!!! 🤤,🤤
ltk7egd,t3_1gb6yhn,1gb6yhn,STUNNING oh my gosh!,
ltlavcf,t3_1gb6yhn,1gb6yhn,"Well fuck me sideways, I didn't even know butter pecan was a type of cake! Looks amazing",
ltrwfta,t3_1gb6yhn,1gb6yhn,Dank 🙏🏼 gimme a slice,🙏🏼
lu3bta8,t3_1gb6yhn,1gb6yhn,Looks sooo good! Congrats on this amazing cake :D,
ltjzzv6,t3_1gb6yhn,1gb6yhn,It's so perfect 😢😁,😢😁
ltpygg6,t3_1gb6yhn,1gb6yhn,Wow 😍😍 now I need an excuse to make this!!,😍😍
ltsbks1,t3_1gb6yhn,1gb6yhn,One please!,
ltjrhgy,t1_ltjigdn,1gb6yhn,I'll go post it there too. Thank you. <3,
ltjmtto,t1_ltjigdn,1gb6yhn,Totally agree! I thought that's where it was posted until I read your comment.,
ltjjayg,t1_ltjdp0y,1gb6yhn,"I'm not sure if I'm allowed to link to non-vegan recipes. I got the recipe from ""Sugar Spun Run"" and veganized it. I used Country Crock Plant Butter, Trader Joe's vegan cream cheese, oatmilk + vinegar for the buttermilk, and Bob's egg replacer.",
ltjj6lj,t1_ltjdp0y,1gb6yhn,I second this. Need the recipe!!!,
ltl8kuy,t1_ltjjayg,1gb6yhn,It's actually so helpful to hear your alterations! Baking doesn't always turn out with vegan substitutions so I'm def gonna try this seeing how it turned out for you!,
lv80qxz,t1_ltjjayg,1gb6yhn,"I'm curious, did you just melt the butter or did you try to brown it? I was inspired by your post and made this for my Dad's birthday yesterday (using Ripple + vinegar, Violife cream cheese, and Just egg). Since vegan butter won't brown the same way as cow butter, I tried browning the butter (Country Crock) along with two teaspoons of natural almond butter. It worked really well!",
ltk5g05,t1_ltjjayg,1gb6yhn,Thank you!,
ltltr0v,t1_ltl8kuy,1gb6yhn,I've had a lot of luck doing vegan substitutions in cakes. I always try to find recipes with weight measurements too (more consistency). This was my very first time making butter pecan and I was nervous because I've never added nuts to a batter before. I went back and forth between using applesauce and Bob's. I think either would work. The cake batter was delicious. I'll be making cupcakes next time.,
lv83q60,t1_lv80qxz,1gb6yhn,"I melted it and cooked it on the stove for about 4-5 minutes. I know you can't truly brown vegan butter, but I did this anyway. I tried the almond butter technique once for cookies a few months ago and I really couldn't taste the difference, so I haven't done it again. I'm so glad it turned out well for you! ☺️ I made this again, but in cupcake and Bundt cake form. It's so good!",☺
lv89n0b,t1_lv83q60,1gb6yhn,"Oooh, maybe I'll try it both ways with something less complex and see for myself if I can tell a difference, then-- this was the first time I'd seen brown butter called for in a recipe I was veganizing, so I didn't want to miss out on the flavor. I'd also toasted the nuts which I think can give a similar profile? 

Thanks for answering, and thanks for posting this recipe-- I agree it's super delicious and was a huge hit!",
lv8a9rk,t1_lv89n0b,1gb6yhn,"I didn't even think about toasting the pecans. Now I need to try that! 

You're welcome!",
m2src3d,t3_1hhp0c5,1hhp0c5,"Hi sweet teeth :)

I'm a retired pastry chef from Germany, had to quit baking due to medical reasons.
But I never lost my passion for my own creations and bc I'm new here I wanted to see, if you like them, too.
Would you like to know more about vegan french pastries?

Here are some of my favourite cakes and gourmet tartes, inspired by the french originals by Gaston Lenotre.",
m2t3asb,t3_1hhp0c5,1hhp0c5,Damn these look so good!!!! 🤤,🤤
m2uhsqd,t3_1hhp0c5,1hhp0c5,"Your creations are stunning masterpieces 💐⭐ and yes,I  would like to hear more about vegan French pasty",💐⭐
m2umam8,t3_1hhp0c5,1hhp0c5,you may!,
m2u02ka,t3_1hhp0c5,1hhp0c5,Beautiful!,
m2v20jv,t3_1hhp0c5,1hhp0c5,The flower one (the fourth) is so impressive! How did you make the flower in the center?,
m2t8y0x,t3_1hhp0c5,1hhp0c5,"They are perfect!! The kind of cake one would be sorry to eat, they look like decor cakes. Good job!!",
m2uhftd,t3_1hhp0c5,1hhp0c5,These are beautiful 😭😭,😭😭
m2y5wct,t3_1hhp0c5,1hhp0c5,No need you’re already invited 😯,😯
m2vtdhw,t3_1hhp0c5,1hhp0c5,Do you have any social media aside here?,
m31jg3v,t3_1hhp0c5,1hhp0c5,So beautiful!,
m6ftmxp,t3_1hhp0c5,1hhp0c5,"Glückwunsch, das sieht wirklich perfekt aus! Ich sehe gerade, dass du Gaston Lenôtre erwähnst: ich habe hier sein Buch ""Das große Buch der Patisserie"", aus dem ich am Wochende mal die Kirsch-Tartelettes machen wollte. Da du offensichtlich vom Fach bist und auch seine Rezepte kennst; was hältst du von dem Buch? Würdest du als Neuling dazu raten, aus so einem Buch die Grundlagen zu lernen, oder empfiehlst du etwas Moderneres? VG",
m2t9n7n,t3_1hhp0c5,1hhp0c5,"If it don't taste good it better look good!🤣 I kid, not vegan by any stretch.....mostly due to bacon, cheese, and honey.....lard in crust, etc. Yeah, I ain't dying skinny, but you got an eye for presentation! Impressive.",🤣
m2t9ooy,t1_m2src3d,1hhp0c5,"Wooooowww did you know there’s a community that’s called vegan food porn? This definitely needs to be posted there. Here too obviously. Your art/baking is beautiful. Now I want cake for breakfast 🤣.
There are so many epic vegans in Germany. I used to be in a vegan fitness group and some of the coolest people were in Germany. My current coach is in Germany. I’m in the US and clearly I need to move to just have this cake. 😅",🤣😅
m2vko81,t1_m2src3d,1hhp0c5,If you’re retired would you be willing to share your recipes 👀,👀
m2sw6y7,t1_m2src3d,1hhp0c5,Everything looks incredible! What is the first one? Do you have a recipe ? 😋,😋
m346yn0,t1_m2src3d,1hhp0c5,"THIS IS AWESOME!! I have a question: have you ever tried creating a vegan version of Schaumküsse? That's a treat I still miss so much, I had a couple attempts but failed. 

Thank you for sharing your vegan pastries. I would also Love some crosssection of your cakes",
m2wtu09,t1_m2umam8,1hhp0c5,Right??,
m2v5ayx,t1_m2v20jv,1hhp0c5,"That one is a bit tricky.
Take thick plastic foil, cut it into 4x10cm and tempered chocolat, you dip the tip of a knife (with a pointy end) into the chocolat and put it onto the foils corner. Make sure to apply some pressure while pulling the knife towards you.
Next you'll need a baking sheet or something you can let your leafs harden in. I used two metal bars, close together.
Once your chocolate leafs are hardened, you can pick them up and arrange them how ever you like :)

The tarte is Avocado - Chocolate - Raspberry btw :)",
m6jtap9,t1_m6ftmxp,1hhp0c5,"Hallo Richard!

Lenotre war ein Visionär, unbestritten. Seine Rezepte erfordern, wie die meisten Backrezepte, aber nichts als Genauigkeit und Geschick  :)

Kirschtartelette kenne ich glaub ich nur unter dem Namen 'Clafouti' Die Kirschen werden in einer Mandelcreme im frisch gerollten Mürbteig gebacken, ein wunderbarer Klassiker. Achte darauf, dass der Mürbteig vor der Verarbeitung einen Tag im Kühlschrank ruht, damit sich der Zucker löst, sonst wird dein Teig beim Backen grobporig und porös und lässt sich schwieriger aus der Form lösen. Und die Form mit Trennwachs fetten, kleine Gebäcke lassen sich schlechter lösen und brechen oft (=Frustration).

Viel Erfolg und guten Appetit!",
m2z7bq7,t1_m2t9n7n,1hhp0c5,"Hey, if ya like meat so much, maybe u could suck on my gargantuan, borderline offensively large testicles",
m2swpq0,t1_m2sw6y7,1hhp0c5,"It's a chocolate - peanut - Tarte with caramelised peanuts on top!

Very easy to make actually 

Short crust shell ( I take one part sugar, two parts shortening and three parts flour)
Ganache : Two parts coconut cream (boiled) and one part dark chocolate (add a bit salt and vanilla)
And for the topping I use creamy peanut butter, u can use your favourite piping bag and nozzle!
Get creative and enjoy.",
m34fdph,t1_m346yn0,1hhp0c5,"Try Sean Moxies' recepie on dailyvegan :)

 Vegan marshmallows 


For 'Schaumküsse' you'll need a thin layer of wafer, you can make a classical 'Hippenmasse', look up the recepie and use Oatmilk and Aquafaba instead of Eggwhite and Milk. When hot, you can press the pastrie into every shape. It's used for ice-cream-cones for ex.
When cold, you can use the vegan marshmallow to pipe a dome, let cool and cover with you favourite vegan chocolate :)

Have fun and merry Christmas:)",
m2ylp0u,t1_m2v5ayx,1hhp0c5,"Thank you for the reply. I'm not very sure what is thick plastic foil, is it just like thick foil?",
m6jwcq0,t1_m6jtap9,1hhp0c5,"Dank' dir, ich werde die Anweisung streng befolgen! ;-)",
m2yu0cq,t1_m2ylp0u,1hhp0c5,"I looked it up, it's transfer foil in English, I hope I could help :)",
m31bdqm,t1_m2yu0cq,1hhp0c5,Thank you. :),
m54lit0,t3_1hs6ho1,1hs6ho1,I can’t help but see a gaping monster mouth with only bottom teeth and a nose in the first pic 😂,😂
m53ftep,t3_1hs6ho1,1hs6ho1,Those ginger cookies look perfect to me!,
m56jpne,t3_1hs6ho1,1hs6ho1,Those chocolate orange cookies look divine!,
m58yje4,t3_1hs6ho1,1hs6ho1,The Santa hats!,
m54vjm8,t1_m54lit0,1hs6ho1,Same😂 they look great tho!,😂
m550d4b,t1_m54lit0,1hs6ho1,Maybe you’re onto something for Halloween cookies 🤔,🤔
ljnb80s,t3_1ezu62e,1ezu62e,"Congratulations on your birthday 🎂 May your new life year be filled with love,joy, health and best of good blessings 💖🍀🌞🪷",🎂💖🍀🌞🪷
ljncsxd,t3_1ezu62e,1ezu62e,"Oh shit, looks like I've got less than one year to become your best friend to get a slice at your next party.",
ljnhuaf,t3_1ezu62e,1ezu62e,"Happy birthday! Also damn, I've been craving chocolate for over a week ahaha this was my sign to finally get off my ass and bake something",
ljnddee,t3_1ezu62e,1ezu62e,Happy birthday!,
ljnhy3y,t3_1ezu62e,1ezu62e,Happy birthday!  Save me a piece this looks heavenly,
ljnk58n,t3_1ezu62e,1ezu62e,Happy birthday awesome vegan!!,
ljnohad,t3_1ezu62e,1ezu62e,Wowwwww looks amazing,
ljnpqnk,t3_1ezu62e,1ezu62e,Beautiful! What type of frosting is it?? It looks so fluffy!,
ljomz8d,t3_1ezu62e,1ezu62e,"Pardon my French but >!that cake looks sexy!< 
Well done",
ljo6qbv,t3_1ezu62e,1ezu62e,please ! we need this recipe !,
ljo8pft,t3_1ezu62e,1ezu62e,Hbd!!,
ljqpfjs,t3_1ezu62e,1ezu62e,"Wow, 45?! 

That's a lot of birthday cakes.",
ljon90v,t3_1ezu62e,1ezu62e,Drop that icing recipe!,
ljoqp61,t3_1ezu62e,1ezu62e,Looks SOOOOOOOO good happy birthday!!!!🎁🎈🎉🎂,🎁🎈🎉🎂
ljq5p6l,t3_1ezu62e,1ezu62e,Happy Birthday 🎂 🥳 🎉,🎂🥳🎉
ljqtnxx,t3_1ezu62e,1ezu62e,Yum!!! This looks beautiful. Happy birthday xo,
lk73pc2,t3_1ezu62e,1ezu62e,😻😻😻,😻😻😻
ljozbr2,t1_ljnb80s,1ezu62e,Thanks so much! ☺️,☺
ljp56pn,t1_ljncsxd,1ezu62e,lol! Sounds good to me friend!,
ljp5c9w,t1_ljnhuaf,1ezu62e,Thank you! Yes! It’s always good time to make cake 😊,😊
ljp57i0,t1_ljnddee,1ezu62e,Thank you!,
ljp5daa,t1_ljnk58n,1ezu62e,Thank you!,
ljp5vpn,t1_ljnpqnk,1ezu62e,Thank you! It’s a buttercream from a wonderful place called cupprimo. They make delicious cakes and cupcakes.,
ljp5wdv,t1_ljo8pft,1ezu62e,Thank you!,
ljqpgan,t1_ljqpfjs,1ezu62e,Wait,
ljoz9su,t1_ljoqp61,1ezu62e,Thank you!,
ljqc4yn,t1_ljq5p6l,1ezu62e,Thank you!,
ljr0cla,t1_ljqtnxx,1ezu62e,Thank you!,
ljqsoql,t1_ljqpgan,1ezu62e,"😂 that was a good one, thanks for the laugh!",😂
ks4iiqm,t3_1azys5b,1azys5b,That texture looks amazing and so fluffy! I really want to try this.,
ks4o7z2,t3_1azys5b,1azys5b,Look at those air bubbles!!! This is gorgeous! Well done 👏👏,👏👏
ks4maa2,t3_1azys5b,1azys5b,That looks like a good recipe and you had good success with it. Thanks for sharing the recipe. I’ve printed it out and I’ll have to try it out for an upcoming gathering.,
ks4mwzz,t3_1azys5b,1azys5b,🥹,🥹
ks4krni,t3_1azys5b,1azys5b,That looks so f’n good!,
ks4r3od,t3_1azys5b,1azys5b,Looks amazing,
ks4tjam,t3_1azys5b,1azys5b,"Looks amazing, thank for sharing!",
ks53gb6,t3_1azys5b,1azys5b,Looks awesome but I don't support that guy anymore.,
ks53myc,t3_1azys5b,1azys5b,Wow! This looks dreamy! I gotta try this!,
ks586h0,t3_1azys5b,1azys5b,Ooh la la 🥰,🥰
ks5b9ta,t3_1azys5b,1azys5b,Beautiful!!!,
ks5ebr0,t3_1azys5b,1azys5b,This is really lovely!,
ks6rck1,t3_1azys5b,1azys5b,😍😍😍,😍😍😍
ks7m4ax,t3_1azys5b,1azys5b,This looks BEAUTIFUL! Mega well done and thanks for sharing!,
ks8a9mj,t3_1azys5b,1azys5b,I really really really want it. \*cries\*,
ks9lxs4,t3_1azys5b,1azys5b,STAWP!!!,
l1ppqae,t3_1azys5b,1azys5b,"O.m.g. I made this for a friends bday bbq, it was a giant hit! “Is this vegan??! Wow, this is amazing”. I wish I would’ve remembered to look up your post bc it would e saved me a lot of hassle and gone with the country crock heavy cream instead. I made this twice this week to Trouble shoot it for today. 

I tried that califia and silk, no luck. Trader Joe’s and country crock were perfectly, the homemade heavy whipping cream from him also works really well. I topped it with chopped hazelnuts and raw cocoa nibs…beautiful AND delicious! I didn’t have any bc I wanted more omnis to taste the amazingness that is vegan food.",
ks5s0ug,t3_1azys5b,1azys5b,Thank you for sharing! Looks amazing! I have a lot of exploring to do on that blog now.,
ks5akjd,t1_ks4o7z2,1azys5b,Thank you 🥹,🥹
ks5aok6,t1_ks4maa2,1azys5b,"You’re welcome! If you want to make it gluten free like I did, just swap the AP flour with gluten free AP flour. I used King Arthur 😊",😊
ksaymz4,t1_ks4krni,1azys5b,Thank you so f’n much! 😁,😁
ks5e9h2,t1_ks53gb6,1azys5b,"Oh no, what happened, if you wouldn't mind sharing?",
ksazj36,t1_ks8a9mj,1azys5b,You can make it! It’s really easy.,
ksaytio,t1_ks5s0ug,1azys5b,Try his recipe for glazed donuts. You won’t be disappointed 😊,😊
ks7jo8v,t1_ks5aok6,1azys5b,I do what to make it gluten free. Thanks!,
ks5f5h6,t1_ks5e9h2,1azys5b,I complimented him on a post and he DMed me that I triggered his ED and then blocked me.,
ksbnx24,t1_ksaytio,1azys5b,Thank you for the recommendation! I’ll be sure to try it.,
ks8rjoq,t1_ks7jo8v,1azys5b,Can someone please enlighten me why they want to make their food gluten free if it isn't because of celiac's or wheat allergy?,
ksce696,t1_ks8rjoq,1azys5b,"I am celiac. So I always look at recipes that are tried as gluten free version since they are often failed or gross if not used the right flour mix. 

I read that some people do it for inflammation in a way to lower it.",
ll3po5q,t3_1f6yp2s,1f6yp2s,"From W.H.I.P in Inglewood, Perth. A description of the hazelnut illusion by them - Chocolate & Chestnut layers: Chestnut ganache with candied and roasted chestnut pieces, chocolate whipped ganache & chocolate glaze. 🤤",🤤
ll3vskh,t3_1f6yp2s,1f6yp2s,Wow! They both look delicious.,
ll4ruq3,t3_1f6yp2s,1f6yp2s,"Oh my— I just looked at their website and I would love to take ALL of their classes!  I should vacation in Inglewood, Perth or just move there🤔",🤔
ll6b60w,t3_1f6yp2s,1f6yp2s,I want that 🤤,🤤
ll6vv0f,t3_1f6yp2s,1f6yp2s,"So, so envious but maybe it's for the best...or at least what's best for my waistline!",
ll4hr4h,t1_ll3po5q,1f6yp2s,"😢🤤 

So jealous! They have some gorgeous looking things in their website and respect for their blurb on the bottom of each page.

“In the spirit of reconciliation W.H.I.P Patisserie acknowledges the Traditional Custodians of Country throughout Australia and their connections to land, sea and community. We pay our respect to their Elders past and present and extend that respect to all Aboriginal and Torres Strait Islander peoples today.”",😢🤤
ll4i0op,t1_ll4hr4h,1f6yp2s,"They are a lovely couple and super genuine, source so much of their stuff locally. Attended their tofu scramble cooking class the other week and had a great time ☺️",☺
lxmt4y3,t3_1gtkiix,1gtkiix,Looks so delicious 😍,😍
lxmvhxg,t3_1gtkiix,1gtkiix,Stunning 🤩,🤩
lxn3sig,t3_1gtkiix,1gtkiix,It looks very inviting and yummy. I’d eat it 😁,😁
lxn6l75,t3_1gtkiix,1gtkiix,"Looks awesome - I've been wanting to make one of those sparkling water cakes, and this might be the way to do it!",
lxt9dm2,t3_1gtkiix,1gtkiix,Gorgeous,
lxuxt7w,t3_1gtkiix,1gtkiix,Omg this looks amazing,
m3mz3cp,t3_1hljjv1,1hljjv1,these are so so beautifully done!! and sound tasty too,
m3n7o9m,t3_1hljjv1,1hljjv1,"Thank you for all the kind comments! This is my first time making Christmas cookie boxes and I'm happy with how everything turned out. Here are the recipes:

\- [Lemon raspberry linzer cookies](https://www.tiktok.com/@eatsaplanty/video/7451723358854565125?is_from_webapp=1&sender_device=pc&web_id=7418608198221628933)  
\- [Matcha wreath cookies](https://www.tiktok.com/@eatsaplanty/video/7451318252766121222)  
\- [Chocolate and earl grey shortbread cookies](https://www.tiktok.com/@eatsaplanty/video/7450964002424753414?is_from_webapp=1&sender_device=pc&web_id=7418608198221628933)  
\- [Cookie sticks](https://www.tiktok.com/@eatsaplanty/video/7450640881054420229)  
\- [Cashew and matcha polvoron](https://www.tiktok.com/@eatsaplanty/video/7450269582167788805?is_from_webapp=1&sender_device=pc&web_id=7418608198221628933)

Still trying to perfect my matcha white chocolate cookies!",
m3n0roq,t3_1hljjv1,1hljjv1,"These are stunning!!! I love the infographic too, it looks so professional. Would you be able to share the recipes of these beautiful cookies?",
m3r6gwf,t3_1hljjv1,1hljjv1,"so amazing, would be the happiest person everrrr if i got to try even half that box",
m3n2d0s,t3_1hljjv1,1hljjv1,Recipes please ! ❤️ This is a beautiful box,❤
m4dzsvm,t3_1hljjv1,1hljjv1,Either you've got a green filter on your camera or that's a whole lotta matcha! :D,
m3nygh9,t3_1hljjv1,1hljjv1,"Wow this looks amazing, I bet it tasted 10/10!",
m3ondn3,t3_1hljjv1,1hljjv1,❤️❤️,❤❤
m3n4m9z,t1_m3mz3cp,1hljjv1,thank you so much! this is my first time making christmas cookie boxes 🥰,🥰
m3n8ww1,t1_m3n7o9m,1hljjv1,I’m going to SO try all of these OP u are amazing 🥺❤️,🥺❤
m3n6rtf,t1_m3n0roq,1hljjv1,thank you!! just posted links to the recipes in another comment ☺️,☺
m3rl2hw,t1_m3r6gwf,1hljjv1,thank u for the kind words!! ,
m3n6tvk,t1_m3n2d0s,1hljjv1,thank you you so much ☺️ just posted links to the recipes in another comment,☺
m4f55q3,t1_m4dzsvm,1hljjv1,I was quite generous with the matcha powder haha,
m3ri8y2,t1_m3nygh9,1hljjv1,thank you hehe,
m3rkve8,t1_m3ondn3,1hljjv1,☺️☺️,☺☺
ldcqkni,t3_1e46188,1e46188,That is a THICC layer of frosting on the top *removes*,
ldd8k1w,t3_1e46188,1e46188,"Holy cake frosting Batman!

Lemon is such an underappreciated flavour. It looks lovely and moist.",
lddi6zm,t3_1e46188,1e46188,"Frosting is where it’s at, cake compliments",
lddwoov,t3_1e46188,1e46188,"Now this is my kind of cake!! Never enough frosting!! 🤤 

Looks delish, I've been meaning to try out ermine frosting for so long, this has inspired me to finally do it!",🤤
ldd1b6r,t3_1e46188,1e46188,"Betcha you're cousin was extremely happy... may you both be blessed with happiness Karma points, you for making the delicious cake (lemon 🍋😍) and her in her marriage ❣️⭐🌞🍀",🍋😍❣⭐🌞🍀
ldczok8,t3_1e46188,1e46188,Wow that's some thick frosting,
ldcoud3,t3_1e46188,1e46188,That icing to cake ratio?! Perfection!!!!!!!,
ldi12h1,t3_1e46188,1e46188,10% cake 90% icing,
lddknnj,t3_1e46188,1e46188,I'm so impressed by all the modifications you did! I bet it was yumm. And how sweet to be a part of their day!,
ldf5v2d,t3_1e46188,1e46188,Frosting is just the perfect amount don’t listen to anyone else,
ldg6d8e,t3_1e46188,1e46188,Oh my… it’s look delicious!  😋,😋
