comment_id,parent_id,post_id,comment_body,emojis
m7vpwuv,t3_1i4jkve,1i4jkve,"Happy birthday and congratulations!! Those chocolate hearts look perfect, that’s so cool that you get to work for a (vegan?) chocolate company like that :)",
m7vrg18,t3_1i4jkve,1i4jkve,Lovely jubbly cake mate <3<3 What an adorable treat for a birthday bash (•u•),
m7vsj67,t3_1i4jkve,1i4jkve,Wow! That looks like heaven,
m7vvsts,t3_1i4jkve,1i4jkve,Happy birthday!!,
m7w385o,t3_1i4jkve,1i4jkve,"Happy Birthday, fellow Capricorn!  My birthday is January 18.",
m7wed4i,t3_1i4jkve,1i4jkve,Happy Birthday! What a stunning cake! And those hearts are like no chocolate I've ever seen before- they remind me of geodes So cool!!,
m7yathk,t3_1i4jkve,1i4jkve,Happy Birthday! That cake looks amazing! 🤩,🤩
m7w9opc,t3_1i4jkve,1i4jkve,That looks so yummy! Great job OP 😋 ,😋
m7wbhq2,t3_1i4jkve,1i4jkve,Wonderful! Happy birthday you vegan baking boss!,
m7whlmd,t3_1i4jkve,1i4jkve,Happy bday! Cake looks delicious!,
m7whpe1,t3_1i4jkve,1i4jkve,Yuuuummmmm,
m7wi8d9,t3_1i4jkve,1i4jkve,Happy belated birthday!🥳🌱🎂 I hope you had a fabulous day celebrating you! Your birthday cake looks divine! What is in the chocolate hearts?,🥳🌱🎂
m7x888u,t3_1i4jkve,1i4jkve,Happy birthday!,
m7xbpon,t3_1i4jkve,1i4jkve,I’ve turned 36 recently too! Happy birthday! 🎊,🎊
m7xcqpl,t3_1i4jkve,1i4jkve,Woah. Bravo!,
m7yi1q3,t3_1i4jkve,1i4jkve,What recipe did you use for the frosting?? Looks great!,
m7ylydh,t3_1i4jkve,1i4jkve,Wow! The culinary landscape was far more hostile to veganism twenty years ago so thank you for paving the way and holding it down even when it got you 5 gta wanted stars,
m80ahm8,t3_1i4jkve,1i4jkve,Happy birthday,
m829psr,t3_1i4jkve,1i4jkve,Happy birthday!! Can I order chocolates?,
m837mkv,t3_1i4jkve,1i4jkve,Amazing!!,
m8b6y15,t3_1i4jkve,1i4jkve,Wow!! Looks soo good.. love that cracked little hearts😍,😍
m8bcxzp,t3_1i4jkve,1i4jkve,"Belated Happy vegan kind of Birthday 
Wishing you clarity, peace and wellness",
m8gb07e,t3_1i4jkve,1i4jkve,"amazing, happy anniversary! looks stunning.",
m8h4vts,t3_1i4jkve,1i4jkve,GO OFF ✨ happy bday <3,✨
m7vqjzv,t3_1i4jkve,1i4jkve,Happy birthday! What a lovely looking cake,
m7vqzr0,t1_m7vpwuv,1i4jkve,"Thank you! The two owners are vegetarian & we only use dark chocolate for our creations, but they do offer some caramels/brittle that contain dairy. I’ve worked in two vegan bakeries & a vegan brewery (all in the kitchens) in the past, though.",
m7w3ooe,t1_m7vsj67,1i4jkve,Thank you! It’s quite rich haha,
m7w3pum,t1_m7vvsts,1i4jkve,Thank you!!,
m7w3vlr,t1_m7w385o,1i4jkve,Happy birthday to you as well!,
m7wg76w,t1_m7wed4i,1i4jkve,"Awwww thank you, sincerely!",
m812z62,t1_m7yathk,1i4jkve,Thank you!,
m7wbi9n,t1_m7w9opc,1i4jkve,Thank you so much!,
m7wc2c1,t1_m7wbhq2,1i4jkve,*blushes* Thank you so much!,
m7wj5vz,t1_m7whlmd,1i4jkve,Aw thank you!,
m7wj7d5,t1_m7whpe1,1i4jkve,🤗🤗🤗,🤗🤗🤗
m7wjdxb,t1_m7wi8d9,1i4jkve,Thank you very much! The chocolate is 70% dark & has freeze-dried strawberries & raspberries.,
m8131h6,t1_m7x888u,1i4jkve,Thank you!,
m813715,t1_m7xbpon,1i4jkve,Hope you have a great year. Thank you!,
m813wwt,t1_m7yi1q3,1i4jkve,Miyoko Schinner’s chocolate buttercream from The Homemade Vegan Pantry. It’s silken tofu and raw cashew based with melted chocolate.,
m8141np,t1_m7ylydh,1i4jkve,5 gta wanted stars? What is that?,
m8157or,t1_m7ylydh,1i4jkve,"I just googled then asked my partner because they used to play. I’ve never had anyone make a grand theft auto reference to be before haha. It actually wasn’t bad because I grew up in California. Definitely 100x easier now, though.",
m81434i,t1_m80ahm8,1i4jkve,Thank you!,
m83jpty,t1_m829psr,1i4jkve,Thank you! Message me & I’ll let you know our website.,
m7vr705,t1_m7vqjzv,1i4jkve,Thank you!,
m81b4qm,t1_m8131h6,1i4jkve,You’re welcome.,
m5xvxwc,t3_1hw29bw,1hw29bw,"That's one excellent veganizing perfection ⭐⭐⭐ Thanks for sharing your delicious recipe, and may you have an awesome week 💐🍀🌞🫶",⭐⭐⭐💐🍀🌞🫶
m5yaqel,t3_1hw29bw,1hw29bw,Oh my god. I would be such a fat fuck if I could bake this beautifully. I need those rn,
m5xzyiy,t3_1hw29bw,1hw29bw,My eyes have been blessed,
m5y5e8m,t3_1hw29bw,1hw29bw,"These are legit some of the nicest cookies I’ve ever seen :o 

Absolutely divine. 

r/VeganFoodPorn Is calling your name!",
m5xyz8g,t3_1hw29bw,1hw29bw,"Well dang, might need to try these out. Look great!",
m5ya3eo,t3_1hw29bw,1hw29bw,Love how big the chocolate chips are!,
m5xzayu,t3_1hw29bw,1hw29bw,looks delicious🫶 cant wait to try! thanks for sharing this,🫶
m5y0kx8,t3_1hw29bw,1hw29bw,Damn those look awesome,
m602t1k,t3_1hw29bw,1hw29bw,What brand of chips did you use?,
m5yk2s9,t3_1hw29bw,1hw29bw,This loooks SOOOOOO good 😍😍,😍😍
m5ysb4s,t3_1hw29bw,1hw29bw,Can’t wait to try this. I can make vegan macarons in a snap but have the hardest time with C Chip cookies!,
m5y7d8h,t3_1hw29bw,1hw29bw,What did you use in place of eggs?,
m5ya7p5,t3_1hw29bw,1hw29bw,Delish!,
m5yly4l,t3_1hw29bw,1hw29bw,NEED,
m5z8arr,t3_1hw29bw,1hw29bw,For a second I forgot gluten tries to kill me.,
m5zl0jr,t3_1hw29bw,1hw29bw,Thank you for posting this! Recent egg allergy and chocolate chip are my favorite!,
m64l2tl,t3_1hw29bw,1hw29bw,so stunning!! what type of chocolate chips did you use?,
m5ytenj,t3_1hw29bw,1hw29bw,"So I have to ask, what the hell is vegan butter and what is it made of",
m5z02nd,t3_1hw29bw,1hw29bw,Did you sprinkle it with vegan meth?,
m5ytzyd,t3_1hw29bw,1hw29bw,This is my famous chocolate chip cookie recipe I make for my friends and family. It gets rave reviews!! Even from non vegans.,
m5z7ye4,t3_1hw29bw,1hw29bw,Wow these look amazing 🤩,🤩
m5z80fj,t3_1hw29bw,1hw29bw,I don’t think I’ve ever seen a more beautiful cookie 🍪,🍪
m5zacry,t3_1hw29bw,1hw29bw,Wowwww yum!!! These look fantasticb,
m5ze1nc,t3_1hw29bw,1hw29bw,I haven’t been able to find a single good vegan chocolate chip cookie recipe so I’ve gotta try this!,
m5zjjok,t3_1hw29bw,1hw29bw,yumm!!,
m5znuuk,t3_1hw29bw,1hw29bw,So very aesthetically pleasing ✨,✨
m6021q4,t3_1hw29bw,1hw29bw,I can’t tell if the cookies are massive or if you have tiny hands. The chocolate chips look bigger than normal too.,
m604qe7,t3_1hw29bw,1hw29bw,"I may be missing something, but where is the recipe?",
m609qe2,t3_1hw29bw,1hw29bw,That is absolutely stunning! As someone who's been obsessed with perfecting my chocolate chip cookie recipe for over 12 years,
m60jwfh,t3_1hw29bw,1hw29bw,Omg you did a fantastic job! 🤤,🤤
m61av62,t3_1hw29bw,1hw29bw,my G-d that looks incredible!!,
m61z8ll,t3_1hw29bw,1hw29bw,Gorgeous!!!! The color is awesome! How would you describe the final texture of the cookie? I don't have the patience to age the dough 😩,😩
m63ga0w,t3_1hw29bw,1hw29bw,Beauty,
m64shpj,t3_1hw29bw,1hw29bw,"I was just talking about veganizing a lot of my recipes, taking this as a sign.",
m64xjjt,t3_1hw29bw,1hw29bw,Yum! There is nothing better to me than salt on a chocolate chip cookie. You did an amazing job.,
m65gewk,t3_1hw29bw,1hw29bw,"OP, i’ve been struggling for years to find a good vegan chocolate chip cookie recipe. Yours look perfect!! And you were kind enough to share the recipe. Thank you!!!!",
m660rvp,t3_1hw29bw,1hw29bw,😍,😍
m66gsiy,t3_1hw29bw,1hw29bw,This is literally my dream cookie! I have had the original Jacques Torres cookie and it was incredible. I thought I'd never be able to eat it again. I am definitely going to try out this recipe!,
m8nnu1v,t3_1hw29bw,1hw29bw,😭😍😍😍,😭😍😍😍
m8nxfzd,t3_1hw29bw,1hw29bw,😍😍😍,😍😍😍
m5y3yzo,t1_m5xvxwc,1hw29bw,Thank you!! You as well 💛,💛
m5ye0pu,t1_m5yaqel,1hw29bw,Hahaha I like to think of the process of baking itself to be it's own little workout,
m5y3iux,t1_m5xzyiy,1hw29bw,I try!!,
m5y6sh9,t1_m5y5e8m,1hw29bw,That’s so nice of you 😭💛 Thank you!,😭💛
m5y4f3w,t1_m5xyz8g,1hw29bw,"Do ittt, it's so easy and bakes from frozen perfectly so you can always have fresh cookies.",
m5ydutp,t1_m5ya3eo,1hw29bw,Can't stay away from a giant puddle of chocolate!,
m5y3cuf,t1_m5xzayu,1hw29bw,Of course! It's truly my fav chocolate chip cookie,
m5y3l03,t1_m5y0kx8,1hw29bw,Thank you!,
m5y8ass,t1_m5y7d8h,1hw29bw,"I used a flax egg! 1 tbsp flax, 2.5 tbsp water = 1 egg",
m5ydvhw,t1_m5ya7p5,1hw29bw,Thank you!!,
m5ywcny,t1_m5ytenj,1hw29bw,[an example](https://www.miyokos.com/products/european-style-plant-milk-butter-salted),
m60i62g,t1_m604qe7,1hw29bw,"The post has 3 photos, in her description she says what about the recipe she changed to make it vegan",
m62nej2,t1_m61z8ll,1hw29bw,"It’s crispy crunchy outside with a chewy center! I baked mine for the full 18 minutes for a more done texture but you can bake less if you want gooey. 

It’s best to age overnight to 72 hours but if you chill the dough for a couple of hours you’ll be fine :)",
m5y8nlo,t1_m5y8ass,1hw29bw,"Thank you! They look great!!!
I made some of the most delicious chocolate chip cookies using coconut sugar, and they were so tender and amazing.",
m5z4ezc,t1_m5ywcny,1hw29bw,"Excellent thank you for this, I get it now. 
Isn’t coconut oil like, really bad for you though? Like worse than regular dairy butter? I’m not insulting or anything I want to try it, I’m just not trying to switch out bad for worse product ya know what I mean?",
m5ydrsd,t1_m5y8nlo,1hw29bw,That sounds soo good and reminded me of how much I love coconut sugar! I need to pick some up next time I'm at the store.,
m5yahcl,t1_m5y8nlo,1hw29bw,"do you have a recipe for those, please?",
m5z6lz4,t1_m5z4ezc,1hw29bw,"you're welcome!

not particularly. it's high in saturated fat but the same is the case for dairy butter. oil/fats are always going to be unhealthy in excess. the butter i linked is technically a ""cleaner"" product than dairy butter - folks will argue ""well it's just cream and salt"" (maybe cultures too) while ignoring the fact that dairy cows consume feed with additives, affecting the milk they produce. 

if you happen to be lactose intolerant (a lot of people are since we have not evolved to drink breastmilk from other species!), dairy butter probably won't bug you much because it's mostly fat, but assuming you have no intolerance to nuts you'd probably enjoy the kind i linked just as much as dairy.",
m5z59ef,t1_m5z4ezc,1hw29bw,Bad in what way?,
m60hyuz,t1_m5z4ezc,1hw29bw,"I mean, I feel like relatively speaking eating cookies with milk butter vs eating cookies with coconut oil is the same thing. Neither are healthy for you, they are cookies filled with fat and sugar. Although personally I haven't seen any research suggesting that coconut oil in particular is unhealthy, it may be.",
m61p01o,t1_m5z4ezc,1hw29bw,"Neither are good for you, but this is a cookie sooooo",
m5ycin0,t1_m5yahcl,1hw29bw,https://www.reddit.com/r/VeganBaking/s/qLkNKITMZt,
m5z5slt,t1_m5z59ef,1hw29bw,"Like worse for you in relation to clogging arteries and bad for kidneys. 
I understand with regular butter it’s like comparing apples to oranges…",
m61xo18,t1_m60hyuz,1hw29bw,"And I get that, it’s a piss poor thing to dispute. I guess what I’m going for is I’ve heard (but not actually seen) research suggesting the higher level of saturated fats in coconut oil is worse for you than regular dairy butter. Although, again let me be clear here, butter is shit bad for your system no matter what I get that. Also yes, of course chocolate and sugar is bad for you as well-hell everything is man at this point. 

Course the solution to that is to not bake and eat salad forever with nothing else.",
m61xrpk,t1_m61p01o,1hw29bw,"Yep again I get that, just trying to see out of the two would you be better off consuming if you were to make and eat said cookie soooo",
m62bsst,t1_m61xo18,1hw29bw,"Yeah and you’re right about that, coconut oil does have higher saturated fat, and butter has higher cholesterol while coconut oil has none so in my opinion it’s more or less a tossup. Neither are particularly healthy for you, especially in the context of “what fatty substance should I use for my cookies” lol. 

I think the occasional indulgence in cookies is fine whether you choose to use dairy butter or coconut oil, but you are on a vegan baking subreddit so you aren’t going to get anybody on here recommending butter made of milk that was stolen from a baby cow over coconut oil.",
m63a4ps,t1_m61xrpk,1hw29bw,You're on a vegan baking subreddit ,
m63jq40,t1_m62bsst,1hw29bw,"Heard. 
I appreciate your response, bout all I wanted answered out of my question.",
m63jy4y,t1_m63a4ps,1hw29bw,"Ya know I had a sneaking suspicion I was on here, thanks for pointing that out! Bless you.",
m64wq05,t1_m63jy4y,1hw29bw,Whut ? I have read that sentence three times now and still don't get what you were trying to do or say . ,
m65b3oa,t1_m64wq05,1hw29bw,Settle down guy move along,
m65bbc7,t1_m65b3oa,1hw29bw,You're attempts at being edgy are just sad,
l95bxw1,t3_1dip47t,1dip47t,First and second photo literally gave me whiplash oh my god,
l956ijj,t3_1dip47t,1dip47t,Its super cool! I even expected it to be a lava cake as it was cut. I was expecting it to bleed lol.,
l95c732,t3_1dip47t,1dip47t,Beautifully scary! I died when I saw it staring at me in the fridge. 😂😂,😂😂
l964tag,t3_1dip47t,1dip47t,Talk to me about your pink drips. What melts did you use that are vegan? Did you color the melt or did it come that color?,
l95h80a,t3_1dip47t,1dip47t,This deserves more views,
l95k1i7,t3_1dip47t,1dip47t,That fridge pic 😂,😂
l959rcy,t3_1dip47t,1dip47t,That’s amazing!! Hahaha.,
l95asvo,t3_1dip47t,1dip47t,LOL - love it. What are the flavours?,
l97fczy,t3_1dip47t,1dip47t,Oh my god it was vegan?? I saw it suggested to me on the baking sub but this news makes it 10x better ,
l95a5xz,t3_1dip47t,1dip47t,I want it.,
l95hqtn,t3_1dip47t,1dip47t,Holy shit 😅 incredible,😅
l95x5jn,t3_1dip47t,1dip47t,Jump scare!,
l96ld61,t3_1dip47t,1dip47t,The jumpscare the second photo gave me😂,😂
l95veuj,t3_1dip47t,1dip47t,"Gives me Attack on Titan vibes lol. 
Looks great on the side that didn't give me a heart attack! Lol",
l96gl22,t3_1dip47t,1dip47t,🤣🤣😅 that was an incredible experience going from pic 1 to pic 2. Really terrific decorating!,🤣🤣😅
l95xrrd,t3_1dip47t,1dip47t,I love everything about this! 😂,😂
l96i1oy,t3_1dip47t,1dip47t,This is the best thing I have seen today,
l96tc21,t3_1dip47t,1dip47t,"I love this so much! The contrast between the cheery, more minimalistic side and the side with the face is beautifully unsettling. Sincere compliment :)

It reminds me of body horror manga. It legit looks like the face of a creature from PTSD Radio or Jujutsu Kaisen.

Also, dang, props on the amount of skill that making the face must have taken! Did you sculpt the lips from frosting?",
l9738kn,t3_1dip47t,1dip47t,Would eating this violate the rule of not eating anything with a face? 😅,😅
l9871g7,t3_1dip47t,1dip47t,i don't think this is vegan anymore that thing is ALIVE and has seen some things......,
l999kkw,t3_1dip47t,1dip47t,Screaming at the fridge photo 😭 we need context!!,😭
l95rg0p,t3_1dip47t,1dip47t,Glorious!,
l95rg9j,t3_1dip47t,1dip47t,hahahhhahh!!!!!! YASSSSSS,
l95yfyd,t3_1dip47t,1dip47t,Looks delicious,
l960ujd,t3_1dip47t,1dip47t,Glorious 🤩,🤩
l9626ky,t3_1dip47t,1dip47t,Fucking love it,
l9640r2,t3_1dip47t,1dip47t,so cool!,
l966l17,t3_1dip47t,1dip47t,"Haha, nice 😂 i love that you just went all in on the creepy face 👌",😂👌
l96c961,t3_1dip47t,1dip47t,Oh my goodness I love it 🥹,🥹
l96gswc,t3_1dip47t,1dip47t,I’m so obsessed lmao,
l96y7ra,t3_1dip47t,1dip47t,"I saw first picture and was aww cute, saw second and was oh my god.",
l97b03z,t3_1dip47t,1dip47t,"First thought: huh?! How is this cake ugly???
Second thought: Dafouq?! I will never sleep again",
l97k4aq,t3_1dip47t,1dip47t,"Omfg I love it! What are the eyes and teeth made of, please?",
l97lhwf,t3_1dip47t,1dip47t,Kinda looks like my cat whenever I make a sudden noise,
l97v8s5,t3_1dip47t,1dip47t,"I would fucking DIE if I saw that in my fridge. Literally, that would take minutes off the end of my life. Damn.",
l98wsyj,t3_1dip47t,1dip47t,I was not prepared for this jump scare.,
l99j3dl,t3_1dip47t,1dip47t,Oh boy there goes by peaceful sleep down the drain tonight,
l9aolol,t3_1dip47t,1dip47t,I simultaneously love him and loathe him.,
leaij8o,t3_1dip47t,1dip47t,"I love this. You must be a professional. I’m new here and I’ve already gotten lots of pointers but I was wondering a few more things… How do you know how much batter to put in each pan so the layers are even? And then the same with the icing in between layers, how do you know how much to put? Do you have any go to recipes? Thanks again for blessing this feed lol",
l96bcta,t3_1dip47t,1dip47t,So no chik fil a sauce?,
l975c36,t3_1dip47t,1dip47t,This is so awesome!!! You're amazing at this.,
l979ji3,t3_1dip47t,1dip47t,It’s beautiful except for the face.  I’d give her a little makeover:,
l97ak5e,t3_1dip47t,1dip47t,Lmao I love it,
l97dpx7,t3_1dip47t,1dip47t,Love it,
l97rjrd,t3_1dip47t,1dip47t,I love it and want to kiss it on the teeth.,
l98cbbx,t3_1dip47t,1dip47t,Ok clearly this cake looks like it belong on one of those SNL cake skits ironically speaking.,
l98gpxz,t3_1dip47t,1dip47t,Its so ugly! I LOVE IT,
l99455g,t3_1dip47t,1dip47t,It's originally I like it.,
l998ks7,t3_1dip47t,1dip47t,Love it! Also curious what you used for the pink drip and what brand of vegan sprinkles do you use?,
l999b7x,t3_1dip47t,1dip47t,I love it!!,
l99o57s,t3_1dip47t,1dip47t,Amazing,
l99s6es,t3_1dip47t,1dip47t,Terrifying,
l99wlof,t3_1dip47t,1dip47t,Hahaha that's glorious 😂 well done!,😂
l9a9qpr,t3_1dip47t,1dip47t,Show the ugliest now,
l9bi8iy,t3_1dip47t,1dip47t,JESUS FUCKING CHRIST,
l9enwyj,t3_1dip47t,1dip47t,"I was like I don't see how it's ugly it's super pretty??? 

*OH*....... oh....",
l9ery8s,t3_1dip47t,1dip47t,I love it,
l9gyzwl,t3_1dip47t,1dip47t,This is not the least bit ugly❤️,❤
l9hmpyw,t3_1dip47t,1dip47t,"This is genuinely so amazing. I was like, ""what do you mean ugliest Ohh huh yep."" good work!",
l9px45j,t3_1dip47t,1dip47t,Well…now I know what will be in my nightmares tonight :),
l9s0e0c,t3_1dip47t,1dip47t,I can’t even with this cake,
lbh18ls,t3_1dip47t,1dip47t,“Wait wdym I think it’s just pretty—OH OKAY” was my thought process,
l988kvz,t1_l964tag,1dip47t,I also need this information!!,
l99ek10,t1_l964tag,1dip47t,"Following this comment, I need answers",
l9by1ec,t1_l95asvo,1dip47t,Vanilla funfetti and vanilla buttercream! Cake balls are made of the same cake but are coated in white chocolate,
l9bjlxb,t1_l97fczy,1dip47t,It WAS vegan.. before we sent it back to hell from whence it came,
l98744u,t1_l9871g7,1dip47t,however i love the fridge pic that had me dying,
l9be9et,t1_l999kkw,1dip47t,"I feel like I should have written a horror back story for this monstrosity 😅 it was my friend’s birthday recently and I volunteered to make a cake and I realized it had been over a year since I baked one. I wanted to do a funfetti cake because I hadn’t done one before, I can’t really say what possessed me to give it a face, but I took that fleeting thought and ran with it 😂",😅😂
leaq7ao,t1_leaij8o,1dip47t,"Thank you so much! I’m not a professional but I’m actually in the process of putting together a portfolio so I can try working at a bakery

As for the batter, I generally fill pans 1/2 or 3/4 of the way up. To make the layers perfectly even, I use my digital kitchen scale to weigh each pan. I’ll scoop a little out of one and put it in another in order to get them as close in weight as possible

For the frosting, it’s really a preference thing I think. I just kind of plop on enough so that it looks proportionate to me (cake layer thickness to frosting thickness). I know some people like to pipe their frosting onto and inside of the cake, that seems to help make it all a uniform thickness but I just wing it

The vast majority of my cake recipes are from Gretchen’s Vegan Bakery [on YouTube](https://youtube.com/@gretchensveganbakery?si=6yURcaSmv96rxYea). I’ve been following her for many years and I love everything she makes. Sometimes I’ll go months without baking and then she uploads a new video that inspires me",
l9bkg6v,t1_l979ji3,1dip47t,Now I’m wishing I had given it a pair of falsies and eyeshadow,
l9g5592,t1_l9by1ec,1dip47t,Thanks! The icing is so smooth - I can't wait till I can ice cakes and they don't look like a bad cement job 😅,😅
l9cm2ll,t1_l9be9et,1dip47t,I will definitely be in contact to commission you for all my future cake needs. This cake at a baby shower? A wedding? Yes. Yes.,
l9cnrvt,t1_l9cm2ll,1dip47t,I’m down! This at a baby shower would be hysterical,
m2hzy0c,t3_1hgbivm,1hgbivm,By chance don't you want to move to my City? Please 🥺,🥺
m2jfl2h,t3_1hgbivm,1hgbivm,"This is absolutely stunning!! 

You need to start a blog, YouTube, anything! And teach us how do work this magic! 

I try to make my hubby a vegan carrot cake every year for his bday and the frosting is always 🤮
So, he gets a complete naked cake! ",🤮
m2i76qa,t3_1hgbivm,1hgbivm,That’s just beautiful!,
m2jwydk,t3_1hgbivm,1hgbivm,Absolutely NEED a recipe for that buttercream! So smooth and it looks like it’s holding its shape so well! 😍,😍
m2ily6i,t3_1hgbivm,1hgbivm,wow! it's gorgeous!,
m2j3xao,t3_1hgbivm,1hgbivm,Stunning!!!,
m2l5lkk,t3_1hgbivm,1hgbivm,the wreath is mesmerizing! you are so skilled. it all looks perfect!,
m2l648v,t3_1hgbivm,1hgbivm,Please send me a cupcake! Beautiful work.,
m2jlpx4,t3_1hgbivm,1hgbivm,Gorgeous,
m2k5339,t3_1hgbivm,1hgbivm,Wow. Just wow!!,
m2kg2do,t3_1hgbivm,1hgbivm,"This is absolutely stunning, amazing job!! Would you be willing to share your icing recipe?",
m2kmkju,t3_1hgbivm,1hgbivm,"Stunning, wow, yum!",
m2kuyu4,t3_1hgbivm,1hgbivm,🤤🤤🤤 those look ✨amazing✨,🤤🤤🤤✨✨
m2kv8l3,t3_1hgbivm,1hgbivm,Gorgeous!!,
m2lktx3,t3_1hgbivm,1hgbivm,I’m very disappointed to see that you’re not in my area. 😒 Your cake and cupcakes look lovely!,😒
m2lowyt,t3_1hgbivm,1hgbivm,Beautiful,
m2lvafy,t3_1hgbivm,1hgbivm,Wow the decorations are so lovely! And everything looks delicious. Great job!,
m2lymay,t3_1hgbivm,1hgbivm,WOWZA - Lucky client - That's going to be a delicious party :),
m2o3wcb,t3_1hgbivm,1hgbivm,Amazing!,
m2sujn4,t3_1hgbivm,1hgbivm,"OMG!! They are literally perfect! You have such talent! I wish so badly that I could take a huge chunk out of that cake omg. I bet it’s absolutely delicious. Either way though, it’s truly a work of art. I’m sure your client was thrilled. And thank you for posting your buttercream recipe! I can’t wait to try it. You seem like such a positive person! I hope you have so much success with your baking.",
m2zslo0,t3_1hgbivm,1hgbivm,Fantastic. This must be one of the most beautiful cakes I’ve ever seen ❤️,❤
m2mqedl,t3_1hgbivm,1hgbivm,Simply spectacular. You are an artiste and should be applauded - absolutely magnificent!,
m2mtsgz,t3_1hgbivm,1hgbivm,Seriously impressive these are gorgeous! I asked my toddler if she was ready for Christmas and she said yeah I’ll have cake! And we never have cake on Christmas 😆 but now I really wish I could get her this cake 🤩,😆🤩
m2mv6b1,t3_1hgbivm,1hgbivm,"Do you, by any chance, live in the Netherlands? 🤞☺️ it looks so good!",🤞☺
m2p22ok,t3_1hgbivm,1hgbivm,Wow!,
m2xx7ga,t3_1hgbivm,1hgbivm,Oh. My. GOD. !!!!!!!! THIS LOOKS AMAZING 🤩🤩🤩,🤩🤩🤩
m2i8teh,t1_m2hzy0c,1hgbivm,Awwwwww! You are too kind! 💖🥹,💖🥹
m2jmfo8,t1_m2jfl2h,1hgbivm,"Omg I cannot love your comment enough -thank you 💕

Starting a tutorial channel is one of my goals! I’m so BAD with videos and editing though rofl. I’m slowly learning how to do all the technical stuff, and do plan to start posting my vegan cooking and baking tutorials down the line! 

Heehe the naked cake! I’m sure it still tasted divine! ❤️",💕❤
m2i8vh1,t1_m2i76qa,1hgbivm,"Thank you, kind stranger! ❤️✨",❤✨
m2nd2k1,t1_m2jwydk,1hgbivm,"Sure thing! ❤️

250g salted European style butter, 250g unsalted European style butter, 1-2 tbsp vanilla bean paste or vanilla extract, 1-2 tbsp creamy plant milk (go for oat, soy or cashew if you can), and 6-8 cups of powdered sugar. 

Using the paddle attachment for your mixer, cream your softened butter. Then add your vanilla. Add your powdered sugar one cup at a time, mixing well between each addition and scraping the sides and bottom of the bowl to prevent unmixed clumps. Add in your milk if you wish. 

The type of butter is the key ingredient here. If you can find Violife salted & unsalted butter, you’re golden. I find that no other vegan butter works nearly as well. The oils in other brands make them unable to hold their shape when decorating and also lend a more greasy/salty flavor. I think I’ve heard some good comments about Miyokos being a good alternative, but I’ve never personally tried making buttercream with it yet. 

I hope this helps! Happy baking love ❤️ ✨😊",❤❤✨😊
m2imdyq,t1_m2ily6i,1hgbivm,Thank you! 😊 🙏,😊🙏
m34p5u9,t1_m2j3xao,1hgbivm,Thank you!,
m2ncf0j,t1_m2l5lkk,1hgbivm,Thank you! 😊,😊
m2ld844,t1_m2l648v,1hgbivm,"Hehe I totally would if I could, my friend! Thank you 😊❤️",😊❤
m2jmq5k,t1_m2jlpx4,1hgbivm,Thank you! 🙏,🙏
m2nay3m,t1_m2k5339,1hgbivm,Thank you! 🙏,🙏
