comment_id,parent_id,post_id,comment_body,emojis
m1spkoi,t1_m1sl56p,1hcu85c,"How is the OP being annoying? They just stated a fact. They also did not repost the picture; they reposted the reddit thread. Because it was the comments they were talking about, not the photo. 

I never said we are the only mammals to eat eggs, I said one of the. Because statistically, very few species do.

Also, I didn't realize I had to clarify with milk that I wasn't talking about when they are 6 week old infants unable to see and hear. As adults, we are the only species to do so. In fact, the reason why so many people are lactose intolerant is because we are not made to drink milk after infancy. When animals stop breastfeeding, they lose the ability to fully digest lactose, as they no longer need it. The only reason this doesn't always happen to humans is because you only stop being able to digest lactose when you stop drinking it. If you continue to drink milk, you will continue to be able to digest it. Because to your body, it is still being breastfed, so it still needs to be able to digest lactose. 

I never claimed you said people should only eat eggs and milk. I said that there are not GI issues where that is all you can eat. Implying you can also eat other foods, so it is still possible to be vegan (but maybe more difficult). 

Again, I never claimed animal products are part of all of your meals. 

Also, no, you do not need meat to sustain and heal yourself. It may be easier, but clearly, it is not the only way.

And it seems you missed my point bringing up eating humans. No matter how much someone says it is best for their health, it is immoral. A large portion of vegans believe it is immoral to eat any species that is conscious and capable of feeling and expressing pain. And hopefully, someday, more people will recognize this. Potentially, even laws will follow. After all, cannibalism used to be common among humans.",
m1trevx,t1_m1t7q2r,1hcu85c,"im not denying people recovery, whatever that means. i am, in fact, recovering. mental illness isnt an excuse to actively contribute to the murder and torture of animals. animal exploitation is wrong and unnecessary. the animals are not here to make you feel better, their life is not ours to use. animals are not here for human benefit.",
m2ff0x9,t1_m1ztrzt,1hcu85c,"You don't care about the class of the other person doing it but ""if there is another option available and they're not taking it, they're unethical."" 

What if I told you that the reason pesticide holders have to be designed for children to hold is because this country uses child labor in picking your organic vegan salad. That when people designed it only for adults, children routinely were disfiguring themselves with pesticides and industrial chemicals because they were the ones out there, with their families, picking and growing your produce. 

Would you eat the salad?? 

But that's all you have to eat! You're disabled or Autistic! You struggle to even eat that! This is what you can AFFORD to eat. It what you know how to cook. 

But isn't it unethical for you to go forth eating produce in America knowing how we treat migrant farm workers and how they're exposed to horrific working conditions and that whole families work in the fields because they can't afford child care??? 

It's almost as if you would do the best you can under the conditions you can. 

It's almost as if you, or ANYONE does what they can as they can, and calling a poor person who can't afford to go Vegan, amoral is a ridiculously classist, racist, shitty stance that doesn't understand how race, class, and culture come into play with food.",
m1s7xd4,t1_m1s3kmq,1hcu85c,That's great for you!,
m1syxuq,t1_m1spkoi,1hcu85c,"That’s not why people are lactose intolerant. 

and yes, I do need to eat meat for my health because I have food allergies and I have a literal eating disorder. I have been told to do so by multiple different doctors and a nutritionist. you are not my doctor or my nutritionist so I don’t need you to tell me what I should and should not eat. You do not know my medical history so therefore you have no say. it’s quite disrespectful, inappropriate, and offensive that you think you can tell me what I should and shouldn’t eat. you have no idea how mine or anyone else’s body works. only your own. 

I’m glad that you have found something that works for you but trying to push that on to other people is really not ok. Kinda like how I’m not pushing what I’m doing with my health onto you, because I know it’s disrespectful and wrong.",
m1vm49d,t1_m1trevx,1hcu85c,"It’s very obvious that you think that you’re better than people because you were able to be vegan and recover, that’s not the case for everyone. 

You shouldn’t have to be told to be kind to people even if they have different eating habits than you because that should just be a given.",
m2tehex,t1_m2ff0x9,1hcu85c,"i have to eat something. eating plants is the most ethical thing. you do understand that animals eat plants too, right? so eating animals is objectively more unethical, because you'd  be paying for the child worker abuse, plus the torture of the animal.

you're trying to muddy the waters and say that everything is equally unethical. two things being unethical does not mean they are equally unethical. eating plants is much much more ethical than eating animals. moreover, due to the fact that we have to eat something, i do have to select the most ethical source of food available. what you're arguing for is to not have to be ethical in food choices.

poor people can afford to be vegan. the cheapest foods are vegan. it is an invented idea that being vegan is expensive.",
m1sl74v,t1_m1s7xd4,1hcu85c,"Why thanks, your anecdotes sound like you finally found your way, too!  It's alright to meander!",
m1tyt60,t1_m1syxuq,1hcu85c,"That simply is why people are lactose intolerant. There is more science behind it, but from an evolutionary standard, that is true. 

Also, I never claimed you should stop eating meat, and I'm sorry if that is how it sounded. I simply wanted to explain that, truly, people in general can get enough nutrients off of non-animal products to survive, even with allergies. Otherwise, how would the animals they eat have the needed nutrients? Veganism is possible but might not be an option for people. For example, a lot of grocery stores do not sell certain foods that can make being vegan an option. Like nutritional yeast is not always sold, but is such an easy way to get needed vitamins. Being vegan is not hard, but being vegan in the world we live in, which is already so pro meat, is. 

I do believe it is immoral to eat animals, but I also believe society pushes it upon people. Just like how I believe it is immoral to fly on airplanes as often as I do to visit family. While that aspect of me is immoral, I feel I do enough good to outweigh it. (Like fostering and volunteering for animal rescues). So, just a little context here that I believe you can do immoral things and still be a very moral person, and there are just necessary evils sometimes. For you, that might be eating meat. 

I believe a large difference here is I am talking more from the stance of it is possible, whereas you are talking more from your experience, in which it may not be a good option. 

Also, I wish you the best of luck with overcoming your eating disorder. I've been there too, and it really sucks.",
m1vnh3b,t1_m1tyt60,1hcu85c,"there are plenty of people that cannot get enough nutrients solely from plants because their body cannot absorb it properly since they have gastrointestinal disorders. I really don’t know why I have to keep saying this or why you choose to be uneducated about this. 

I genuinely don’t know why there are so many vegans that feel so entitled to telling other people what they should and shouldn’t eat. y’all freak out when someone who eats meat makes fun of you for being vegan or tries to convince u to eat meat or whatever else, but the moment it’s flipped it’s fine. It’s very hypocritical. there has not been a single time that I have sat here and I’ve tried to tell you that you should eat meat because that’s not my place but there have been multiple times that multiple people have told me that I should be vegan because I’m a bad person for eating meat

it is not immoral for me to be healthy, but if that’s what you think then that’s pretty ableist. 

like it’s hilarious that you’re literally saying veganism might not be an option for everyone yet in the same comment, you’re still condemning people for not being vegan like you’re just not making any sense. 

and no, I’m not talking solely from my experience. I’m talking from the experience of people that have told me and that I have viewed with my own eyes. Like I don’t know why you think this is fake. That’s genuinely weird. People are allowed to eat meat and still be good people and I don’t know how to change your mind but I quite honestly don’t fucking care. If you want to think people who eat meat are bad people that’s fine, but I think people who judge other people for what they eat are the real bad people.

I will be blocking from here on out because this should not go on for days and it’s also super disappointing to have to leave a community where I was getting recipes from to help me bake because I’m lactose intolerant. Like it’s genuinely sad the hatred some of you guys hold, but it’s not something that I’m willing to be a part of.",
m1w5cum,t1_m1vnh3b,1hcu85c,">I genuinely don’t know why there are so many vegans that feel so entitled to telling other people what they should and shouldn’t eat

Because ""what"" you're eating was once a living, breathing, sentient being who wanted to - and deserves to exist just as much as you do.",
lue4bff,t3_1gf135x,1gf135x,Thank you for sharing a truly divine looking recipe 💐⭐💖,💐⭐💖
lue5k4b,t3_1gf135x,1gf135x,BEAUTIFUL! Adding this to my list,
lueq3ql,t3_1gf135x,1gf135x, Absolutely gorgeous bake. Wow 😍,😍
lue5l71,t3_1gf135x,1gf135x,This is stunning. The ingredients sound wonderful I’m definitely going to try this. Thank you!!!! 💚🩷,💚🩷
luedh2i,t3_1gf135x,1gf135x,God fucking dayum,
lufbo9q,t3_1gf135x,1gf135x,Pretty,
lufhyeo,t3_1gf135x,1gf135x,What fat/protein content does your vegan cream cheese have? There are a bunch of different cream cheese variations available where I live and I assume it's important to get the right one to nail the consistency.,
lufwr0k,t3_1gf135x,1gf135x,I love how your recipe lists ingredients!! Describing the ingredients and why you chose each. I hate when recipes say 'use this specific brand' and then if you can't find it you don't know what to substitute with. Your recipe explains the rationale and it's so helpful! Cheers!,
lufec3d,t3_1gf135x,1gf135x,Wowwww this is gorgeous and I bet it tastes even better than it looks!,
lughsd3,t3_1gf135x,1gf135x,One of the most gorgeous cakes I have ever seen.,
lugn1dk,t3_1gf135x,1gf135x,insanely gorgeous!!! thank you for sharing the recipe :'),
luj0nt9,t3_1gf135x,1gf135x,This is extremely beautiful! May I know what is the size of the cake pan? I am thinking of making a halved version of it.,
lvkm5k8,t3_1gf135x,1gf135x,what kind of witchcraft is this!!!,
luhbce1,t1_lufhyeo,1gf135x,hi! the one i use has around 30 % fat and almost no protein,
luj4rej,t1_luj0nt9,1gf135x,"thank you! 
it's a 20 cm/8 in diameter pan",
luhq32u,t1_luhbce1,1gf135x,Thanks :) I'll give it a go!,
lqegiao,t3_1fwddby,1fwddby,Shana tova! Wish I saw the recipe earlier in the week!,
lqewcom,t3_1fwddby,1fwddby,Shana tova! What do you dip your apples in if at all?,
lqdsgbz,t3_1fwddby,1fwddby,"Apple Cake

INGREDIENTS

3 cups all-purpose flour
1 teaspoon baking soda
¼ teaspoon salt
1 teaspoon cinnamon
3 egg replacement
6 tablespoons water
1½ cups granulated sugar
1¼ canola oil
2 teaspoons vanilla extract
3 cups peeled and chopped apples
1 recipe brown sugar super

STEPS

1) Preheat the over to 350°. Lightly oil a bundt pan.

Sift together the flour, baking soda, salt, and cinnamon. Seat aside. In a food processor or blender, whip the egg replacer and water together until it becomes creamy, about 1 minute. Add the sugar, oil, and vanilla, and beat for 2 minutes. Stir the dry ingredients into the wet. Fold the apples. You will have a thick batter.

Pour the batter into the pan, bake for 1 hour and 15 minutes. Pour the syrup over the cake as soon as it comes out of the over. Let the cake cool, loosen the sides, invert onto a place, then invert onto another plate, with the syrup topping side up.",
lqe5uxq,t3_1fwddby,1fwddby,It's so pretty!,
lqdsigg,t3_1fwddby,1fwddby,"Brown Sugar Syrup

INGREDIENTS

½ cup firmly packed brown sugar
¼ cup nondairy milk
3 tablespoons non-hydronated nondairy butter

STEPS

1) Combine the brown sugar, milk, and butter in a sauce pan. Bring to a full boil and boil for 3 minutes. Reduce the heat and simmer vigorously until thickened to a syrupy consistency, 10 to 15 minutes. Let cool slightly and serve. It will keep in the refrigerator for up to 1 month.",
lqdyfzu,t3_1fwddby,1fwddby,Wishing you a peaceful Rosh Hashanah 🤜🤛From one Abrahamic religion to another,🤜🤛
lqeu487,t3_1fwddby,1fwddby,Woweeee spectacular! L'Shanah Tova!,
lqfjy8t,t3_1fwddby,1fwddby,Delicious! It looks like serving it with cranberries grand marnier would fit. Is that a thing?,
lqfvp0o,t3_1fwddby,1fwddby,Gorgeous!,
lqgn7sj,t3_1fwddby,1fwddby,Uhhh looks tasty,
lqi1oaw,t3_1fwddby,1fwddby,Wow! Looks delicious and what an awesome pan!,
lqin2fm,t3_1fwddby,1fwddby,Happy new year!,
lringu5,t3_1fwddby,1fwddby,"Oh, beautiful!",
lqe1uy4,t3_1fwddby,1fwddby,"Yum! Looks so good, especially the syrup in those grooves",
lqdw4zb,t3_1fwddby,1fwddby,So thicc!  Looks so good!,
lqe1xio,t3_1fwddby,1fwddby,This looks utterly divine! 🍴,🍴
lqdvscm,t3_1fwddby,1fwddby,That is gorgeous!,
lqdw8vx,t3_1fwddby,1fwddby,If I tried this in a non Bundt/tube pan how bad would it fail?,
lqdxwtj,t3_1fwddby,1fwddby,"Beautiful, and also looks delicious!",
lqiv5oc,t3_1fwddby,1fwddby,😍😍😍😍🙌🏼🙌🏼🙌🏼🙌🏼,😍😍😍😍🙌🏼🙌🏼🙌🏼🙌🏼
lqh19k9,t3_1fwddby,1fwddby,Shana Tova! It looks delish!!,
lqfgtxo,t1_lqewcom,1fwddby,We prefer agave but I know people who prefer date honey.,
lqfstod,t1_lqdsgbz,1fwddby,Thank you for posting the recipe ,
lqe1pwo,t1_lqdyfzu,1fwddby,Thank you 🤍,🤍
lr15fpa,t1_lqdyfzu,1fwddby,I wish Reddit had more people like you.,
lqe0kff,t1_lqdw8vx,1fwddby,Its super hefty. Go for it though and post the results cause I'm curious too.,
ljj53ro,t3_1ezakwm,1ezakwm,Can they be my friend too?,
ljk9ezj,t3_1ezakwm,1ezakwm,Where from? This looks fabulous,
ljk9gp3,t3_1ezakwm,1ezakwm,My mouth 👄 is watering bruh,👄
ljkfnky,t3_1ezakwm,1ezakwm,"Oh my days, keep this friend close. That peanut butter bar looks absolutely epic! 👌",👌
ljjpsry,t3_1ezakwm,1ezakwm,This is powerful 🥹,🥹
ljj8v99,t3_1ezakwm,1ezakwm,Oh shit! Amazeballs,
ljkne9o,t3_1ezakwm,1ezakwm,That looks so good 😍,😍
ljlprax,t3_1ezakwm,1ezakwm,Ineeeeed someee 😩,😩
ljlxecw,t3_1ezakwm,1ezakwm,That looks delish!,
ljm6fsh,t3_1ezakwm,1ezakwm,Wagon wheels and cherry ripe 🤤🤤🤤🤤 How do they taste ? You've got a good buddy right there 👌,🤤🤤🤤🤤👌
ljmg3cs,t3_1ezakwm,1ezakwm,Looks amazing! Absolute masterpiece hahaha. Would not be able to decide which to eat first,
lkhspb9,t3_1ezakwm,1ezakwm,This is so 🥹🥹🥹🥹 I need a friend like yours that can help me satisfy my PCOS food cravings too 🥹🥹🥹,🥹🥹🥹🥹🥹🥹🥹
ljkc4fn,t1_ljk9ezj,1ezakwm,https://crunchbox.com.au/ ☺️,☺
ljmxqls,t1_ljm6fsh,1ezakwm,"They were all perfect! The shortbread and jam in the wagon wheel were just as I remembered the non-vegan ones. The cherry ripe had rich dark chocolate and soft coconut and cherry inside, sooo lovely.",
ljmc0xs,t1_ljkc4fn,1ezakwm,[deleted],
ljmzmyv,t1_ljmc0xs,1ezakwm,"If you make your way down check out Holmesys Bakehouse (predominately vegan bakery with lots of Australian classics, just a couple of non-vegan items but they're clear about it), W.H.I.P (vegan french patisserie that do cooking class events too) and La Vida Vegan (vegan grocery store with a baked goods section) as well! My favourites 😍",😍
ljnb1gl,t1_ljmzmyv,1ezakwm,"Darrington's too, their green chicken curry pie is awesome!",
ljnbb6w,t1_ljnb1gl,1ezakwm,"Oooo! Going to try them out tomorrow, thank you friend! 🌿",🌿
ljnblgo,t1_ljnbb6w,1ezakwm,"They also do bakery favourites but Holmesy's is better IMO (Darrington's is 100% vegan/GF so can be hit or miss texture wise). 

They do a wagon wheel too that I quite enjoyed, and I think a vanilla slice too!",
ljojqrd,t1_ljnbb6w,1ezakwm,Tell us how was it. I’m outside of the Australia ((🇦🇺,
lju1aq3,t1_ljnbb6w,1ezakwm,"I was at a cafe at gosnells this morning and they had crunchbox so I had one of those wagon wheels, 10/10, thank you for the inspiration

I would say it tasted better  than the darringtons one but it was less authentic, if you get me!",
ljsegh6,t1_ljojqrd,1ezakwm,"The choc hazelnut was like a mousse with a crisp bottom, perfectly airy and light. The strawberry cream was more of a thicker mousse with a cookie bottom, lovely mix of flavours. The wagon wheel had a dark chocolate coating that made that great crack sound when you bite in, jam and a fluffy marshmallow like filling and not too crumbly but not too hard shortbread base. The cherry ripe was like a super fancy cherry ripe bar, super on point. Didnt get to the peanut butter bar as my father came past and demolished it 😅",😅
lju1jxk,t1_lju1aq3,1ezakwm,"Yessss! Glad you enjoyed ☺️ I didn't make it to darringtons cus I did a scrambled tofu cooking class at W.H.I.P in the morning  and was so full of baked goods afterwards 🤤 scrambled tofu and olive oil fried mushrooms in their croissant with vegan mozzarella melted on top, was glorious!",☺🤤
lju1ocw,t1_lju1jxk,1ezakwm,I used to go there every Saturday after the gym and that and the noissettine are my two go-to orders if i don't fancy any of the pastry of the month :) so good....,
lju1v17,t1_lju1ocw,1ezakwm,They just started doing the croissants with a new vegan butter from Europe! Good excuse to go back again 😉,😉
ljuc9eb,t1_lju1v17,1ezakwm,don't worry i go there three times a month instead of once a week now lol (I moved).... doing my part to support small business!,
m6sxc91,t3_1hzum5f,1hzum5f,People not posting the recipe is my supervillain origin story,
m6soei9,t3_1hzum5f,1hzum5f,What did you use for the frosting?,
m6sl1lh,t3_1hzum5f,1hzum5f,They look so fluffy! 😊,😊
m6syt92,t3_1hzum5f,1hzum5f,As well you should be! 🤩😍💚,🤩😍💚
m6t3ai4,t3_1hzum5f,1hzum5f,They look perfect! 😍,😍
m6tvcrg,t3_1hzum5f,1hzum5f,Beautiful,
m6u5ui5,t3_1hzum5f,1hzum5f,"Those look so, so good.",
m6ubbzz,t3_1hzum5f,1hzum5f,I would eat 6 of those right now,
m6w3uk6,t3_1hzum5f,1hzum5f,"Yes chef!  
We are sooo proud!",
m6uxztx,t3_1hzum5f,1hzum5f,Bruh,
m6uy1ii,t3_1hzum5f,1hzum5f,My mouth is Niagara falls rn,
m70gn5h,t3_1hzum5f,1hzum5f,I have tried a billion different cinnamon roll recipes and none have worked for me. 😩 I have never felt more defeated. 😞,😩😞
m6tjerp,t1_m6sxc91,1hzum5f,I’m sorry!! I didn’t follow the exact recipe but this is the inspiration 🤗 https://www.noracooks.com/vegan-cinnamon-rolls/,🤗
m6thyw7,t1_m6sxc91,1hzum5f,"I don't know what OP used, but this is the cinnamon roll recipe I use and they are absolutely god-tier and look just like these. They get hoovered up by non-vegans whenever I bring them to potlucks: https://tasty.co/recipe/the-best-ever-vegan-cinnamon-rolls",
m6t7ze8,t1_m6sxc91,1hzum5f,💯 💯,💯💯
m6tjjsw,t1_m6soei9,1hzum5f,I used the violife cream cheese with icing sugar and vanilla! 😌,😌
m6sw58o,t1_m6soei9,1hzum5f,Have the same question:D,
m6tjohd,t1_m6sl1lh,1hzum5f,They were surprisingly fluffy! I left them in the fridge overnight before baking them and I think that made them more fluffy!,
m6tjpde,t1_m6syt92,1hzum5f,Thank you 🥹🥲,🥹🥲
m6tjqe9,t1_m6t3ai4,1hzum5f,Thank you 🥰,🥰
m6tk8i7,t1_m6tjerp,1hzum5f,"Haha, no worries! I was joking though I really appreciate the link!! Can't wait to try these",
m7dsdjg,t1_m6tjerp,1hzum5f,"This is the one I use too, so good!!",
m6viirj,t1_m6tjerp,1hzum5f,People not following the exact recipe is my supervillain origin,
m6tlh6v,t1_m6thyw7,1hzum5f,"Thank you for this recipe and for reminding me that I can use the phrase ""hoovered up"" when my bake's been well-received. Love it 🥰",🥰
m6tknj4,t1_m6tjjsw,1hzum5f,Thank you very much :),
m6utv6b,t1_m6tjohd,1hzum5f,"I’ve seen that tip in recipes I’ve followed, but never tried it. Maybe I will next time!",
m6u2sbt,t1_m6tjpde,1hzum5f,So welcome 😊,😊
m6tobxc,t1_m6tlh6v,1hzum5f,Haha no problem!,
luox3lg,t3_1ggbsur,1ggbsur,"shaped them better?!?! oh how i disagree! i love the shape of those, they look deliciously crunchy and soft…",
luokopr,t3_1ggbsur,1ggbsur,I'm looking respectfully... 🫳🥐,🫳🥐
luoepfo,t3_1ggbsur,1ggbsur,That looks just absolutely divine!,
luohb08,t3_1ggbsur,1ggbsur,Omg they look soooo good,
luopbjc,t3_1ggbsur,1ggbsur,These look amazing. Did you use a specific recipe?,
lup0hyd,t3_1ggbsur,1ggbsur,Hi I’ll take two dozen please.,
lup7tc6,t3_1ggbsur,1ggbsur,omg!,
luq0mn5,t3_1ggbsur,1ggbsur,Wow 👌,👌
luq5y5a,t3_1ggbsur,1ggbsur,What butter did you use? They are awsome!,
luptn8i,t3_1ggbsur,1ggbsur,The lamination is 🤌🏼🤌🏼 well done friend!,🤌🏼🤌🏼
luu3mxa,t3_1ggbsur,1ggbsur,Njama!,
luww06f,t3_1ggbsur,1ggbsur,"....what sorcery is this, and how can I learn it!?",
luqcr7s,t3_1ggbsur,1ggbsur,"They look picture perfect and YUMderful, great job.",
luqfrfk,t3_1ggbsur,1ggbsur,"They look like regular croissant! Amazing!


Do they have a buttery taste too? Or coconutty?",
lurqa3v,t3_1ggbsur,1ggbsur,Beautiful!,
lus189a,t3_1ggbsur,1ggbsur,They are... Perfect🥺,🥺
lusccwd,t3_1ggbsur,1ggbsur,"Do you know if there's a way to start making them then you stop and freeze them so you can easily have fresh croissants in the morning?

As a kid, before I was vegan, I remember my parents buying frozen shaped but unbaked croissants.  They'd let them rise in the oven overnight and bake ""fresh"" in the morning.  

I wonder if that'd be doable with his recipe.

Also, for the step when you cut the dough in triangles, it says to use half the dough.  Considering that the double turn yields a 9"" x 6"" rectangle, I guess you cut it into a 4.5 x 6"" rectangle which you then roll into an 18"" x 20"" rectangle. Is that correct?",
lusp4em,t3_1ggbsur,1ggbsur,Gorgeous!,
luu222j,t3_1ggbsur,1ggbsur,Gimme!,
luu65n0,t3_1ggbsur,1ggbsur,take my money!,
lv4kbdo,t3_1ggbsur,1ggbsur,They look perfect to me!,
m3tww65,t3_1ggbsur,1ggbsur,How long you have proofed the Crossaint and what temp ?,
lusj9g4,t3_1ggbsur,1ggbsur,can the mods please add a rule where people who post flaky pastries need to post a cross sectional too,
lup3itf,t1_luox3lg,1ggbsur,thanks that's very kind of you :),
lutzeq3,t1_luokopr,1ggbsur,I'm looking sinfully 🌝,🌝
luoezrn,t1_luoepfo,1ggbsur,thank you 🤗,🤗
luoj1bv,t1_luohb08,1ggbsur,thanks appreciate it :)),
luos0z6,t1_luopbjc,1ggbsur,Thanks! I used https://sarahsvegankitchen.com/recipes/vegan-croissants/#timeline,
lup3fgo,t1_lup0hyd,1ggbsur,hehe maybe i should start a business,
luqb3pr,t1_luq5y5a,1ggbsur,I wanted to use Violife but I couldn't find it so i used a cheap vegan block that is available in my country. But Violife would definitely be better,
luq8v37,t1_luptn8i,1ggbsur,aww thanks 🤗,🤗
luqd3us,t1_luqcr7s,1ggbsur,That's so nice thank you :)),
luqpcv8,t1_luqfrfk,1ggbsur,Well the only difference is that I used vegan butter instead of regular and it doesn't contain coconut so no coconutty taste!,
lutpvuq,t1_lusccwd,1ggbsur,"I would do that after shaping (but I'm just an amateur so idk!), put them on a tray and freeze so they don't stick together. After they are frozen, I would put them in a bag. When you want to bake them just let them defrost and rise as normal (that would take longer). I thought of doing this myself it's a great idea :)) 

About cutting up the dough in half: I was also confused by that, because in the blog post she says to work with half the dough, but then in the recipe card she doesn't say anything. So what I've done is I just rolled out the whole dough and followed her instructions. I cut 10 triangles with no problems.",
lus6479,t1_lup3itf,1ggbsur,Can we see the cross section?,
luozjkr,t1_luos0z6,1ggbsur,"Omg thank you ! I'm a baker, trying to find the best croissant recipe because the one they gave me at school wasn't vegan, I'll be trying these 🤩",🤩
luq2rml,t1_luos0z6,1ggbsur,Thx for providing the recipe! They look great :D,
luqr6zn,t1_luqpcv8,1ggbsur,Definitely gonna try these! Thanks for sharing!,
luu8ubv,t1_lutpvuq,1ggbsur,"Great! Thanks for clarifying the ""dough in half"" bit!

I will try to freeze some after shaping otherwise I'll be left with 10 croissants to eat all by myself which wouldn't be a smart move on my part because I could and would eat them all in a day...

Edit: just noticed that the original recipe has some info about freezing (at the very bottom) either right after laminating or after shaping.",
lup3q34,t1_luozjkr,1ggbsur,Ooh let me know how it goes!! however i think the key is finding actually good vegan butter,
lv07kz4,t1_luu8ubv,1ggbsur,"You're welcome! And I totally get you, I could hardly resist when they came out of the oven haha
I hope they turn out good for you :)",
