comment_id,parent_id,post_id,comment_body,emojis
labvh3e,t3_1dolx4j,1dolx4j,I kinda wanna fuck it,
lad5z8o,t3_1dolx4j,1dolx4j,"I was like... don't squeeze it, don't squee ah fuck sakes",
lab4nsm,t3_1dolx4j,1dolx4j,you little slut,
labmas6,t3_1dolx4j,1dolx4j,https://preview.redd.it/ttfsx4l8qu8d1.jpeg?width=1054&format=pjpg&auto=webp&s=b6425ae185320ba32cc9c1027037efd6b7e292d0,
labpacy,t3_1dolx4j,1dolx4j,Where the hell is this,
lacjrhh,t3_1dolx4j,1dolx4j,https://preview.redd.it/623nbclkjw8d1.jpeg?width=960&format=pjpg&auto=webp&s=6f2ef931ee79786b61e56e88f9f9deb3f9bc9d63,
lam0m4x,t3_1dolx4j,1dolx4j,STOP. SQUEEZING. YOUR MEAT.,
laayv03,t3_1dolx4j,1dolx4j,Y’all act like this one little squeeze for the camera has negated the entire 14 hours of smoking.,
labljcv,t3_1dolx4j,1dolx4j,https://preview.redd.it/bfrz8vwwou8d1.jpeg?width=1284&format=pjpg&auto=webp&s=bc33640e67431dbff4e81d284c106d4e3abc5938,
labulrg,t3_1dolx4j,1dolx4j,In me now,
laf9jo9,t3_1dolx4j,1dolx4j,When the brisket moves like jello you know it’s some good ass brisket,
labvg2t,t3_1dolx4j,1dolx4j,I like the way it jiggles.,
lac153t,t3_1dolx4j,1dolx4j,HOT DAMN!!! GIMMI A CHUNK OF DAT!!!!,
lablabl,t3_1dolx4j,1dolx4j,Before I die I hope to make a brisket as good as this one looks.,
lackxx1,t3_1dolx4j,1dolx4j,"For a split second I thought this was a big pile of dirt and a bunch of ants were going to come out. 

I am a lost redditor this morning apparently.",
labrhki,t3_1dolx4j,1dolx4j,Good God damn. Rarely are the ones you love beautiful inside and out.,
lac1c2l,t3_1dolx4j,1dolx4j,Sabre cut!,
lacfjj0,t3_1dolx4j,1dolx4j,Perfection.,
lacoawe,t3_1dolx4j,1dolx4j,[deleted],
lact9eu,t3_1dolx4j,1dolx4j,why squeeze it? no need to waste all that juicy loveliness,
lad2njz,t3_1dolx4j,1dolx4j,This group makes me realize how little I know about briskets,
ladbq0r,t3_1dolx4j,1dolx4j,Leaping lima beans...,
ladkpt5,t3_1dolx4j,1dolx4j,Worlds better than the super dry one I saw yesterday on Reddit.,
labtmls,t3_1dolx4j,1dolx4j,Stop squeezing brisket!!!!,
lab0eiv,t3_1dolx4j,1dolx4j,Mouth is actually watering ah,
labklvw,t3_1dolx4j,1dolx4j,https://preview.redd.it/3mtxlluanu8d1.jpeg?width=1284&format=pjpg&auto=webp&s=f3069e2783f8a909a23f127b4e80ae8b82273de3,
lafflyc,t3_1dolx4j,1dolx4j,Fuck.........,
lab2ckk,t3_1dolx4j,1dolx4j,Fuck me silly,
labmxz1,t3_1dolx4j,1dolx4j,My penis can only get so erect!,
labidx9,t3_1dolx4j,1dolx4j,If I'm ever on death row - I want THAT for my last meal. The whole thing.,
labpowz,t3_1dolx4j,1dolx4j,Mmmmmmmmmmm,
labwamf,t3_1dolx4j,1dolx4j,That is the softest brisket I've ever seen. It moves like a cloud.,
laby84y,t3_1dolx4j,1dolx4j,"MEAT IS MURDER!!!! 
JK gimme some of that 🤤",🤤
lacf52x,t3_1dolx4j,1dolx4j,"Before the cut, I knew that was going to be juicy as hell. The smush made my insides feel funny.",
lachtxz,t3_1dolx4j,1dolx4j,Oh my god I'm salivating.,
lacketg,t3_1dolx4j,1dolx4j,Hol up !!! This should not be on my feed first thing in the morning .. mark that shit NSFW .. walking the job site with morning wood ain’t a good look …,
lact3x3,t3_1dolx4j,1dolx4j,Great googly moogly,
lad3v5j,t3_1dolx4j,1dolx4j,Little to no smoke ring and doesn't look like they let it rest since it's still steaming hot. Pretty big L and waste of a brisket tbh.,
lao59k2,t3_1dolx4j,1dolx4j,WAB,
laob7gj,t3_1dolx4j,1dolx4j,Shove your meat inside of me.,
labyqcl,t3_1dolx4j,1dolx4j,I'd go American pie on that piece of meat,
lab5asv,t3_1dolx4j,1dolx4j,Just fell to my knees in Planet Fitness,
laffedm,t3_1dolx4j,1dolx4j,"Oh man … damn … you look like you work in a restaurant, can you share where this is ?",
lab6vqv,t3_1dolx4j,1dolx4j,I should be going to bed but now I’m mopping up a puddle of drool,
lae6ma5,t3_1dolx4j,1dolx4j,"https://preview.redd.it/2doq6re3cy8d1.jpeg?width=1042&format=pjpg&auto=webp&s=707244b57e12eb00aed216fecedf1de36aa5033c

“Squeeeeezzze iiittt! Yes……”",
lafadgo,t3_1dolx4j,1dolx4j,[removed],
labc5wl,t3_1dolx4j,1dolx4j,Hmmm now I fall asleep 😴,😴
labjfqt,t3_1dolx4j,1dolx4j,That's do fucking gloriously beautiful. Holy shit.,
labukjv,t3_1dolx4j,1dolx4j,Spill on the process.,
laccidg,t3_1dolx4j,1dolx4j,I’d bury my face all the way in that.,
lacmgxw,t3_1dolx4j,1dolx4j,https://preview.redd.it/zw6j5jjjnw8d1.jpeg?width=237&format=pjpg&auto=webp&s=a83f3fe6423a8c04d09d2594aeb18c131f11ed27,
lacpwik,t3_1dolx4j,1dolx4j,I will commit crime for this thing,
lacuqh5,t3_1dolx4j,1dolx4j,NSFW,
lacz2pw,t3_1dolx4j,1dolx4j,Stop squeezing my meat.,
laczk9s,t3_1dolx4j,1dolx4j,A friend of mine has that same barbed wire bunny tattoo,
lad4nu7,t3_1dolx4j,1dolx4j,"god damn, this literally looks like a bag of liquid, but it's meat!!!",
lad4u88,t3_1dolx4j,1dolx4j,Good lord,
laev9fw,t3_1dolx4j,1dolx4j,I’ve got video of my 72 hour sound video brisket where I cut it with a butter knife.   I need to post that at some point.,
laf6ugf,t3_1dolx4j,1dolx4j,Damn...thats sexy LOL 🤣🤣🤣🤣,🤣🤣🤣🤣
lalm4l9,t3_1dolx4j,1dolx4j,NSFW,
lampch7,t3_1dolx4j,1dolx4j,How can you have any pudding if you don’t squeeze your meat,
lanu6pz,t3_1dolx4j,1dolx4j,How long did you cook it? What temp? Asking for a friend…,
lb47zz6,t3_1dolx4j,1dolx4j,Oh that looks so yummy,
lae88ve,t3_1dolx4j,1dolx4j,STOP FUCKING SQUEEZING IT,
laaz1gg,t3_1dolx4j,1dolx4j,Not at all dry. Great cook.,
lab0awd,t3_1dolx4j,1dolx4j,There we go. 10/10,
labm3by,t3_1dolx4j,1dolx4j,I’d be willing to miss some big life events in order to eat this brisket…,
labyk3d,t3_1dolx4j,1dolx4j,Now THAT is how you make a fucking brisket!,
lacu6wq,t3_1dolx4j,1dolx4j,How could I have guessed it was going to be squeezed?,
laczwi3,t3_1dolx4j,1dolx4j,"My favorite ""meat memory"".  

It was 1989. I was a freshman, playing college football.  We had won our conference for the first time and as a reward, we were treated to a BBQ by the husband of the team secretary, who just happened to be a professional competitive BBQ chef.  

As we are about ready to start.  The guy comes out of his 20ft long BBQ trailer with the stereotypical hog on a plate with the apple in its mouth.  He sets the hog on the table in front of us.  Then he grabs the ears of the hog and lifts it.  As he does, the meat LITTERALLY falls off the bone and onto the plate.  He then takes the skin and bones in his hands and walks back into to trailer.  I have never seen anything as mouth watering.",
laazwhp,t3_1dolx4j,1dolx4j,S Q U E E Z E,
lafrax4,t3_1dolx4j,1dolx4j,Nothing wrong with a little meat squeezing now and then. U won’t go blind 👀,👀
labfqps,t3_1dolx4j,1dolx4j,Needs to be marked NSFW,
labkqa8,t3_1dolx4j,1dolx4j,This post needs a NSFW tag 🥵🥵,🥵🥵
labp369,t3_1dolx4j,1dolx4j,Slap my ass and call me Sally! That is a fine lookin brisket!,
lal9lxz,t3_1dolx4j,1dolx4j,"Ah yes, there’s that patented Reddit idiot squeeze. Wrong color gloves for it, so downvoted lol.",
lay1ssa,t3_1dolx4j,1dolx4j,"Please don't squeeze it please don't squeeze it please don't squeeze it, NOOOOOOO",
laast77,t3_1dolx4j,1dolx4j,I hate that I’d eat just the bark off this thing.,
lab8tet,t3_1dolx4j,1dolx4j,Dat jiggle tho,
lab98ul,t3_1dolx4j,1dolx4j,"I had to come back to this post a second time because of how damned good this looks. Sure I joked about the squeeze. But… Damn, I want some brisket. Nice job",
lab9xfh,t3_1dolx4j,1dolx4j,Sploosh,
labhx57,t3_1dolx4j,1dolx4j,That looks so good it would turn a vegan carnivore,
lack6yn,t3_1dolx4j,1dolx4j,that’s memaws brisket,
lacovu2,t3_1dolx4j,1dolx4j,Oh Lordy.,
laczc5r,t3_1dolx4j,1dolx4j,CUT MY MEAT,
lad4pse,t3_1dolx4j,1dolx4j,I thought this was a fudgy chocolate cake,
ladzo64,t3_1dolx4j,1dolx4j,"All I read is it takes 12 hours to make brisket, check it etc how do business do it? the have someone working all night? 

There is very few places that sell it around me. the last good place I found was 30 minutes away and last 2 times I went the quality dropped too much.",
lae25zg,t3_1dolx4j,1dolx4j,🤤🤤,🤤🤤
lae2xjz,t3_1dolx4j,1dolx4j,Where were you all my life?!,
laegwns,t3_1dolx4j,1dolx4j,"That left side is half fat, should be juicy",
laenpf5,t3_1dolx4j,1dolx4j,what animal is brisket from?,
lal9e1v,t3_1dolx4j,1dolx4j,I hate when they squeeze it,
lal9zkq,t3_1dolx4j,1dolx4j,"This brings bad memories of when I smoked a brisket for my birthday. 

My dad decided to cut it up early to save time... made it completely dry within the hour.",
lb1h473,t3_1dolx4j,1dolx4j,Omfg,
ldbasot,t3_1dolx4j,1dolx4j,🥴😩💦,🥴😩💦
lad6dyi,t3_1dolx4j,1dolx4j,NSFW,
lahif9m,t3_1dolx4j,1dolx4j,We can close this sub now. You could ring that out like a towel and still be better off than 90% of brisket out there,
laat6tw,t3_1dolx4j,1dolx4j,I knew what it would look inside when you touched it and it jiggled.,
laazjsv,t3_1dolx4j,1dolx4j,Jesus Christ that looks amazing. What grade meat was that?,
lab3svg,t3_1dolx4j,1dolx4j,Damn dawg,
lab45g9,t3_1dolx4j,1dolx4j,That’s what I’m talking about! Looks absolutely delicious!,
lab62a8,t3_1dolx4j,1dolx4j,Meat porn riiiiii ‘chere!,
lac3suv,t3_1dolx4j,1dolx4j,So juicy,
laex5tu,t3_1dolx4j,1dolx4j,Why am I getting an erection?!,
laezcic,t3_1dolx4j,1dolx4j,"Yo, what's your OF?",
laauqp1,t3_1dolx4j,1dolx4j,"ALWAYS with the fucking sqeezing !!

Trust me anybody could tell that was juicy. 

Now you've gone and dried out a perfect piece of meat that a customer will be paying for.

That bark is FUCKING BEAUTIFUL !!!!!

PSA, to all the people making brisket to show off...

QUIT SQUEEZING THE FUCKING THINGS !!!!!",
labbpxp,t3_1dolx4j,1dolx4j,nothing makes me cringe more than someone squeezing the juice out.. it looks good don’t ruin it😭,😭
labrxss,t3_1dolx4j,1dolx4j,I just moaned,
lad9x7e,t3_1dolx4j,1dolx4j,I'd eat that from the back!,
laixv8o,t3_1dolx4j,1dolx4j,Stop squeezing it!!!!! We can see it’s juicy you’re just losing all the flavor when you do that crap.,
laauzfa,t3_1dolx4j,1dolx4j,You didn't let it rest,
laeksgb,t3_1dolx4j,1dolx4j,Fucking squeezing it really ?? The fuck,
laarmwn,t3_1dolx4j,1dolx4j,That's perfect.  Double dead ass on,
laas2hz,t3_1dolx4j,1dolx4j,God damn. That there is some brisket.,
laau2hz,t3_1dolx4j,1dolx4j,How the fuck do you cook that???,
laav7xg,t3_1dolx4j,1dolx4j,Process for the love of everything I hold dear?!!!!,
laaxb28,t3_1dolx4j,1dolx4j,"Woah, what was the weight on that bad boy?",
laaz347,t3_1dolx4j,1dolx4j,This has to be prime? Right?,
lacfe8c,t3_1dolx4j,1dolx4j,Looks hawt.  What does everyone do with the seam though?  I hate the seam.,
ladgiu5,t3_1dolx4j,1dolx4j,I should call her..,
lagdx3r,t3_1dolx4j,1dolx4j,"Damn, it’s been a long time since I’ve squeezed meat that juicy.",
lagwze6,t3_1dolx4j,1dolx4j,I could put my foot in that 😩,😩
laaxupc,t3_1dolx4j,1dolx4j,As Andy Samburg would say “AND I JIZZED IN MY PANTS”.,
laazjxa,t3_1dolx4j,1dolx4j,Thanks I just came in my pants at work 😧,😧
labu3qu,t3_1dolx4j,1dolx4j,"Great squeeze, you got my down vote you fuck",
labl0e5,t3_1dolx4j,1dolx4j,I have no idea why I got the same Sense of satisfaction from watching this as when I impregnated my wife.,
lad67pp,t3_1dolx4j,1dolx4j,This is my kink.,
lag5737,t3_1dolx4j,1dolx4j,"Welp, here goes nothin’!

*unziiiiiiiiiiips*",
lab9ivx,t3_1dolx4j,1dolx4j,Holy,
labbxro,t3_1dolx4j,1dolx4j,Nice,
labfz8z,t3_1dolx4j,1dolx4j,Look at that baaaahk!,
labo8tw,t3_1dolx4j,1dolx4j,I couldn’t tell if that little moan was from me or the video.,
labokwg,t3_1dolx4j,1dolx4j,Hey OP… quick question.  What brand is that knife?  & does it start with a C ?,
labxwx9,t3_1dolx4j,1dolx4j,Small.,
lac840x,t3_1dolx4j,1dolx4j,Yummmm,
lac8exx,t3_1dolx4j,1dolx4j,Mmmmm,
lacvkw4,t3_1dolx4j,1dolx4j,"That looks good. Never had it before, what does the outside taste like? It looks burnt but I’m sure it’s not",
lacw2b3,t3_1dolx4j,1dolx4j,Why’d you smoosh it ?!?!?!?!,
ladzypj,t3_1dolx4j,1dolx4j,Mmmmmmmm,
lae05ci,t3_1dolx4j,1dolx4j,"""Oh fuck yeah 🥵""",🥵
lae07ll,t3_1dolx4j,1dolx4j,God damn brother.,
lae0ciy,t3_1dolx4j,1dolx4j,omg,
lae0gnm,t3_1dolx4j,1dolx4j,Why is it so juicy I don't get it.. all the other posts are dry and get loads of upvotes I'm so confused.. should I want it juicy or dry.. just kidding I don't know the difference so everyone gets a trophy!!,
laejwvb,t3_1dolx4j,1dolx4j,I’m a cow and that was my mom,
laixntr,t3_1dolx4j,1dolx4j,The succulents,
lamdyf1,t3_1dolx4j,1dolx4j,That makes me want to eat 2nd dinner.,
lamhyz4,t3_1dolx4j,1dolx4j,I hate you at 11 o’clock pm on a work night,
lamxr9e,t3_1dolx4j,1dolx4j,Oh. So this is what it feels like when your eyes salivate.,
laspnw1,t3_1dolx4j,1dolx4j,"Right amount of juice, perfect amount of meat and fat, and that satisfying jiggle of the meat … it’s perfect~",
lawmgw3,t3_1dolx4j,1dolx4j,I’ve had sex to recently to enjoy this properly,
lax357d,t3_1dolx4j,1dolx4j,The bark and fatty on that..got dayum,
lb1f0ma,t3_1dolx4j,1dolx4j,My stomach just growled.,
lab78vu,t3_1dolx4j,1dolx4j,How you get that thang so damn JUICY?!,
labk3ri,t3_1dolx4j,1dolx4j,💦💦💯,💦💦💯
lad8xqe,t3_1dolx4j,1dolx4j,Boutta do nasty things to that meat,
laapaij,t3_1dolx4j,1dolx4j,Stop making me hungry! It looks awesome!!!!,
lab7gfn,t3_1dolx4j,1dolx4j,Brisket tip/fatty brisket is something special.,
labognr,t3_1dolx4j,1dolx4j,I'm hungry. Let's get married.,
lacw6ew,t3_1dolx4j,1dolx4j,"I bet it’s yummy, but good god that looks revolting.",
ladr8qd,t3_1dolx4j,1dolx4j,How do I get that amazing color/texture on the outside of my meats?!,
lae0omf,t3_1dolx4j,1dolx4j,"Holy crap. I’m not even a huge fan of brisket, but damn……the fact that it moves as much as raw meat, while being cooked to well done. Lord have mercy!",
lae1tkm,t3_1dolx4j,1dolx4j,"Well, that was arousing.",
lahsmz5,t3_1dolx4j,1dolx4j,~Drool~,
laeoa5w,t3_1dolx4j,1dolx4j,"Gotta rest the meat for a while, it doesn’t rest in 5 minutes like a steak. A lot missed tickets to flavor town when you squeeze out the juicey juices",
lablvhi,t3_1dolx4j,1dolx4j,I should call her!,
laaw19p,t3_1dolx4j,1dolx4j,[deleted],
labj3hq,t3_1dolx4j,1dolx4j,I’m so hard it hurts. I’m going to have zipper marks for a week!,
labqrkt,t3_1dolx4j,1dolx4j,Oh fuck me,
lacx2fj,t3_1dolx4j,1dolx4j,Thank for I’m not wearing underwear,
ladxt9f,t3_1dolx4j,1dolx4j,r/dontputyourdickinthat,
lah157y,t3_1dolx4j,1dolx4j,Wish I can provide a gif of Homer drooling,
laf4kgj,t3_1dolx4j,1dolx4j,I want to make a brisket just to film myself squeezing tf out of it for this group.,
lal1v6k,t3_1dolx4j,1dolx4j,"If you squeeze the meat, I immediately downvote your post. You can call me meat Karen.",
laasy86,t3_1dolx4j,1dolx4j,I just jizzed in my pants,
laassg2,t3_1dolx4j,1dolx4j,Was about to say thank you for not squeezing the brisket. Sigh never mind.,
laaxqv0,t3_1dolx4j,1dolx4j,Thank you for not having the black gloves that everyone seems to think they need in these posts.,
labuywl,t3_1dolx4j,1dolx4j,My oh my! That jiggle has me sweating.,
labvdjh,t3_1dolx4j,1dolx4j,"What's your rub n smoke time if I may ask.

Thank you in advance",
lacjsa9,t3_1dolx4j,1dolx4j,Jesus Christ this is hor,
laleqzv,t3_1dolx4j,1dolx4j,The brisket money shot.,
lamm6lg,t3_1dolx4j,1dolx4j,Not red at all.,
lanctbr,t3_1dolx4j,1dolx4j,I could dive in it Looney Tunes style,
laqbx01,t3_1dolx4j,1dolx4j,looks juicy enough to fuck.,
laqy7f7,t3_1dolx4j,1dolx4j,Jesus. Im sick to my stomach with hunger now.,
larjbjv,t3_1dolx4j,1dolx4j,Looks juicy just no smoke ring.,
larks0r,t3_1dolx4j,1dolx4j,I can feel the taste in my mouth just looking at it,
larq6bn,t3_1dolx4j,1dolx4j,Im so damn hungry it’s not funny..,
larr389,t3_1dolx4j,1dolx4j,Damn now I’m hungry af,
lartb3j,t3_1dolx4j,1dolx4j,My reaction to this video is so primal. How do vegetarians exist,
lat7jx4,t3_1dolx4j,1dolx4j,Love the wobble ! That’s why you know it’s a good one,
lauztg4,t3_1dolx4j,1dolx4j,🤤🤤🤤,🤤🤤🤤
lav2mee,t3_1dolx4j,1dolx4j,Yeah just came a little lol,
lazno5o,t3_1dolx4j,1dolx4j,Now I'm hungry for brisket!,
laztt1h,t3_1dolx4j,1dolx4j,Fuck me up Freddy that looks incredible 🥹,🥹
lb0pxj3,t3_1dolx4j,1dolx4j,[deleted],
m39xkyr,t3_1dolx4j,1dolx4j,Don’t let gang know I fw this,
labb2ey,t3_1dolx4j,1dolx4j,Don’t stick your dick in crazy,
labk1mx,t3_1dolx4j,1dolx4j,Let me get the recipe. I suck at grilling.,
lacpty2,t3_1dolx4j,1dolx4j,r/dontputyourdickinthat,
ladfo22,t3_1dolx4j,1dolx4j,How you doin’?,
ladn6cv,t3_1dolx4j,1dolx4j,Oh my good lord you have no idea the sound that just came outta my mouth,
lae4rav,t3_1dolx4j,1dolx4j,Omfg,
lah8x3k,t3_1dolx4j,1dolx4j,Looks sooooo good. Wow.,
lairmrl,t3_1dolx4j,1dolx4j,Oh good lord! 🤤,🤤
lb1fw0y,t3_1dolx4j,1dolx4j,Obligatory don’t squeeze comment. I don’t even go here and I know the rules.,
lad4ajk,t3_1dolx4j,1dolx4j,Meh. No smoke ring to speak of. Basic brisket.,
lai8ng9,t3_1dolx4j,1dolx4j,I'm a Europoor /s and that looks fucking disgusting. I bet it's like eating wet meat flavoured gummy bears :D,
lad9nqa,t3_1dolx4j,1dolx4j,Looks like slop.,
ladprfv,t3_1dolx4j,1dolx4j,Reminds me of Alotta Fagina from Austin Powers for some reason,
lae1pua,t3_1dolx4j,1dolx4j,Everything reminds me of her...,
lajljhh,t3_1dolx4j,1dolx4j,Way too overcooked,
lab6kb9,t3_1dolx4j,1dolx4j,"1 let it rest longer    
2 don't squeeze the moisture out",
lak0gsv,t3_1dolx4j,1dolx4j,Overcooked. You could still bang it,
lak0otj,t3_1dolx4j,1dolx4j,Appears to be burnt meat,
lafs5xu,t3_1dolx4j,1dolx4j,Shouldn't be pink on the inside ?,
lactmct,t3_1dolx4j,1dolx4j,I'm sure it tastes great but am I the only one who thinks it looks pretty unappetizing?,
lacrr69,t3_1dolx4j,1dolx4j,Nice bark poor smoke ring,
lacydic,t3_1dolx4j,1dolx4j,I’m about to BUST,
lae5j4y,t3_1dolx4j,1dolx4j,Many would change their wife by this brisket.,
laasl3j,t3_1dolx4j,1dolx4j,Squeeze it again! Wear more gloves though!,
ladhk32,t3_1dolx4j,1dolx4j,Plastic cutting boards are not good for your health. All that micro-plastic going into your food. Get a wooden cutting board if you care about your customers health,
lacqsur,t3_1dolx4j,1dolx4j,You left that big tasteless fat plug in it? I remember my first time cooking a brisket.,
ladnrxx,t3_1dolx4j,1dolx4j,Everything reminds me of her,
labxwtj,t1_labvh3e,1dolx4j,https://preview.redd.it/al4mtfmlcv8d1.jpeg?width=1284&format=pjpg&auto=webp&s=6beadfdd4cb2b69dff5ee14c449addc822aff24b,
labwsbx,t1_labvh3e,1dolx4j,"Rule 34, man. 🙃",🙃
labxtz5,t1_labvh3e,1dolx4j,r/dontputyourdickinthat,
m3czdv3,t1_labvh3e,1dolx4j,It there be some prime beef 🥩,🥩
lad7h6n,t1_lad5z8o,1dolx4j,Bro cummed 💀,💀
ladk1le,t1_lad5z8o,1dolx4j,I promise it’s still plenty juicy,
ladmrha,t1_labpacy,1dolx4j,San Diego,
lacnrum,t1_lacjrhh,1dolx4j,😂😂😂😂 this fire,😂😂😂😂
laclfrr,t1_lacjrhh,1dolx4j,IDK why this made me laugh as hard as it did,
lamv5d3,t1_lam0m4x,1dolx4j,It’s so fucking cringe,
lam31sq,t1_lam0m4x,1dolx4j,I agree. To their credit though I feel like they know and so only gave it a quick pinch. All that jiggling before said all you need to know 🤤,🤤
lay4a3l,t1_lam0m4x,1dolx4j,"It's their meat, they can squeeze it whenever they want.",
lb0c77t,t1_lam0m4x,1dolx4j,"That lil pinch made absolutely zero difference, that thing is perfect. I’d love the anti squeeze mob to try a blind taste test between lightly squeezed and no squeezed",
lab0nd6,t1_laayv03,1dolx4j,Ya there is plenty of juice to spare looks like.,
labc6p4,t1_laayv03,1dolx4j,"*squeezes once*

This sub: believe it or not, straight to trash",
labmazu,t1_labljcv,1dolx4j,Ngl that is indeed the face I made,
lagkovj,t1_laf9jo9,1dolx4j,Yessss. I knew it was gonna be good when I saw that jiggle,
lacnu08,t1_lackxx1,1dolx4j,"If ants came out of that, I’d still probably eat it.  That is a good looking pile of dirt!",
lacoypv,t1_lacoawe,1dolx4j,"Beef Slug. New band name, called it!",
lacuvkz,t1_lact9eu,1dolx4j,To follow the social media herd,
lad6d98,t1_lad2njz,1dolx4j,"~~The person in the video doesn't know much, either.~~ Edit: they know more than most but Squeezing is a cardinal sin here and it needed a much longer rest than they gave it",
lacjeka,t1_labtmls,1dolx4j,We knew it was coming. Couldn’t look away.,
lacm6ad,t1_labtmls,1dolx4j,"Ya! We need the Charmin dude saying, “Please don’t squeeze the brisket!”",
lacuks2,t1_labtmls,1dolx4j,"Don't press burgers, don't squeeze brisket, and don't press a pancake.",
lafs2fc,t1_lafflyc,1dolx4j,"I would literally fuck that and then eat it. Give it the BBBB brisket,boner, bed, belly",
lacuw3u,t1_lact3x3,1dolx4j,That thaaang is juicy!,
lad6hkb,t1_lad3v5j,1dolx4j,"Wearing a chef's uniform it looks like. I can hear Gordon Ramsey saying ""what are you doing? Fuckn let it rest, you numbnuts. """,
ladkl2p,t1_lad3v5j,1dolx4j,We are open for 3 hours and we’re running low. We did cut too hot but this is one in a batch of 30 and I promise it did not go to waste,
labzl5v,t1_labyqcl,1dolx4j,Literally how is it so sexual 🤣,🤣
lacjo9z,t1_labyqcl,1dolx4j,Hopefully not like the Apple Pie,
lafgvn3,t1_laffedm,1dolx4j,But city is San Diego,
lafgtwk,t1_laffedm,1dolx4j,I will share in a DM but don’t want my restaurant name out in the open on my account,
lab88cc,t1_lab6vqv,1dolx4j,Just close your eyes and dream of brisket,
lab6wxe,t1_lab6vqv,1dolx4j,"^[Sokka-Haiku](https://www.reddit.com/r/SokkaHaikuBot/comments/15kyv9r/what_is_a_sokka_haiku/) ^by ^CasualAtEverything:

*I should be going*

*To bed but now I’m mopping*

*Up a puddle of drool*

---
^Remember ^that ^one ^time ^Sokka ^accidentally ^used ^an ^extra ^syllable ^in ^that ^Haiku ^Battle ^in ^Ba ^Sing ^Se? ^That ^was ^a ^Sokka ^Haiku ^and ^you ^just ^made ^one.",
lafh4qa,t1_lafadgo,1dolx4j,Single and ready to mingle,
lad6hys,t1_laczk9s,1dolx4j,But they wear *black* gloves when squeezing their smoke-ring-less brisket.,
laf6c6c,t1_laev9fw,1dolx4j,Just don’t squeeze it! They will come after you,
lap7jmc,t1_lanu6pz,1dolx4j,I'm the friend,
lb7p2da,t1_lb47zz6,1dolx4j,It definitely was!,
laeglaw,t1_lae88ve,1dolx4j,As soon as I saw him pick it up I know he was going to squeeze the juice out of its little bus bus,
laehq6v,t1_lae88ve,1dolx4j,I’m sure the customer would prefer all that delicious juice all over the kitchen cutting board as opposed to actually being in the brisket,
lacuxep,t1_lacu6wq,1dolx4j,That makes me absolutely furious for some reason. It's like watching someone squeeze the juice out of an orange and then giving it to you to eat,
lacur69,t1_lacu6wq,1dolx4j,Why does it annoy me to no end?  All it was missing is black gloves,
lad1ac7,t1_laczwi3,1dolx4j,"That's a power move, only made better if he did all this without saying a single word or even acknowledging anyone's existence, as if it were a mild inconvenience that he just dropped food porn on the table.",
lad28vt,t1_laczwi3,1dolx4j,My wife has a different kind of favorite meat memory.,
laby00j,t1_labp369,1dolx4j,"***SMACK!!***

Yo, Sally!",
lay4bo5,t1_lal9lxz,1dolx4j,You sure showed them,
lb087ws,t1_lay1ssa,1dolx4j,I just saw a brisket cut yesterday and everyone was super impressed at how juicy it was without having to be squeezed. OP was commended highly for it. Now here we are again back to squeezing. Shame,
lad2il2,t1_laczc5r,1dolx4j,Into pieces. This is my last resort!,
lae0nnf,t1_ladzo64,1dolx4j,You answered your own question. Automated smokers and a night crew.,
laji6k4,t1_ladzo64,1dolx4j,Yes we have a guy that comes over night and loads the smokers and sprays every hour and is asleep by the time we serve it,
laepr2p,t1_laenpf5,1dolx4j,"Cow. Called breast on other animals, can have “names” like pork brisket but it’s just pork breast, which is really just ribs or pork belly",
lajgpax,t1_lahif9m,1dolx4j,Yeah the comments saying I’m squeezing “ALL the flavor out” I just roll my eyes,
lab8djj,t1_laazjsv,1dolx4j,Prime,
lafrj17,t1_laex5tu,1dolx4j,Cause you were raised right 🐄,🐄
laavy88,t1_laauqp1,1dolx4j,"I'd have to slap it first, then squeeze.",
laaxttf,t1_laauqp1,1dolx4j,"“Yes I’d like to order the brisket,  sliced and wrung please”",
laaw0la,t1_laauqp1,1dolx4j,Don't listen to this guy. SQUEEZE IT HARDER!!!,
lac23xd,t1_labbpxp,1dolx4j,These comments about jerking off to it are way more cringe than anything.,
labcec9,t1_labbpxp,1dolx4j,lol imagine looking at a literal pro displaying their perfect brisket and feeling the need to regurgitate this line.,
labc5uq,t1_labbpxp,1dolx4j,Squeeze looked good tho! Not like the ones where they squeeze all the life out of it lol,
labtzxz,t1_labrxss,1dolx4j,"Was it the jiggle, the squeeze, or the oozing?",
lajm7zp,t1_laixv8o,1dolx4j,I’ll never understand why people care about the way others handle their own meat,
laawn1x,t1_laauzfa,1dolx4j,You’re right. Cut this one a little close but we have customers waiting and had to chop early. Still great though!,
laengqp,t1_laeksgb,1dolx4j,Did not know the squeeze was so controversial! I’ve learned a lot this post,
laexglq,t1_laeksgb,1dolx4j,I immediately back out of a video if I see them squeeze it. It's blood boiling imo,
laawrl1,t1_laau2hz,1dolx4j,14 hours on an ole Hickory smoker with lots of apple cider sprays,
laax20c,t1_laav7xg,1dolx4j,Ole Hickory smoker for 14 hours. Seasoning a bunch then season some more!,
lab8k8r,t1_laaxb28,1dolx4j,Didn’t get an exact weight on that piece but we get 10-15lbs hunks that cook down to about 7-12lbs,
lab0oo1,t1_laaz347,1dolx4j,I would also like to know. Looks amazing. ,
ladkds9,t1_ladgiu5,1dolx4j,😂😂😂,😂😂😂
ladkg2l,t1_ladgiu5,1dolx4j,She was smokin too,
laguly9,t1_lagdx3r,1dolx4j,I'm right here papa,
lahojmr,t1_lagwze6,1dolx4j,"Well, that did it for me. Logging off for the night.",
labldj7,t1_labl0e5,1dolx4j,Ones a much larger meat though.,
labu2mn,t1_labl0e5,1dolx4j,"So when you squeezed her, she oozed out?",
labp7xg,t1_labokwg,1dolx4j,That is indeed a cutting knife sir,
labrlep,t1_labokwg,1dolx4j,It looks like a victorinox cimeter,
lae2gex,t1_labokwg,1dolx4j,Cozzini,
