comment_id,parent_id,post_id,comment_body,emojis
lad21g7,t1_lacvkw4,1dolx4j,"It's not burnt, the color is from creosote from the smoke.  Briskets are smoked at very low temp for a very long time.  They can't be burned, but they can dry out.  The outside (technical term is ""bark"") and the inside taste awesome when done right.",
lad5gwc,t1_lacvkw4,1dolx4j,Brisket is the best form of meat imo.  In the Southern US it's perfected.,
laeec9v,t1_lae0gnm,1dolx4j,Idk either.  Too fatty for me but still want the juices.,
laejhii,t1_lae0gnm,1dolx4j,"That's the ""point"" end of the brisket and has a ton of fat.  It's also the piece that you make burnt ends out of.  

 The ""flat"" end is mostly meat with no internal fat and is somewhat dry.  It's generally sliced thin and served on a bun.",
lae8n9p,t1_lae0gnm,1dolx4j,It won’t stay that way long now that it’s cut before resting,
laeniqr,t1_laejwvb,1dolx4j,Well your mom was delicious,
lazkw8r,t1_lawmgw3,1dolx4j,This guy FUCKS,
lb0cqa7,t1_lawmgw3,1dolx4j,r/ihavesex,
labjggt,t1_lab78vu,1dolx4j,By leaving all that deckle fat in the middle. Looks great but your body wouldn’t be happy,
lab8rbv,t1_lab78vu,1dolx4j,It's quite moist.,
labgysp,t1_lab78vu,1dolx4j,Great googely moogely!,
labqfmr,t1_labognr,1dolx4j,Don’t know how much my husband would like that but I CAN feed you!,
ladst4c,t1_ladr8qd,1dolx4j,"I know that's called the ""bark"" and there's various recipies online that talk about how to do it nice. i'm pretty new to it and i've found that nobody's process works for me. so you may have to mix and match ideas to make it work. Some talk about the amount of time you have to wrap in pink paper, others talk about the spices or avoiding foil or steaming or managing the drippings. The the overall process seems to be wrapping the meat for a period of time within the process, but the exact numbers and tricks involved seem to just be not easily transferable to another smoker. Here's one to try   
[https://www.grillagrills.com/blog/what-is-bark-and-to-build-bark-on-brisket-ribs-pork-butts-and-more](https://www.grillagrills.com/blog/what-is-bark-and-to-build-bark-on-brisket-ribs-pork-butts-and-more)",
lai7wu2,t1_lahsmz5,1dolx4j,Drooooooolllll,
laetimt,t1_laeoa5w,1dolx4j,This particular cut is for sandwiches. I do agree it needs to rest longer but it is chopped and actually drained a bit so it doesn’t turn the bread into a soggy mess but I can assure you it is still extremely juice even after a tiny squeeze,
laaxv7c,t1_laaw19p,1dolx4j,"Would guess the squeeze is for the video, no point otherwise.",
laawwnt,t1_laaw19p,1dolx4j,I bet you’re fun at parties,
lab1l4b,t1_laaw19p,1dolx4j,The point grip is a viable method to slice softer meats and fish with longer knives where precision is required.  See sushi chefs. This obviously isn't a precision cut but the rest holds true.,
laazgp0,t1_laaw19p,1dolx4j,Serious question what’s wrong with how he or she handled the knife?,
laf616a,t1_laf4kgj,1dolx4j,"I thought about making another video doing everything wrong. Cut it all bad, squeeze the shit out of it, pour ketchup all over",
lal4oh2,t1_lal1v6k,1dolx4j,"I so badly wanted to reply with an Always Sunny ""She's mashing it"" meme :(",
laavq2z,t1_laassg2,1dolx4j,Couldn’t help myself…. Sooooo juicy,
latzi0d,t1_lartb3j,1dolx4j,Some people just don’t wanna be happy!,
layn4fd,t1_lartb3j,1dolx4j,"Basically, that’s what you are eating. They have their purpose.",
lb1g41h,t1_lb0pxj3,1dolx4j,"Whoa, watch out everyone. We have a bad ass in the chat.",
ladsfwn,t1_lacpty2,1dolx4j,Oh I fucking would,
ladnv7z,t1_ladn6cv,1dolx4j,Did it sound like [this](https://imgur.com/gallery/droooool-yt6levQ),
lad5ax0,t1_lad4ajk,1dolx4j,I'd go as far to argue that this didn't touch a smoker at all,
laeknbw,t1_lad4ajk,1dolx4j,"A smoke ring looks good, but it has no effect on the taste of the brisket.",
laidzt6,t1_lai8ng9,1dolx4j,Which europoor? British? Cause if so the flavors would kill you.,
laiio6g,t1_lai8ng9,1dolx4j,"They don’t properly trim the fat, go over to r/smoking for some proper brisket.",
laib5fg,t1_lai8ng9,1dolx4j,Using the term Europoor is so cringe.,
laplas8,t1_lai8ng9,1dolx4j,Don't knock it till you try it,
lapkztz,t1_lajljhh,1dolx4j,"A lot of commentors don't seem familiar with smoking meats and ""bark""

What you think is overcooked is just the salt pepper rub turning black from the smoke. It turns into this nice flavorful exterior that goes so well with how tender and juicy smoked meats are",
lab85ox,t1_lab6kb9,1dolx4j,They’re in a professional kitchen. Safe to say they most likely know what they’re doing.,
lab8qd4,t1_lab6kb9,1dolx4j,Either post a better looking brisket or shut the fuck up,
lab7x7t,t1_lab6kb9,1dolx4j,We literally have buckets of drippings at the end of a shift. The brisket is chopped for sandwiches and I assure you they are very juicy,
lab7zmi,t1_lab6kb9,1dolx4j,Bro literally squeezed it once,
lab77n3,t1_lab6kb9,1dolx4j,"Usually I would agree but I don’t think I’ve ever even come close to getting a brisket to look that juicy. Whatever they are doing, let em’ cook.",
lanty45,t1_lak0gsv,1dolx4j,Fitting username,
lay4f2l,t1_lak0gsv,1dolx4j,When you post a Pic of meat on reddit that isn't completely raw:,
lag1ws5,t1_lafs5xu,1dolx4j,"It’s not a steak, it’s smoked brisket. You cook it between 195-205°, pink is nowhere in the equation except a small ring around the edges.",
laga7qs,t1_lafs5xu,1dolx4j,My sweet summer child,
lag5cnx,t1_lafs5xu,1dolx4j,“Black Jeopardy is brought to you by…Well-Done Steaks! There better not be any pink in my steak!”,
lacvxf7,t1_lactmct,1dolx4j,You sound insane. Do you realize that?!,
lacuqh3,t1_lactmct,1dolx4j,"It's definitely not as pretty as other briskets you'll see on the Internet - the trim job isn't ideal, there's an absolutely massive hunk of fat in the top left of the cross section, I see no smoke ring, and it looks like it was rested for half hour tops, if at all, so I'm a bit like you. I'm sure it tastes great - but I'd pass on this one or at least cut all the deckle fat out before eating. All that being said - any brisket cook is intimidating as hell, massive props to any cook who attempts one!",
lacuelh,t1_lactmct,1dolx4j,"Not enough smoke, and almost too much liquid. Looks almost like it was baked.",
lad4vim,t1_lacydic,1dolx4j,My sperm went backwards in the vas deferens and created a black hole in my scrotum,
ladje82,t1_ladhk32,1dolx4j,"Ima bout to eat 10 lbs of meat in one sitting, health is not one of my concerns",
ladj167,t1_ladhk32,1dolx4j,"In a restaurant plastic is king, easy to sanitize for customers health.",
ladiicl,t1_ladhk32,1dolx4j,Plastic cutting boards are such a small part of the micro plastic problem and have little to no effect on customer health if used correctly,
ladsqmr,t1_ladhk32,1dolx4j,"dude is smoking a brisket,  pretty sure eating smoked meats like that increases risk of cancer. Esp the bark. So I've read.",
ladmqqd,t1_ladhk32,1dolx4j,Don’t wood ones absorb bacteria,
ladn5kb,t1_ladhk32,1dolx4j,"Pseudoscience. There is no proof that ""micro plastics"" are hurting anyone.

A huge amount of medical equipment uses plastic.",
lacue3e,t1_lacqsur,1dolx4j,"Oh my God I was thinking the same. 

It's a good cook, looks well smoked. 

But damn you gotta trim that fatty bit off before serving otherwise you're just serving tasteless lumps of fat. 

Spent 3 years in a barbecue restaurant in Texas. We'd have never served it like that. Yeah you lose some bark and some weight in trimming. But it's gotta be done.",
lacvb9u,t1_lacqsur,1dolx4j,"It's a rookie move, everyone learns at some point.",
lad6pyb,t1_lacqsur,1dolx4j,"What do you do with the deckle? Do you carve the fat out and leave it on, or separate it entirely?",
lac7cr5,t1_labxwtj,1dolx4j,This is fucking GREAT!,
ladn9g1,t1_ladmrha,1dolx4j,Thanks. Business name? My best friend lives there,
lqxgw1d,t1_ladmrha,1dolx4j,A whales vagina,
labrqd0,t1_labmazu,1dolx4j,It is the appropriate reaction.,
lacydtq,t1_lacnu08,1dolx4j,i agree lol,
ladkw3b,t1_lad6d98,1dolx4j,"You’re right, I’ve only been smoking for a year and am not the chef in charge of the recipes or smoker. But I think this is a good looking piece of meat and wanted to share. People are very critical on Reddit, trying not to take it personally. It’s not even me in the video, I’m the one filming.",
lagttwi,t1_lafs2fc,1dolx4j,Oh yeah? What kinda bbq sauce you gonna use or are you just gonna raw dog that shit!,
lacx2nv,t1_lacuw3u,1dolx4j,North North,
lad9lqx,t1_lad6hkb,1dolx4j,"""I should squeeze the stupid out of you!""",
lapkhh3,t1_ladkl2p,1dolx4j,That makes me feel better!  Makes sense why it was done this way then.,
laeny8o,t1_lacjo9z,1dolx4j,thats what the joke is refering to,
lafhy01,t1_lafgvn3,1dolx4j,"Thank you for sharing the city, that’s enough for me, I’m nowhere near it haha.",
lafx258,t1_lafgvn3,1dolx4j,Mind sending me a dm? I’m in SD and love me some good brisket. I tried going out to Flinn Springs on Father’s day but the family was too hungry to wait.,
lafjw4h,t1_lafgtwk,1dolx4j,"I have never cooked one of these so excuse my ignorance, but doesn't squeezing the juice out make it more dry and not as good to eat? Wouldn't you want to keep the juices in?",
lab7tdm,t1_lab6wxe,1dolx4j,Good bot,
lab8f31,t1_lab6wxe,1dolx4j,Very good bot! 🥰,🥰
lauug2n,t1_lap7jmc,1dolx4j,"Hi friend, I’m a friend too.",
lad5wy7,t1_lacur69,1dolx4j,I'll never understand the hate on gloves.  They keep the shit off your hands.  They keep you from contaminating the meat with your dirty grub hooks.  They're made for this.,
lad1r8s,t1_lad1ac7,1dolx4j,"That's basically what he did.  He walked out and all the players just stared at him while he silently did it.  Very little was said even by us players until we had a few seconds to soak in what just happened.  The whole time, he never said a word.",
lad2ply,t1_lad28vt,1dolx4j,"Unfortunately, I married a ""vegetarian"".  😉☹️",😉☹
laddzlb,t1_lad28vt,1dolx4j,How's she been? Tell her i said hey.,
lad666k,t1_lad28vt,1dolx4j,"Your neighbor a good ""cook"" or what?",
lad66di,t1_lad28vt,1dolx4j,Her boyfriend.    /jk 😉✌️,😉✌
lad6l55,t1_lad2il2,1dolx4j,🪳,🪳
lae22m2,t1_lae0nnf,1dolx4j,Wait till they find out most of the products that they consume take months to make and require people working at night.,
lajowg5,t1_laji6k4,1dolx4j,Nice.,
lax6y46,t1_lajgpax,1dolx4j,"I generally agree with that sentiment, but when it looks like this, you have a lot of wiggle room.",
lac28dp,t1_lac23xd,1dolx4j,"fortunately, i didn’t look to far into the comments.😅",😅
labitp3,t1_labcec9,1dolx4j,Imagine reading the oc and typing out what you just did thinking it would get traction,
labca4b,t1_labc5uq,1dolx4j,i would eat it and drink the juice😭 that’s how good it looks lol,😭
labuqjo,t1_labtzxz,1dolx4j,"Honestly, it was the squeeze and the ooze lmao",
laoc7ua,t1_lajm7zp,1dolx4j,Its hard for me to get off when you’re doing it wrong. Whip it out and let me show you how to really handle meat.,
lajx1t0,t1_lajm7zp,1dolx4j,Why do you care about others' opinions?,
labrntg,t1_laawn1x,1dolx4j,where might one find this establishment of yours?,
laawv6f,t1_laawn1x,1dolx4j,Do they pay extra for you to squeeze the shit out of it? Lol,
laaxpzm,t1_laawn1x,1dolx4j,People are paying for you to not do this.,
laewbh7,t1_laengqp,1dolx4j,"Yeah man I hate it when they squeeze it. This looks like they barely let it rest, which makes it dryer if you cut it too soon before letting the moisture soak back into meat, then the mf fucking squeezes the juice out while it's still hot AF. One dude did it awhile back and it started a trend to ""show how juicy it is"" they are just making it worse by doing that 😩",😩
lab97se,t1_laawrl1,1dolx4j,How often do you spray?,
laaxbkk,t1_laax20c,1dolx4j,"Temps, water pan?",
lab8nw0,t1_lab8k8r,1dolx4j,Looks perfect!,
lahdghm,t1_laguly9,1dolx4j,FIEVEL!!!,
lagw14j,t1_laguly9,1dolx4j,I meannn…meat is meat.,
lad0fhh,t1_labp7xg,1dolx4j,Looks like one. But if you look closely at the bottom of the knife just near the handle there’s a cut off where the metal is a little small.  This cut off is designed this way for safety measures. My company makes this knife. I was super curious if this was one of them,
lad3zfm,t1_lad21g7,1dolx4j,Thanks,
lago4sn,t1_laejhii,1dolx4j,"It also didnt seem to rest very long based on the steam, so a lot more juices would expel in that case.",
laev73b,t1_lae8n9p,1dolx4j,And fucking squeezed....,
laf6rp0,t1_laeniqr,1dolx4j,🤣🤣🤣🤣☠️☠️☠️☠️,🤣🤣🤣🤣☠☠☠☠
labpgu2,t1_labjggt,1dolx4j,Wait what? Is this fat that is typically trimmed at the start?,
lab9cl8,t1_lab8rbv,1dolx4j,I want someone to tell me how they got it so JUICY?!,
lafdm0f,t1_laetimt,1dolx4j,Not sure what it being for a sandwich has to do with resting your meat. But I know resting your meat longer will help your problems with soggy bread,
lab1dvc,t1_laawwnt,1dolx4j,"They quit inviting him after he kept trying to show everyone the ""right"" way to drink beer",
laazvu4,t1_laazgp0,1dolx4j,[deleted],
ladk6c5,t1_lad5ax0,1dolx4j,Lol,
ladglrg,t1_lad5ax0,1dolx4j,*gasp*,
ladbdvk,t1_lad5ax0,1dolx4j,They also cut the point and the flat in the same orientation wrecking the point...,
ladjenh,t1_lad5ax0,1dolx4j,Most likely an electric smoker.,
laiedxo,t1_laidzt6,1dolx4j,"Romanian, live in England, well traveled, can handle my spices :)

It's probably the congealed fat and how wet it is that's super unappetizing to me.",
laibate,t1_laib5fg,1dolx4j,I was using it sarcastically.,
labm2gu,t1_lab8qd4,1dolx4j,I wish I would have thought of this reply!,
lab96ns,t1_lab8qd4,1dolx4j,Someone’s angwy,
labc13f,t1_lab7x7t,1dolx4j,There's no way this can be true. How dare you counter this man's own original thought!,
lag2qof,t1_lag1ws5,1dolx4j,"I think it is a joke, reminds me of something juicy.",
lacw9kx,t1_lacuqh3,1dolx4j,"The smoke ring is the first thing I looked for.  This looks like a rotisserie brisket:

https://nexgrill.com/blogs/recipes/rotisserie-grilled-brisket",
lacx3sx,t1_lacuelh,1dolx4j,"Yeah I think it's the way theres so much liquid, kinda tips it over into some uncanny valley of food haha. I feel the same way about wagyu steak where the sheer amount of fat just looks so unpleasant to me even though it tastes good",
lad6lss,t1_lacuelh,1dolx4j,Probably wrapped for too long,
laek94g,t1_ladj167,1dolx4j,I'm pretty sure that you are not allowed to use wooden cutting boards in restaurants.,
ladm37s,t1_ladiicl,1dolx4j,I'm so tired of hearing about all the wrong things we're doing.,
ladzq9v,t1_ladmqqd,1dolx4j,"There are also wooden chopping boards made of end pieces of wood that resemble a checker board that hold less bacteria because of the angle of the grain and it being resistant to chipping, this is just what I’ve read about so I don’t physically know if this is true.",
ladppdc,t1_ladmqqd,1dolx4j,Last time I looked it up the worries about either type of cutting board wrt bacteria is pretty overstated. Less bacteria than you think ends up in those plastic grooves and wood tends to release a natural bacteria resistant substance when cut. I mean either way you have to keep it clean but it's less of a problem than people assume.,
ladzzcc,t1_ladmqqd,1dolx4j,"Man, people have been using wooden chopping boards for centuries.",
lacwfch,t1_lacue3e,1dolx4j,I think everyone that cooks brisket should have to be “classically” trained in Texas lol.,
ladbbt7,t1_lad6pyb,1dolx4j,"I leave it on you will get a Mohawk piece and I cut that down a bit, in KC bbq that is where the burnt ends come from.",
ladpwkm,t1_ladn9g1,1dolx4j,You can DM me. Don’t want to post my business linked to my account,
ladnv3t,t1_ladkw3b,1dolx4j,"I agree, reddit is harsh. It is a good looking brisket and it takes a lot of skill to even get to that point so it's rude of me to say they don't know much. But if your restaurant is serving it to paying customers it's disrespectful to reduce the quality of the food by cutting it before it's done resting and squeezing the juices out. Just my $0.02. If it was your own personal brisket I probably wouldn't have cared enough to say anything",
lagxd8i,t1_lagttwi,1dolx4j,Looks to me like she’s all ready no sauce needed,
lafndt4,t1_lafjw4h,1dolx4j,"The squeeze you saw in this clip is not going to dry out a fatty brisket, especially being served minutes later. This brisket was going into sandwiches so we actually cut it and put it on a draining pan to get some of the juice out. I’m sure I’ll get roasted for that on here but there is a puddle of liquid still at the bottom of a pan and it gets extremely hot and hard to handle and if it’s too juicy it makes the bollio we serve it on turn into slop.",
lad1z09,t1_lad1r8s,1dolx4j,Legend.,
lagibsj,t1_lad666k,1dolx4j,"Yep, she said his meat is just way juicier and tastier than mine. Hopefully I pick up a few tips from here to change her mind.",
labtebg,t1_labitp3,1dolx4j,"Imagine you were now dead, or had not lived before this moment. Now view the rest of your life as a bonus, and live it as nature directs.",
labvib3,t1_labuqjo,1dolx4j,Like a wet meat mop getting rung out and yet still not dry. I feel ya.,
lal5qnw,t1_lajx1t0,1dolx4j,mfs arguing about meat on reddit,
lak601s,t1_lajx1t0,1dolx4j,"I guess that would depend on the situation. Generally, no, but it isn’t always cut and dry like that. Why do you ask?",
laaxtqh,t1_laawv6f,1dolx4j,😂😂💀,😂😂💀
labgvvp,t1_laaxpzm,1dolx4j,"Cool, then they won’t get it today probably.",
laf08zx,t1_laewbh7,1dolx4j,Op made a comment saying it was for sandwiches so the less juicy the better. As they stated less soggy bread mess lol,
labug5j,t1_lab97se,1dolx4j,I too want to know. And also at what temp do you start?,
laazklh,t1_laaxbkk,1dolx4j,It’s on a rotating rack so no water pan.,
lab8qhm,t1_lab8nw0,1dolx4j,Thank you!,
lahdr4p,t1_lahdghm,1dolx4j,"Fievel Fievel, Mousekewitz",
lahakw5,t1_lagw14j,1dolx4j,Yall are insane 🤣,🤣
lacxhjl,t1_labpgu2,1dolx4j,Yeah - that top left part of the cross section is entirely fat and should have been cut out before cooking.,
lafxmej,t1_lafdm0f,1dolx4j,I assumed he doesn’t need it to be any more moist than it already is. Since it’s for sandwiches you won’t want brisket dripping with fat and juices and resting it longer would cause that more so.,
lab1y6e,t1_laazvu4,1dolx4j,Idkkk that’s a huge piece of meat to handle a knife how you’re describing,
ladkfi5,t1_ladbdvk,1dolx4j,It gets chopped for sandwiches so the cut doesn’t matter,
ladkbh8,t1_ladjenh,1dolx4j,You can go on my profile and see it being cooked on the rack… of an Ole Hickory smoker with real wood!,
laieik4,t1_laiedxo,1dolx4j,Sadness. I was really hoping for the English based food humor. Thanks for ruining it. Have a good dae.,
lajz6kw,t1_laiedxo,1dolx4j,"If you haven't had good Texas smoked brisket, you haven't lived.",
lajzj47,t1_laiedxo,1dolx4j,You don't seem to know what congealed means.,
lae0dwz,t1_ladm37s,1dolx4j,"""Oh no, I'm gonna die at 80 instead of 90."" Is how I view these things nowadays.",
lae13rp,t1_ladpwkm,1dolx4j,Understandable,
lafs43l,t1_lafndt4,1dolx4j,All makes sense now!  TIL 😃,😃
lag2c74,t1_lafndt4,1dolx4j,Next time time that correctly,
labzjc7,t1_labtebg,1dolx4j,"Imagine there's no heaven
It's easy if you try
No hell below us
Above us, only sky
Imagine all the people
Livin' for today
Ah
Imagine there's no countries
It isn't hard to do
Nothing to kill or die for
And no religion, too
Imagine all the people
Livin' life in peace
You
You may say I'm a dreamer
But I'm not the only one
I hope someday you'll join us
And the world will be as one
Imagine no possessions
I wonder if you can
No need for greed or hunger
A brotherhood of man
Imagine all the people
Sharing all the world
You
You may say I'm a dreamer
But I'm not the only one
I hope someday you'll join us
And the world will live as one",
lakccfc,t1_lak601s,1dolx4j,"How can you not see the comparison?? Your asking why that dude had an opinion on the meat, second dude asked why you have an opinion about the first dudes opinion and it went riiight over your head.",
lae7c3v,t1_lacxhjl,1dolx4j,Ah okay yeah that makes sense then.,
lag3m8x,t1_lafxmej,1dolx4j,"Resting your meat doesn’t cause more juices to come out, that’s just factually wrong. Why do you think you rest a steak? It’s to keep the juices inside. Meat 101.",
ladpau3,t1_ladkbh8,1dolx4j,"I wasn’t knocking your brisket, just explaining to the poster.

Same end result as electric, no smoke ring. I personally don’t care about a smoke ring but they look pretty. What I’m seeing is a brisket I would eat without a single complaint!",
laieos8,t1_laieik4,1dolx4j,I probably will knowing I won't be eating what looks like wet roadkill covered in fresh tarmac :),
laek19t,t1_lae0dwz,1dolx4j,"""maybe even 70, thank goodness!""",
lagbkcm,t1_lag2c74,1dolx4j,I’m not the one that loads them on. That’s a different shift,
lakepv2,t1_lakccfc,1dolx4j,"Dude, I was making a reference to other people meat. Reread what I wrote with innuendo in mind. Talk about going over heads. 

Also, to interpret it your way, how was my original comment an opinion? I stated no preference or judgement. At best it was a musing masked in in innuendo.",
lag4ix3,t1_lag3m8x,1dolx4j,I thought that’s what I said… he doesn’t rest it because he wants the juices to come out when he cuts it and isn’t worried about keeping the juices inside due to it being sandwich meat.,
lag5jd3,t1_lag4ix3,1dolx4j,"“You don’t want brisket dripping with fat and juices and resting it longer would cause that more so” 

Resting the meat doesn’t cause it to drip more juices.",
lag5rd4,t1_lag5jd3,1dolx4j,Compared to slicing it without resting and letting the juices drain out into a pan? Yes it would.,
lag8fxw,t1_lag5rd4,1dolx4j,"You’re advocating for dry brisket devoid of love, god help you.",
lag9qv1,t1_lag8fxw,1dolx4j,I’m just trying to explain to you what this guy was saying. Did you read his post?,
lagd0os,t1_lag9qv1,1dolx4j,"If you want dry meat go ahead and cut it early. If he’s draining it either way I’d go with properly rested meat. Not sure why you are continuing to advocate for dry meat but you do you. He said he drains the meat, why wouldn’t you properly rest it if you are going to drain the meat either way? 100% well rested meat is better, I don’t care what you say, you are wrong.",
